times_suggested	from_opus	mod	from	via	to_pillar	motif	consensus	verdicts	hook
2	False	exposure	exposure:camera / film (exploration capture)	supplementaries:weathered_map (map art + weathering)	economy	M-33	ACCEPT	{'ACCEPT': 1, 'REJECT': 1}	A player with a good camera and the darkroom setup offers commissioned photography — expedition portraits, colony docume
1	False	exposure	exposure:black_and_white_film (silver-halide chemistry implied) → Ars Nouveau imbuement as a "light-reactive" catalyst	ars_nouveau:imbuement	magic	M-10	REJECT	{'REJECT': 1}	tone clash — film chemistry as arcane catalyst is a stretch that a player wouldn't find intuitive. The photography vibe 
1	False	exposure	exposure:lightroom (block) + developed photographs	MineColonies quest/reward tie (photographs as quest reward items or colony archive flavor)	economy		REJECT	{'REJECT': 1}	No motif covers a photograph-as-quest-reward path; the "no-motif" rule applies. Surface for Gate-0 review only if the ma
1	False	exposure	exposure:photograph (printed photograph of a location/scene)	loot-seed (placing photographs as decorative "evidence" drops in structure chests)	survival	M-02	REJECT	{'REJECT': 1}	Photographs are player-generated, not world-generated — seeding them in structure loot would require pre-generated image
1	False	exposure	exposure:film (silver halide — thematic)	create_new_age:energising	create	M-17	REJECT	{'REJECT': 1}	"Energised film" has no real thematic coherent role — darkroom chemistry and electrical charging are unrelated processes
1	False	exposure	exposure black_and_white_film (silver halide chemistry implied)	create:mixing	create	M-12	REJECT	{'REJECT': 1}	Film chemistry through Create mixing is an interesting idea but the dossier already flags Create automation (sequenced_a
1	False	exposure	exposure:black_and_white_film (film cartridge)	create:pressing	create	M-20	REJECT	{'REJECT': 1}	M-20 is the deploy-application upgrade seam, not a flat pressing step. Film cartridges are everyday craft items; pressin
1	False	exposure	exposure:lightroom (deco/workshop block)	loot-seed (structure loot injection)	survival		REJECT	{'REJECT': 1}	loot=yes but no coherent second-system hook — its loot tables likely contain film/camera parts which don't advance any n
1	False	exposure	exposure:black_and_white_film (consumable film stock, crafted from silver compound)	create:milling (mill a silver ore/compound to produce photographic silver halide — makes film production a Create processing step)	create	M-03	REJECT	{'REJECT': 1}	film is already produced via vanilla crafting and the mod's Create integration (sequenced_assembly develops it); adding 
1	False	exposure	exposure:camera (craft item, gold + glass + precision parts)	create:mechanical_crafting (precision optics assembly — lens/shutter require Create-level fabrication)	create	M-05	ACCEPT	{'ACCEPT': 1}	a camera with adjustable focal length and shutter isn't assembled at a bench — precision optics need the mechanical craf
1	False	exposure	exposure:black_and_white_film	create:crushing	create	M-04	REJECT	{'REJECT': 1}	Crushing film back to silver dust is thematically grotesque (you destroy the exposed/unexposed film for a trace resource
1	False	exposure	exposure:camera / exposure:black_and_white_film	create:sequenced_assembly (film development) → seasonal light condition	survival	M-16	REJECT	{'REJECT': 1}	Serene Seasons doesn't gate film chemistry; there's no mechanical hook where season affects developing. The existing Cre
1	False	exposure	exposure:album	loot-seed into t_and_t / moog's structures loot	survival	M-02	REJECT	{'REJECT': 1}	album is a blank keepsake item players fill themselves; seeding it into loot tables doesn't make structural sense — it w
1	False	exposure	`exposure:photograph_copying`	player service	economy	M-33	REJECT	{'REJECT': 1}	photograph copying is a darkroom utility; a player could charge for copies, but there's no emergent demand signal (photo
1	False	exposure	exposure film (black_and_white_film / color) as a silver-halide chemistry input	create:mixing (silver dust + gelatin emulsion → film)	create	M-29	ACCEPT	{'ACCEPT': 1}	film emulsion requires processed silver — Create mills/mixes silver ore into photographic chemistry; a Create production
1	False	exposure	film development automation	create:sequenced_assembly (already inbound)			REJECT	{'REJECT': 1}	existing inbound weave — the Create anchor is already established via sequenced_assembly; no new edge needed
1	False	exposure	exposure (loot=yes)	loot-seed — seed exposure:black_and_white_film rolls into structure loot tables (dungeon caches, ship holds)	survival	M-02	ACCEPT	{'ACCEPT': 1}	Rummaging through a dungeon cache turns up an old film canister — the explorer and the photographer overlap.
1	False	exposure	exposure:camera_gold	ars_nouveau:imbuement (alchemical lens enhancement)	magic	M-29	REJECT	{'REJECT': 1}	theme stretch — alchemy improving camera optics requires a "this is the kind of world we're in" explanation; the connect
1	False	exposure	exposure:black_and_white_film (consumable per 16 shots)	M-26 consumption sink (film is spent with every shoot)	survival	M-26	ACCEPT	{'ACCEPT': 1}	film runs out — the photographer is always the chemist's best customer
1	False	exposure	exposure photographs as a KubeJS-gated progression unlock (a photograph of a specific landmark/boss required to advance a recipe chain)	KubeJS custom recipe gate	create	M-15	REJECT	{'REJECT': 1}	M-15 requires a boss drop as the gate item; a photograph is not a drop; the "proof of exploration" angle isn't implement
1	False	exposure	occultism silver + create:mixing	create:mixing → silver chemical emulsion → exposure:film_developing	magic	M-29	ACCEPT	{'ACCEPT': 1}	True photographic emulsion needs real silver salts — the Occultism lab's silver feeds a Create chemical mixer that produ
1	False	exposure	exposure:album (photograph collection)	bountiful decree (bounty objective: submit N developed photographs of a region)	economy	M-37	REJECT	{'REJECT': 1}	M-37 is research/knowledge gate (unlocking a recipe by knowledge), not a bounty objective; the correct motif for a bount
1	False	exposure	occultism silver compound (the real silver in the pack — checked against galosphere gotcha; galosphere silver_ingot is palladium, so occultism holds the silver)	create:mixing (silver dust + exposure chemistry → photographic silver halide emulsion → exposure:black_and_white_film)	magic	M-29	ACCEPT	{'ACCEPT': 1}	real B&W photography needs silver halide — the pack's only true silver is occultism's; making film emulsion from occulti
1	False	exposure	occultism:silver_ore / silver dust (the pack's real silver, per CLAUDE.md gotcha — galosphere silver_ingot is palladium, NOT silver)	create:milling → create:mixing → exposure:black_and_white_film	magic	M-29	ACCEPT	{'ACCEPT': 1}	B&W photography needs silver halide — the pack's only true silver is Occultism's; a Create photographer must source it f
14	True	mcwdoors	mcwdoors iron/metal door variants	create:crushing	create	M-04	ACCEPT	{'ACCEPT': 12, 'REJECT': 10}	a demolition grinder reduces an unwanted iron door back to scrap — sensible workshop recycle, lossy
5	True	mcwdoors	metal/iron door + iron-framed glass-door variants	create:crushing	create	M-04	ACCEPT	{'REJECT': 2, 'ACCEPT': 3}	only the iron variants have a coherent crush target (nuggets+xp), and it's lossy filler; per dossier decoration is alrea
2	False	mcwdoors	wooden door variants	create:crushing	create	M-04	REJECT	{'REJECT': 2}	Vanilla planks already recycle fine; adding ~250 wooden door entries is noise with negligible loop contribution. Only me
2	False	mcwdoors	iron/metal-containing door variants (modern-style and iron-framed)	create:crushing	create	M-04	ACCEPT	{'ACCEPT': 1, 'REJECT': 1}	an unused iron modern door crushes back to iron nuggets and scrap — keeps the entire deco-metal family in the same lossy
1	False	mcwdoors	mcwdoors metal door variants	create:mechanical_crafting	create	M-20	REJECT	{'REJECT': 1}	the existing vanilla crafting table path is light and adequate; routing door assembly through mechanical_crafting adds c
1	False	mcwdoors	mcwdoors:*_modern_door / *_glass_door (iron + glass)	create:mechanical_crafting	create	M-05	REJECT	{'REJECT': 1}	power-tier mismatch — a decorative door does not justify mechanical-crafting gating (M-05 is for flagship machines); app
1	False	mcwdoors	mcwdoors:*_modern_door / *_metal variants (iron/steel)	create:crushing	create	M-04	ACCEPT	{'ACCEPT': 1}	A salvaged iron door runs through the crusher and comes back as iron nuggets + scrap — the same logic as any metal deco;
1	False	mcwdoors	mcwdoors:iron_* doors / *_modern_door / metal-adjacent door variants	create:crushing → M-04 (metal door variants crush back to iron nuggets + xp nugget; lossy)	create	M-04	ACCEPT	{'ACCEPT': 1}	surplus metal doors from a colonist build aren't waste — crush them back into the iron/Create loop; the deco set becomes
1	False	mcwdoors	mcwdoors:*_stable_door / *_barn_door (wood variants)	create:cutting (mechanical saw produces the planked-panel door shapes from bulk wood)	create	M-12	ACCEPT	{'ACCEPT': 1}	a woodworking belt can stamp out barn doors automatically — giving the builder palette a route through Create automation
1	False	mcwdoors	wood door variants (all non-metal mcwdoors doors)	create:crushing	create	M-04	REJECT	{'REJECT': 1}	wooden doors crushing to planks/sticks adds no meaningful Create feedstock (wood is abundant, the recycled output has no
1	False	mcwdoors	mcwdoors:*_iron_door / metal-family variants	create:crushing	create	M-04	ACCEPT	{'ACCEPT': 1}	a metal door stripped of its frame crushes back to scrap — the same recycling logic that applies to any fabricated metal
1	False	mcwdoors	mcwdoors:*_barn_door / *_stable_door / wooden families	create:crushing	create	M-04	REJECT	{'REJECT': 1}	wooden door variants have negligible raw-material value; crushing wood deco to sawdust/sticks is mechanically thin and a
1	False	mcwdoors	metal door variants → create:crushing back to iron nuggets + xp nugget	create:crushing	create	M-04	ACCEPT	{'ACCEPT': 1, 'REJECT': 1}	a demolished iron door feeds the crusher — deco is part of the Create material loop, not a dead end. Scope: metal/iron v
1	True	mcwdoors	mcwdoors:*_glass_door / metal door variants	create:crushing recycle	create	M-04	REJECT	{'REJECT': 1}	everyday deco-recycle, too thin to author alone; only fold into a pack-wide deco-crush family pass. Decoration is a sanc
1	False	mcwdoors	mcwdoors:*_modern_door / garage variants	M-28 colony route — Builder hut places MCW doors in colony structures	economy	M-28	ACCEPT	{'ACCEPT': 1}	colony buildings use door variants; a colony runner is the colony-locked route to varied doors in bulk without hand-craf
1	False	mcwdoors	mcwdoors wood variants as "any door is a door"	bare "it's wood"		M-04	REJECT	{'REJECT': 1}	no method routing; wood doors have no cross-system hook that earns an anchor — the metal-crush edge (M-04) covers the on
1	False	mcwdoors	metal-variant doors (iron/steel frame doors)	create:crushing back to nuggets + xp_nugget	create	M-04	ACCEPT	{'ACCEPT': 1}	a misplaced or scrapped reinforced door gives back its metal at a small loss — Create doesn't waste, it recycles, and 26
1	False	mcwdoors	"wooden door variants as special crafting target"			M-04	REJECT	{'REJECT': 1}	250 wooden door variants already exist in vanilla style; routing them through a special process has no mechanical payoff
1	False	mcwdoors	mcwdoors:*_iron_*_door / *_metal_*_door variants	create:crushing	create	M-04	ACCEPT	{'ACCEPT': 1}	metal-frame doors crush back to iron nuggets + an XP nugget (lossy) — standard deco-recycle weave that links the door pa
1	False	mcwdoors	mcwdoors:*_barn_door / stable_door	farmersdelight:cutting (knife on wood planks)	survival	M-12	REJECT	{'REJECT': 1}	cutting a door on a cutting board makes no sense — the cutting method is for food prep, not woodworking; theme clash dis
1	False	mcwdoors	nether/mystic door variants	crafting requiring magic reagent	magic		REJECT	{'REJECT': 1}	gating a cosmetic door variant behind a magic reagent violates the basic-component cost rule (depth scales with power — 
1	False	mcwdoors	exotic wood logs	create:cutting → wooden door blanks → crafted into mcwdoors wooden doors	create	M-12	REJECT	{'REJECT': 1}	this routes Create cutting into wooden door blanks as an intermediate, but mcwdoors wooden doors are already craftable d
1	False	mcwdoors	mcwdoors japanese / mystic door variants	create:cutting	create	M-12	REJECT	{'REJECT': 1}	cutting a deco door into a smaller piece is not a meaningful production step — Create's cutting is for converting raw ma
1	False	mcwdoors	wooden door variants (barn/cottage/stable/etc.)	create:cutting	create	M-12	ACCEPT	{'ACCEPT': 1}	a Create saw mills planks into Macaw's wooden door variants — a carpenter automates the full door palette on a belt, tur
1	False	mcwdoors	mcwdoors:*_barn_door / *_stable_door / *_cottage_door (wood variant families — the "rustic" set)	create:cutting (mechanical saw mills rough planks into the pre-cut door shapes, automating the door palette for a colony builder)	create	M-12	ACCEPT	{'ACCEPT': 1}	the colony Builder hut needs 40 barn doors for the new Stable schematic — feed planks through the saw, not through a cra
1	False	mcwdoors	mcwdoors:*_barn_door / *_cottage_door (wood families used in colony stable/cottage schematics)	minecolonies colony Builder request	economy	M-28	ACCEPT	{'ACCEPT': 1}	a MineColonies Builder hut constructing a Stable schematic requests 40 barn doors — the colony pull makes a door-crafter
6	False	minecolonies_tweaks	c:crops/* unified tags (corn, rice, soybean, tomato, etc.)	create:milling	create	M-12	ACCEPT	{'ACCEPT': 5, 'REJECT': 1}	the minecolonies_tweaks unified crop tags mean a single Create milling recipe covers ALL modded grain variants — the tag
2	False	minecolonies_tweaks	minecolonies_tweaks:inventoryscroll / copyscroll (handheld colony-storage tools)	recipe (gate the scrolls on Create brass — M-05 native-method gating: printed brass circuit / brass sheet as a scroll component, reflecting precision colonial logistics)	create	M-05	ACCEPT	{'ACCEPT': 2}	colony logistics scrolls that manage hundreds of items of colony inventory should cost real fabricated precision parts —
1	False	minecolonies_tweaks	c:crops/rice or c:crops/corn	farmersdelight:cooking or create:mixing	create	M-12	REJECT	{'REJECT': 1}	redundant with the milling ACCEPT above; both M-12 rows serve the same pillar — one clean link is enough, two identical-
1	False	minecolonies_tweaks	minecolonies_tweaks scroll items (inventoryscroll / copyscroll)	create:mechanical_crafting or recipe	create	M-05	REJECT	{'REJECT': 1}	the scrolls are handheld colony management tools, not machines or power components. Routing them through Create's mechan
1	False	minecolonies_tweaks	minecolonies_tweaks c:crops/c:foods tag surface	(enables other weaves, not itself a weave node)	n/a		REJECT	{'REJECT': 1}	the mod's real contribution is the unified tag set it injects — it is the *enabler* of food-web weaves (letting extradel
1	False	minecolonies_tweaks	minecolonies_tweaks:inventoryscroll items	any magic/Create method	any		REJECT	{'REJECT': 1}	Inventory scrolls are colony administrative tools (teleport-link to colony storage); no magic or Create method has a sen
1	False	minecolonies_tweaks	minecolonies_tweaks:inventoryscroll	minecolonies_tweaks:component_merge_shapeless	survival	M-26	ACCEPT	{'ACCEPT': 1}	the inventory/copy scrolls are consumed (used up) when interacting with colony storage, making them a repeating consumab
1	False	minecolonies_tweaks	minecolonies_tweaks as a pure support/QoL role	—		M-12	REJECT	{'REJECT': 1}	While the tag-unification role is real, it is infrastructure, not a weavable item node — the accepted M-12 annotation is
1	False	minecolonies_tweaks	c:crops/* / c:foods/* tag unification	tag injection (passive)	survival	M-26	ACCEPT	{'ACCEPT': 1}	By harmonizing modded crop tags (corn, rice, soybean, tomato, etc.) under c:crops/*, this mod enables the consumption-si
1	False	minecolonies_tweaks	inventoryscroll / copyscroll	colony workflow	economy	M-28	ACCEPT	{'ACCEPT': 1}	Scrolls streamline colony-inventory management — a colony operator uses them to move resources between colony storage an
1	False	minecolonies_tweaks	minecolonies_tweaks:component_merge_shapeless recipe type	component_merge_shapeless	create	M-29	ACCEPT	{'ACCEPT': 1}	The component-merge recipe type can fuse a colony-produced scroll with a Create-brass component (or a magic reagent) to 
1	False	minecolonies_tweaks	minecolonies_tweaks:component_merge_shapeless recipe type	used as the delivery for colony resource merging	economy	M-28	REJECT	{'REJECT': 1}	component_merge_shapeless is an internal colony-QoL operation (merging partial stacks for colony requests), not a cross-
1	False	minecolonies_tweaks	minecolonies_tweaks:inventoryscroll (colony storage access tool)	colony demand → survival	survival	M-28	ACCEPT	{'ACCEPT': 1}	the inventory scroll (and copy scroll) is the quality-of-life object that a colony player specializes around — it embodi
1	False	minecolonies_tweaks	minecolonies_tweaks c:tags (c:crops/rice, c:crops/corn, etc.)	create:milling / farmersdelight:cooking	create	M-12	ACCEPT	{'ACCEPT': 1}	the unified crop tags this mod injects let Create milling and FD cooking target any modded rice/corn/tomato/cabbage by t
1	False	minecolonies_tweaks	minecolonies_tweaks c:crops/* tags (corn, rice, soybean, tomato, etc.)	create:milling → minecolonies colony requests	economy	M-28	ACCEPT	{'ACCEPT': 1}	The unified c:crops/corn, c:crops/rice tags (provided by MC_Tweaks) let MineColonies colony farm-huts request these crop
1	False	minecolonies_tweaks	minecolonies_tweaks c:foods/* tags	farmersdelight:cooking → diet system	survival	M-12	ACCEPT	{'ACCEPT': 1}	The harmonized c:foods/corn, c:foods/rice etc. tags let Farmer's Delight cooking recipes accept any modded crop under th
1	False	minecolonies_tweaks	minecolonies_tweaks:inventoryscroll / copyscroll (colony-storage access tool)	recipe (M-33 service-for-hire framing)	economy	M-33	ACCEPT	{'ACCEPT': 1}	a colony administrator running a scroll-stocked storefront performs *labor* for other players — remote stock-checking an
29	False	rottencreatures	rottencreatures:frozen_rotten_flesh (Frostbitten zombie drop)	occultism:spirit_fire	magic	M-11	ACCEPT	{'ACCEPT': 29}	Flesh from a zombie frozen in powder snow carries a cold-touched essence; burning it in spirit-fire cleanses the necroti
22	False	rottencreatures	rottencreatures:magma_rotten_flesh (magma-variant zombie drop)	occultism:spirit_fire	magic	M-11	ACCEPT	{'ACCEPT': 21, 'REJECT': 1}	Flesh infused with magma heat and the Immortal's lightning are already halfway to a fire/lightning spirit; spirit-fire i
20	False	rottencreatures	rottencreatures:corrupted_wart	ars_nouveau:imbuement	magic	M-10	ACCEPT	{'ACCEPT': 18, 'REJECT': 2}	Corrupted wart (a twisted nether plant analog from undead mobs) dissolves well in arcane imbuement as a low-cost catalys
15	False	rottencreatures	rottencreatures:frozen_rotten_flesh	create:haunting	create	M-19	REJECT	{'REJECT': 10, 'ACCEPT': 5}	Haunting is soul-fire themed; frozen flesh has an ice/cold vibe that tonally clashes with soul-fire transmutation. The s
11	False	rottencreatures	rottencreatures:corrupted_wart (generic undead-variant drop)	ars_nouveau:crush	magic	M-02	ACCEPT	{'ACCEPT': 10, 'REJECT': 1}	Corrupted wart is exactly the kind of twisted organic byproduct an Ars Nouveau crush processes into a raw magical dust o
10	False	rottencreatures	rottencreatures:magma_rotten_flesh (Immortal / fire-variant drop)	create:haunting	create	M-19	ACCEPT	{'ACCEPT': 10}	Soul-fire haunting of magma-tainted flesh — the seared remnant of a lightning-undead passes through Create's haunting ki
8	False	rottencreatures	rottencreatures:corrupted_wart	occultism:spirit_fire	magic	M-11	ACCEPT	{'ACCEPT': 8}	a corrupted undead plant-wart transmuting into a dark essence through spirit fire is exactly the "kill-loot → arcane inp
6	False	rottencreatures	rottencreatures:frozen_rotten_flesh	create:crushing	create	M-02	REJECT	{'REJECT': 6, 'ACCEPT': 1}	crushing rotten flesh is mechanically coherent but the output would be trivially cheap bone meal / gravel — no meaningfu
5	False	rottencreatures	rottencreatures mob heads (decorative blocks)	create:crushing	create	M-04	REJECT	{'REJECT': 5}	Mob-head blocks are decorative trophies; crushing them back to bone meal / skull dust is technically M-04, but the dossi
5	False	rottencreatures	rottencreatures:treasure_chest (pirate chest loot)	loot-seed	economy	M-34	ACCEPT	{'ACCEPT': 4, 'REJECT': 1}	Dead Beard's pirate treasure chest is thematically a trade-route prize — seeding it with a Numismatics rare coin denomin
4	False	rottencreatures	rottencreatures themed drops (frozen/magma flesh)	create:haunting	create	M-19	REJECT	{'REJECT': 2, 'ACCEPT': 2}	haunting turns items into soul/spirit outputs via soul-fire; frozen flesh → haunting makes thematic sense but the M-19 s
4	False	rottencreatures	rottencreatures:frozen_rotten_flesh	occultism:spirit_fire	magic	M-02	ACCEPT	{'ACCEPT': 4}	cold-preserved flesh burned in spirit fire yields a chilled essence — undead cold biome drops feed the occult lab
4	False	rottencreatures	rottencreatures mob drops (boss-tier variants: Dead Beard, Immortal)	loot-seed + boss drop as gate item	economy	M-34	ACCEPT	{'ACCEPT': 4}	Dead Beard and the Immortal storm-lich are true bosses; their rare drops are farmed by the combat specialist and traded 
3	False	rottencreatures	rottencreatures:frozen_rotten_flesh	ars_nouveau:imbuement	magic	M-10	ACCEPT	{'REJECT': 1, 'ACCEPT': 2}	frozen rotten flesh is a low-rarity everyday drop; M-10 explicitly forbids gating basic components behind infusion; the 
2	False	rottencreatures	rottencreatures mob drops (any)	create:haunting	create	M-02	REJECT	{'REJECT': 1, 'ACCEPT': 1}	haunting already covers vanilla rotten flesh → soul sand type transmutations; routing rottencreatures' unique drops thro
2	False	rottencreatures	rottencreatures:immortal drop (zap-type)	create_new_age:energising	create	M-17	ACCEPT	{'ACCEPT': 1, 'REJECT': 1}	The Immortal zombie is electric — its lightning-infused drop energised in a Create New Age station produces a charged co
2	False	rottencreatures	rottencreatures:corrupted_wart	create:crushing	create	M-02	ACCEPT	{'ACCEPT': 1, 'REJECT': 1}	crushed corrupted wart yields a nether-spore dust useful as a dye or chemical intermediate — Create already crushes wart
1	False	rottencreatures	frozen_rotten_flesh (Frostbitten zombie drop — cold-biome variant)	occultism:spirit_fire transmutation into a cryomantic reagent	magic	M-11	ACCEPT	{'ACCEPT': 1}	undead flesh flash-frozen in powder snow carries spectral cold — spirit fire extracts that essence into an arcane cataly
1	False	rottencreatures	corrupted_wart (swamp-zombie drop)	ars_nouveau:crush — grinding corrupted_wart into a tainted powder used in Ars rituals	magic	M-02	ACCEPT	{'ACCEPT': 1}	the wart that blooms on swamp undead is already halfway magical; crushing it yields a hex-powder catalyst; the Swampy zo
1	False	rottencreatures	magma_rotten_flesh (Burned/magma zombie drop)	create:haunting — haunting magma flesh on a soul campfire yields an infused smoldering reagent	create	M-19	ACCEPT	{'ACCEPT': 1}	soul-fire doesn't just roast it — it coaxes the residual heat-spirit out; the Create haunting method gives mob combat a 
1	False	rottencreatures	frozen_rotten_flesh / magma_rotten_flesh	create:crushing into byproducts (rotten dust + essence nugget)	create	M-02	REJECT	{'REJECT': 1}	M-19 haunting is the cleaner Create bridge for these biome-themed drops (soul-fire ≠ crushing mechanically); adding crus
1	False	rottencreatures	rottencreatures:immortal_head (storm-lich mob head)	create:haunting	create	M-19	ACCEPT	{'ACCEPT': 1}	The Immortal draws on lightning; passing its head through Create haunting (soul-fire) makes thematic sense — lightning-c
1	True	rottencreatures	themed undead drops (frozen_rotten_flesh, magma_rotten_flesh, corrupted_wart)	occultism:spirit_fire / ars_nouveau:crush transmutation	magic	M-11	ACCEPT	{'ACCEPT': 1}	a storm-lich's corrupted wart and frozen flesh aren't trash — spirit-fire them into arcane essence; themed undead loot b
1	True	rottencreatures	themed undead drops (rotten flesh variants)	create:haunting (soul-fire) into a soul/byproduct	create	M-19	ACCEPT	{'ACCEPT': 1}	haunt the rotten flesh on the Create line and pull a soul output — the bestiary feeds the soul seam, not just the kill c
1	True	rottencreatures	decorative mob heads	create:crushing recycle	create	M-04	REJECT	{'REJECT': 1}	trophy heads are display deco; crushing a unique mob head back to flesh/gravel is incoherent (no player nods at "grind t
1	False	rottencreatures		create_dragons_plus:freezing	create	M-12	ACCEPT	{'ACCEPT': 1}	the frozen corpse's cryo-saturated flesh feeds the freezing method — cold mob → cold machine input; no prior pass propos
1	False	rottencreatures		create:haunting — haunt mob heads into soul-saturated decorative variants (soul-head deco?)	create	M-19	ACCEPT	{'ACCEPT': 1}	the undead head in soul fire transforms — a Create-native transmutation that gives the heads a secondary use without tri
1	False	rottencreatures	rottencreatures:treasure_chest (Dead Beard drop)	loot-seed	economy	M-08	ACCEPT	{'ACCEPT': 1}	a pirate captain's chest should contain coin — seed a small Numismatics coin drop into Dead Beard's treasure_chest loot 
1	False	rottencreatures	rottencreatures:mob_heads (decorative blocks)	create:crushing	create	M-04	REJECT	{'REJECT': 1}	mob heads are trophies/decoration, not deco blocks from a metal/stone set — M-04 is for metal/stone deco recycling; crus
