times_suggested	from_opus	mod	from	via	to_pillar	motif	consensus	verdicts	hook
1	False	drones	drones:drill block (ability component)	aeronautics logistics arm (drone as scout/miner)	aeronautics	M-24	REJECT	{'REJECT': 1}	drones already anchors aeronautics; the drill-ability is internal to that anchor, not a new cross-system edge.
1	False	drones	drones:controller	minecolonies research unlock	economy	M-37	ACCEPT	{'ACCEPT': 1}	gating the drone controller assembly behind a MineColonies research node (Engineering or equivalent) means advanced pers
1	False	drones	drones:pocket_drone (equipped item)	bare sell			REJECT	{'REJECT': 1}	ambient endpoint
1	False	drones	drones drill-drone	createoreexcavation integration	create	M-05	REJECT	{'REJECT': 1}	createoreexcavation:drilling is a Create Ore Excavation method — a drill-drone body does not interact with that method m
1	False	drones	drones:drill (combat/mining ability block)	thematic stretch	survival		REJECT	{'REJECT': 1}	the drill-drone is a QoL assist tool, not a survival-pressure response; forcing a danger/survival anchor onto it is cont
1	False	drones	drones:drill ability block	aeronautics logistics	economy	M-31	ACCEPT	{'ACCEPT': 1}	A drill-drone auto-mines for its owner while they manage other tasks — a logistics drone is bulk-goods handling at small
1	False	drones	drones:drill (mining ability block for drone body)	create:crushing byproduct	create	M-32	ACCEPT	{'ACCEPT': 1}	a drill-drone assists mining and generates an ore-dust byproduct stream that feeds the Create crusher chain — drone-assi
1	False	drones	drones:pocket_drone (equipped personal automation)	aeronautics logistics	aeronautics	M-29	REJECT	{'REJECT': 1}	M-29 requires a cross-route production dependency (recipe demands input from a different production route) — the drone b
1	False	drones	drones:pocket_drone (personal automation tool)	MineColonies colony research	economy	M-37	ACCEPT	{'ACCEPT': 1}	an Engineer-tier MineColonies research unlocks the drone controller schematic — the assembly knowledge isn't tradeable (
1	False	drones	drones:pocket_drone (equipped item)	colony MineColonies delivery/logistics — assign a drone as a delivery courier for a colony route (the drone physically moves goods between colony buildings)	economy	M-28	ACCEPT	{'ACCEPT': 1}	the colony requisitions pocket drones for inter-district deliveries — you supply the drone, the colony uses it.
1	False	drones	drones:pocket_drone	aeronautics logistics arm — a drone as a short-range cargo pod (Aeronautics covers long-haul; drones cover last-meter delivery)	aeronautics	M-31	ACCEPT	{'ACCEPT': 1}	the airship unloads at the dock; the drone carries parcels from dock to doorstep — logistics hand-off at scale.
1	False	drones	drones:drill block (ability slot for the drone)	create:mechanical_crafting	create	M-05	ACCEPT	{'ACCEPT': 1}	the drill's design fits the Create mechanical-crafting table (geared drill assembly matching Create's industrial aesthet
1	False	drones	drones:pocket_drone (drill variant)	aeronautics logistics	economy	M-29	ACCEPT	{'ACCEPT': 1}	a drill-drone (beacon = combat, lodestone = magnet pickup, drill = auto-mining) can feed extracted ore directly into a b
1	False	drones	drones:wood_rotor	recipe (crafting)	create		REJECT	{'REJECT': 1}	wood rotors are intentionally entry-level; gating them behind a Create method would violate the "never gate basic/everyd
1	False	drones	drones:controller (assembly controller, the drone brain)	create:sequenced_assembly requiring an irons_spellbooks:arcane_essence (or ars_nouveau:source_gem fragment) as a mid-sequence input	magic	M-29	ACCEPT	{'ACCEPT': 1}	a drone's guidance circuit needs a whisper of arcane attunement to track its owner — the Create engineer must buy that e
1	False	drones	drones:drill + drones:beacon (combat ability blocks that can be mounted in drone bodies)	emergent trade — a combat-drone specialist builds beacon-ability drones and deploys them in other players' claimed areas as hired defense; the drone IS the service good	economy	M-33	ACCEPT	{'ACCEPT': 1}	a player who doesn't want to fight buys a beacon-drone from the specialist and positions it at their base — the automato
17	False	gamediscs	gamediscs:processor / gamediscs:redstone_circuit	create:mechanical_crafting	create	M-05	ACCEPT	{'REJECT': 8, 'ACCEPT': 9}	M-05 is for a mod's own *flagship* item built in its own machine gated on Create parts — the console's processor isn't g
5	False	gamediscs	gamediscs:processor	create:pressing (pressed circuit board)	create	M-12	REJECT	{'REJECT': 4, 'ACCEPT': 1}	the processor is a custom item, not a crop or raw material; pressing a "processor" is thematically wrong (pressing is fo
2	False	gamediscs	gamediscs:gaming_console	recipe (create:sequenced_assembly multi-step)	create	M-06	REJECT	{'REJECT': 2}	M-06 is reserved for *endgame* multi-step keystones; the gaming console is a novelty/downtime item, not an endgame unloc
2	False	gamediscs	gamediscs:gaming_console components (processor, redstone_circuit, display, control_pad)	create:mechanical_crafting	create	M-05	REJECT	{'REJECT': 1, 'ACCEPT': 1}	while the steampunk-console aesthetic could invite a Create assembly flavor, the gaming console is a pure novelty toy wi
2	False	gamediscs	gamediscs:game_disc_* (mob-kill drops)	loot-seed — skeleton kill gimmick already defined per-mob	survival	M-34	REJECT	{'REJECT': 2}	the disc-from-skeleton-kill is an inherent mechanic (Bee/Slime/Frog/Rabbit killed by Skeleton → disc). It's already a su
2	False	gamediscs	gamediscs:game_disc_* (mob-kill drop, skeleton kills mob → disc)	loot-seed	survival	M-02	REJECT	{'REJECT': 2}	the disc-from-skeleton-kill mechanism is already the mod's native mechanic (100% drop), not a loot-table weave we'd auth
1	True	gamediscs	console component parts (processor, redstone_circuit, display, battery, control_pad)	create:mechanical_crafting / create:pressing	create	M-12	REJECT	{'REJECT': 1}	technically craftable (gives the toy a Create flavor on-ramp), but the console + its parts are a closed cosmetic loop wi
1	True	gamediscs	game discs (dropped when a Bee/Slime/Frog/Rabbit is killed BY a Skeleton)	lootjs mob-drop tweak	economy	M-02	REJECT	{'REJECT': 1}	the discs are purely cosmetic collectibles with zero resource value; routing them as a reagent/coin sink (M-02) would be
1	False	gamediscs	gamediscs:game_disc_*	loot-seed	survival		REJECT	{'REJECT': 1}	discs already drop from specific kills (skeleton kills bee/slime/frog/rabbit) — that IS the survival interaction loop an
1	False	gamediscs	gamediscs components (battery, control_pad, display, redstone_circuit)	create:mechanical_crafting	create	M-05	REJECT	{'REJECT': 1}	gating every component behind mechanical crafting over-engineers a novelty mod (cost scales with power; this is an easte
1	False	gamediscs	gamediscs:gaming_console	tacz:gun_smith_table_crafting or thematic: traded as entertainment	economy	M-33	REJECT	{'REJECT': 1}	"service" motif requires labor on another's materials; a console is a finished good, not a service. Bare sell is M-09 (r
1	False	gamediscs	game_disc (disc drops from skeleton-kill)		economy	M-34	REJECT	{'REJECT': 1}	the skeleton-kill disc gimmick is cosmetic; a "combat specialist farms discs to trade" edge is a stretch — discs have no
1	False	gamediscs	gamediscs game discs (disc-from-skeleton-kill gimmick)	loot-seed	survival	M-34	REJECT	{'REJECT': 1}	Discs already drop from skeleton-kills of specific mobs (Bee/Slime/Frog/Rabbit). This is the mod's existing acquisition 
1	False	gamediscs	gamediscs:redstone_circuit (console component)	create:compacting (redstone + copper dust → circuit board)	create	M-12	REJECT	{'REJECT': 1}	the processor candidate (above) already anchors gamediscs to Create — adding a second Create component route on the same
1	False	gamediscs	gamediscs:game_disc_pong / *_flappy_bird / etc. (collectible discs, mob-kill drops)	loot-seed	survival	M-34	REJECT	{'REJECT': 1}	the disc-drop mechanic (skeleton kills bee/slime/frog/rabbit → disc) is already its entire loop and lives firmly in surv
1	False	gamediscs	gamediscs game discs (mob-kill drops)	occultism:spirit_fire	magic	M-11	REJECT	{'REJECT': 1}	a retro game disc has zero magical identity; transmuting a "Pong disc" into a spirit essence is thematically absurd. The
12	False	handcrafted	handcrafted:berry_jam_jar	farmersdelight:cooking or extradelight:mixing_bowl	survival	M-12	ACCEPT	{'ACCEPT': 9, 'REJECT': 3}	the jam jar is a consumable/condiment — routing it as an ingredient in a FD or ExtraDelight recipe (e.g. jam toast, fill
9	False	handcrafted	handcrafted wood furniture (chairs, tables, shelves, cupboards)	create:cutting (wood-cutting step on planks → furniture piece)	create	M-12	ACCEPT	{'ACCEPT': 11}	feeding planks through a Create sawblade produces the finished chair stock — wood-cutting IS what Create does with wood;
8	False	handcrafted	handcrafted furniture sets (per-wood variants)	M-28 colony route — MineColonies colonist housing requests furniture; a handcrafted furniture set satisfies colonist comfort/décor requests, gating colony progression	economy	M-28	ACCEPT	{'ACCEPT': 7, 'REJECT': 1}	MineColonies colonists that require furnished homes gate the colony's growth; a player who produces Handcrafted furnitur
5	False	handcrafted	handcrafted furniture pieces (chairs, tables, shelves — mid-complexity wood assemblies)	create:cutting (route a representative set through the mechanical saw for planks→shaped-cuts)	create	M-04	ACCEPT	{'ACCEPT': 5, 'REJECT': 1}	a furniture set that earns Create involvement (saw-cut components before assembly) weaves the homestead-decoration tier 
4	False	handcrafted	handcrafted:*_chair / *_table / *_bench (finished wooden furniture)	create:cutting	create	M-12	ACCEPT	{'ACCEPT': 4}	wood planks enter a Create saw; finished furniture pieces come out in discrete, automatable steps — the decoration tier 
3	False	handcrafted	handcrafted:*_table / *_counter / *_cupboard (wood-variant furniture sets)	create:cutting (wood-cutting step before bench assembly)	create	M-12	ACCEPT	{'ACCEPT': 2, 'REJECT': 1}	fine hardwood furniture needs precision-cut planks from the sawblade — raw logs through the Create saw, then the carpent
2	False	handcrafted	handcrafted:*_counter / *_cupboard / *_shelf (kitchen/storage blocks)	create:cutting	create	M-12	ACCEPT	{'ACCEPT': 1, 'REJECT': 1}	running wood planks through a Create mechanical saw to produce the finished furniture components gives the decoration la
1	False	handcrafted	finished furniture (chairs, tables, cupboards, shelves)	recipe (create:cutting for plank-stage components, or woodworks:sawmill)	create	M-04	ACCEPT	{'ACCEPT': 1}	a Mechanical Saw mills raw planks into pre-cut furniture blanks — the workshop makes furniture at scale, not just by han
1	False	handcrafted	wood-tier furniture sets (chairs/tables/benches)	create:cutting (wood)	create	M-04	ACCEPT	{'ACCEPT': 1}	a mechanical saw shapes timber into fitted furniture — the workshop runs on rotational power, not a hand-axe
1	False	handcrafted	high-tier furniture (fancy_bed, cupboard, drawer)	create:mechanical_crafting	create	M-20	ACCEPT	{'ACCEPT': 1}	a deployer-arm assembles the dovetail joints and hardware fittings that a hand craftsman couldn't keep consistent — Crea
1	False	handcrafted	wood furniture (chairs, tables, shelves, cupboards — per-wood-type sets)	create:cutting	create	M-12	ACCEPT	{'ACCEPT': 1}	running planks through the mechanical saw to cut furniture shapes makes home-furnishing an automated production run — th
1	False	handcrafted	handcrafted:bear_trophy	loot-seed (boss/rare mob loot)	survival	M-02	REJECT	{'REJECT': 1}	the trophy is a deco block crafted by the player; seeding it as a boss drop would bypass its crafting recipe, which is t
1	False	handcrafted	wood-tier furniture sets (chairs/tables/cupboards/benches, per-wood variant)	create:cutting (mechanical saw produces planks+trim cuts that feed furniture recipes)	create	M-12	ACCEPT	{'ACCEPT': 1}	building a colonist's tavern or airship cabin in bulk? Feed planks through the saw — the furniture lines become automate
1	False	handcrafted	handcrafted trophies (bear_trophy and kin)	create:mechanical_crafting	create	M-20	REJECT	{'REJECT': 1}	trophies are cosmetic; a mechanical_crafting route is forced depth for a deco item with no mechanical purpose — doesn't 
1	False	handcrafted	handcrafted:bear_trophy	occultism:ritual (trophy as ritual catalyst for a hunting-themed conjuration)	magic	M-02	REJECT	{'REJECT': 1}	trophies are display decoration items; re-interpreting them as ritual catalysts is a forced thematic overload — a huntin
1	False	handcrafted	handcrafted:*_fancy_bed / *_couch / *_dining_bench (upholstered furniture)	create:mechanical_crafting	create	M-05	REJECT	{'REJECT': 1}	M-05 is for a mod's FLAGSHIP item built in its own machine gated on Create parts. Handcrafted has no machine of its own,
1	False	handcrafted	handcrafted:*_shelf / *_cupboard / *_counter (wood furniture pieces)	create:cutting	create	M-12	ACCEPT	{'ACCEPT': 1}	the sawmill shapes fine timber into finished furniture; nobody hand-chisels a dining set
1	False	handcrafted	handcrafted:bear_trophy / trophies	MineColonies decoration/request system	economy	M-28	ACCEPT	{'ACCEPT': 1}	MineColonies colonists request furnished housing; trophies and quality furniture pieces become colony supply requests — 
1	False	handcrafted	handcrafted furniture (deco supply at scale)	M-31 logistics-required bulk	aeronautics	M-31	ACCEPT	{'ACCEPT': 1}	furnishing a MineColonies town or a remote base requires bulk transport of furniture; trading a ship-load of chairs and 
1	False	handcrafted	handcrafted:*_table/*_shelf/*_cupboard (finished furniture)	create:cutting	create	M-04	ACCEPT	{'ACCEPT': 1}	a Saw runs rough planks through a cutter-head to shape chair legs and shelf brackets — furnishing a base has a machine s
1	False	handcrafted	handcrafted:*_fancy_bed/*_couch (high-quality furnishings)	minecolonies colony build requests	economy	M-28	ACCEPT	{'ACCEPT': 1}	colonists request specific furniture for their huts; fancy beds and couches become colony upkeep goods — a colony player
1	False	handcrafted	handcrafted:*_counter / *_cupboard (kitchen-set pieces)	minecolonies huts/colony requests	economy	M-28	ACCEPT	{'ACCEPT': 1}	a Cook hut or Tavern requests furnished counters/cupboards from a crafting specialist — colony demand gates the furnitur
1	False	handcrafted	handcrafted furniture (metal-trim variants — iron/copper/brass)	create:mechanical_crafting	create	M-05	REJECT	{'REJECT': 1}	metal-trim furniture is mid-tier deco, not a flagship item; gating deco behind mechanical_crafting would be punishing fo
1	False	handcrafted	handcrafted:*_chair / *_couch / *_desk (mid-tier furniture)	minecolonies:composting (carpenter hut request)	economy	M-28	ACCEPT	{'ACCEPT': 1}	a MineColonies Carpenter produces basic handcrafted furniture on request, cheaper and faster than solo crafting — making
1	False	handcrafted	handcrafted:*_chair / any furniture block	create:crushing	create	M-04	ACCEPT	{'ACCEPT': 1}	salvage a mis-placed or surplus chair back to planks and an XP nugget through a crusher — the Create recycling loop cove
1	False	handcrafted	handcrafted:*_fancy_bed	ars_nouveau:enchanting_apparatus	magic	M-10	REJECT	{'REJECT': 1}	enchanting a decorative bed via arcane infusion is a tone mismatch — handcrafted's rustic/cozy vibe clashes with arcane 
1	True	handcrafted	select flagship furniture (fancy_bed, cupboard, desk)	create:cutting / mechanical_crafting	create	M-12	ACCEPT	{'ACCEPT': 1}	route a few signature furniture pieces through a Create sawmill/mechanical-crafting step (one light step, it's everyday 
1	True	handcrafted	per-wood furniture sets supplied to colonists	minecolonies request/hut fulfilment	economy	M-28	ACCEPT	{'ACCEPT': 1}	Handcrafted is the natural interior-furnishing palette for MineColonies builders; tying its pieces into the colony reque
1	False	handcrafted	handcrafted:berry_jam_jar (condiment/preserved food item)	extradelight:drying_rack or extradelight:evaporator (age/concentrate the jam into a higher-value preserve — jam → aged preserve or fruit leather)	survival	M-35	ACCEPT	{'ACCEPT': 1}	jam doesn't mature on its own — running it through a drying rack or evaporator concentrates it into a preserve worth mor
1	False	handcrafted	handcrafted furniture (chairs, tables, fancy_bed, cupboard)	loot-seed (seed rare/quality furniture pieces into village/structure loot tables as "found homewares" — the explorer finds a furnished ruin)	economy	M-34	ACCEPT	{'ACCEPT': 1}	an abandoned homestead leaves behind a fine acacia table or a fancy bed — loot that rewards exploration and primes deman
4	False	immersive_paintings	immersive_paintings:painting (crafting mats)	create:mechanical_crafting	create	M-04	REJECT	{'REJECT': 4}	forcing painting frames through a Create machine is pure busywork with no narrative "of course." The briefing explicitly
3	False	immersive_paintings	immersive_paintings:glow_painting	create_new_age:energising	create	M-17	REJECT	{'REJECT': 3}	tone clash — charging a painting with FE electricity makes no thematic sense; a painting glowing from electricity is an 
3	False	immersive_paintings	immersive_paintings:glow_painting	ars_nouveau:imbuement	magic	M-10	REJECT	{'REJECT': 3}	M-10 anti-rule — do not gate basic/everyday components behind infusion; glow paintings are a decoration item, gating the
3	False	immersive_paintings	immersive_paintings:painting (frame craft)	create:pressing / item_application	create	M-20	REJECT	{'REJECT': 3}	no thematic coherence; the craft is already vanilla, adding Create pressing is busywork, not depth. No surviving motif.
3	False	immersive_paintings	immersive_paintings:painting / glow_painting	supplementaries:item_lore + player trade	economy	M-33	ACCEPT	{'REJECT': 1, 'ACCEPT': 2}	M-33 (service-for-hire) requires a specialist performing *work* on another player's material; painting creation is self-
1	True	immersive_paintings	painting/graffiti items (craft from vanilla mats)	any Create/magic recipe	create		REJECT	{'REJECT': 1}	pure client-side decorative-expression mod; paintings are image canvases with no material/fluid/essence surface. Forcing
1	False	immersive_paintings	immersive_paintings:painting crafted via create parts	create:mechanical_crafting or create:sequenced_assembly	create	M-05	REJECT	{'REJECT': 1}	tone clash — forcing craft frames through Create machinery for what is fundamentally a decorative canvas is busywork wit
1	False	immersive_paintings	immersive_paintings:painting / glow_painting	thematic adjacency to Exposure:photograph	survival		REJECT	{'REJECT': 1}	an Exposure→ImmersivePaintings pipeline (photo becomes painting) is flavor, not a system anchor; no existing motif cover
26	False	mushroomquest	mushroomquest deadly / mythical mushroom caps	occultism:spirit_fire or ars_nouveau:imbuement	magic	M-11	ACCEPT	{'REJECT': 6, 'ACCEPT': 21}	The food/economy double-anchor (M-12 + M-09) above already gives mushroomquest two pillars. Adding a magic reagent route
23	False	mushroomquest	mushroomquest edible/effect mushrooms (common to mid-tier caps: bay_bolete, autumn_skullcap, artist_conk, etc.)	farmersdelight:cooking + extradelight:oven or mixing_bowl	create	M-12	ACCEPT	{'ACCEPT': 24, 'REJECT': 2}	mushrooms are a natural cooking input; routing them through Farmer's Delight cooking or ExtraDelight's oven into prepare
8	False	mushroomquest	mushroomquest glowshrooms (luminescent blocks)	ars_nouveau:imbuement	magic	M-10	REJECT	{'REJECT': 4, 'ACCEPT': 4}	Glowshrooms are deco/light-source blocks; their luminescence isn't a named arcane property in the pack lore — imbuement 
7	False	mushroomquest	deadly / effect-bearing mushroom caps (poisonous/hallucinogenic tiers)	occultism:spirit_fire	magic	M-11	ACCEPT	{'ACCEPT': 4, 'REJECT': 3}	Mushrooms with toxic or mind-altering effects already straddle the line between alchemy and poison; transmuting them thr
4	False	mushroomquest	mushroomquest:resin_orb	ars_nouveau:imbuement	magic	M-10	REJECT	{'REJECT': 3, 'ACCEPT': 1}	Resin orb is a worldgen/atmospheric block item; the dossier doesn't identify it as a drops-type reagent or flag it as ef
3	False	mushroomquest	mushroomquest rare/mythical caps (agarikon, angels_wing, etc.)	farmersdelight:cooking or extradelight:oven/vat	survival	M-12	ACCEPT	{'ACCEPT': 3}	rare foraged mushrooms roasted or braised into buffet dishes that fuel the diminishing-returns food loop (pairs with sol
3	False	mushroomquest	mushroomquest:resin_orb (special drop from foraging stumps)	create:mixing	create	M-12	ACCEPT	{'REJECT': 1, 'ACCEPT': 2}	resin_orb's exact properties aren't confirmed beyond "special drop"; routing an item whose behavior is uncertain into a 
3	False	mushroomquest	rare/mythical mushroom caps	ars_nouveau:imbuement	magic	M-10	REJECT	{'REJECT': 3}	spirit_fire (M-11, already accepted) covers the magic-reagent use for deadly caps; adding an imbuement route for the sam
2	False	mushroomquest	rare/mythical mushroom caps (e.g. agarikon, mythical-tier caps)	farmersdelight:cooking OR extradelight:oven / melting_pot	create	M-12	ACCEPT	{'ACCEPT': 2}	Foraged mushrooms are raw ingredients crying out for a cooking station; running the rare caps through Farmer's Delight p
2	False	mushroomquest	mushroomquest rare/mythical mushroom caps	farmersdelight:cooking / extradelight:oven	economy	M-12	ACCEPT	{'ACCEPT': 2}	a morel or agarikon simmered into a gourmet dish commands a real coin price — forager becomes supplier
2	False	mushroomquest	mushroomquest rare caps with seasonal/biome-specific spawning	season-gated spawn (Serene Seasons config/worldgen)	create	M-16	ACCEPT	{'ACCEPT': 2}	only-in-autumn foraging for specific caps that feed a seasonal ritual or Create recipe deepens the seasonal economy; mus
2	False	mushroomquest	mushroomquest glowshrooms (light-emitting blocks)	create:crushing	create	M-04	REJECT	{'REJECT': 1, 'ACCEPT': 1}	glowshrooms are living fungal blocks in a cottagecore foraging mod; crushing them to scrap (M-04 deco-recycles) tonally 
2	False	mushroomquest	glowshrooms (blue/green/magenta varieties)	ars_nouveau:imbuement	magic	M-10	REJECT	{'REJECT': 1, 'ACCEPT': 1}	glowshrooms are a light-source/deco item with no innate arcane pedigree; the imbuement hook ("glowing fungus → arcane cr
2	False	mushroomquest	common/rare mushroom caps (bay bolete, agarikon, etc.)	farmersdelight:cooking / extradelight:oven	create	M-12	ACCEPT	{'ACCEPT': 2}	foraged caps go into the cooking-pot as any other ingredient — mushroom stew, miso, sautéed fungi — folding the foraging
2	False	mushroomquest	rare/mythical mushroom caps (effect-bearing)	occultism:spirit_fire	magic	M-11	ACCEPT	{'ACCEPT': 2}	a toxic or mythical mushroom transmuted through spirit-fire becomes a magic reagent — the deadly ones are worth more as 
2	False	mushroomquest	mushroomquest rare foraged caps	emergent trade (M-34)	economy	M-34	ACCEPT	{'ACCEPT': 2}	rare mythical shrooms are biome/region-locked (Mushroom Island); a foraging specialist who knows the biome supplies them
1	False	mushroomquest	rare/mythical mushroom caps (effect-bearing)	farmersdelight:cooking (cooking_pot)	economy	M-12	ACCEPT	{'ACCEPT': 1}	the forager processes rare caps into tinctures/soups worth selling — the kitchen is the bridge between finding and tradi
1	False	mushroomquest	everyday mushroom (edible caps)	farmersdelight:cooking	survival	M-12	ACCEPT	{'ACCEPT': 1}	run foraged mushrooms through Farmer's Delight cooking to produce variety meals; the two mod systems already share the s
1	False	mushroomquest	mushroomquest:resin_orb / deadly effect caps	occultism:spirit_fire or ars_nouveau:imbuement	magic	M-11	REJECT	{'REJECT': 1}	the dossier flags this WEAK; resin_orb is not confirmed to have effect relevance to magic rituals; the cooking/economy w
1	False	mushroomquest		extradelight:mortar (grind into potion-component paste) → irons_spellbooks:alchemist_cauldron_brew	magic	M-10	ACCEPT	{'ACCEPT': 2}	grinding toxic or hallucinogenic caps in the mortar then brewing the extract in the alchemist's cauldron converts a fora
1	False	mushroomquest		create:milling	create	M-12	ACCEPT	{'ACCEPT': 1}	milling glowing caps yields a luminescent dust (bioluminescent pigment) usable as a crafting reagent — thematic, low-ste
1	False	mushroomquest	mushroomquest foraging blocks (loot=yes, structures)	loot-seed	create	M-02	REJECT	{'REJECT': 1}	tone clash; the loot-seed motif is for structure/dungeon mods; foraging blocks are organic-nature content and adding tec
1	False	mushroomquest	foraged mushrooms (common/rare)	farmersdelight:cooking / extradelight:oven	create	M-12	ACCEPT	{'ACCEPT': 1}	Run foraged mushrooms through the cooking chain into prepared dishes — the food-processing web gains a new ingredient st
1	False	mushroomquest	mushroomquest:agarikon / deadly_dapperling (mythical caps, deadly effects)	occultism:spirit_fire	magic	M-11	ACCEPT	{'ACCEPT': 1}	a deadly or mythical mushroom with potent biochemical effects transmutes cleanly into an Occultism essence via spirit-fi
1	False	mushroomquest	mushroomquest:glowshroom (emissive bioluminescent fungi)	ars_nouveau:imbuement	magic	M-10	REJECT	{'REJECT': 1}	glowshrooms are everyday ambient blocks; imbuement of a common ambient fungi into a magic reagent would be unbalanced (M
1	False	mushroomquest	rare/mythical mushrooms (agarikon, resin orb class)	farmersdelight:cooking / extradelight:oven	survival	M-12	ACCEPT	{'ACCEPT': 1}	a handful of rare caps and a slow simmer — the mycologist's meal is worth the forage trip
1	False	mushroomquest	mushroomquest:bay_bolete / common_puffball (everyday foraged mushrooms)	farmersdelight:cooking or extradelight:melting_pot	create	M-12	ACCEPT	{'ACCEPT': 1}	Foraged mushrooms go into the cooking pot like any crop — the foraging layer slots cleanly into the Farmer's Delight foo
