times_suggested	from_opus	mod	from	via	to_pillar	motif	consensus	verdicts	hook
3	False	create_enchantment_industry	create_enchantment_industry:experience_bucket	occultism:ritual (XP fluid as ritual fuel cost — an Occultism ritual that requires liquid XP delivered via Create pipes instead of raw mob killing)	magic	M-29	ACCEPT	{'ACCEPT': 3}	Certain Occultism rituals demand liquid XP (not raw XP levels), so the Create specialist who maintains a mob farm and pi
3	False	create_enchantment_industry	create_enchantment_industry blaze_enchanter output (enchanted gear)	occultism:ritual	magic	M-29	ACCEPT	{'ACCEPT': 3}	An Occultism ritual that requires an industrially-enchanted item as a component forces magic and Create-enchanting to de
3	False	create_enchantment_industry	create_enchantment_industry:blaze_enchanter (automated enchanting)	create_enchantment_industry:grinding (mechanical grindstone) → ars_nouveau:enchanting_apparatus	magic	M-29	ACCEPT	{'ACCEPT': 3}	an endgame hyper-enchanted piece of magic gear (Iron's or Ars) requiring both a Create-enchanted base (blaze_enchanter o
2	False	create_enchantment_industry	create_enchantment_industry:experience_bucket	create_enchantment_industry:grinding (Mechanical Grindstone)	create	M-06	REJECT	{'REJECT': 1, 'ACCEPT': 1}	grinding → within the same mod, not a pillar bridge; M-06 is for endgame multi-stage keystones gated cross-mod. Internal
2	False	create_enchantment_industry	create_enchantment_industry:mechanical_grindstone (the grinding recipe type)	create_enchantment_industry:grinding on foreign enchanted items	magic	M-05	REJECT	{'REJECT': 1, 'ACCEPT': 1}	This deepens the Create pillar (automated disenchanting is already Create-side), not a 2nd pillar. The magic-bridge cand
2	True	create_enchantment_industry	liquid experience (experience fluid)	native-gating a magic-side cost (Ars/Iron's gear upgrade, Occultism ritual fuel) on liquid XP	magic	M-05	ACCEPT	{'ACCEPT': 2}	factory-pumped liquid XP becomes the fuel a magic upgrade or ritual consumes — automated enchanting feeds spellcraft
2	True	create_enchantment_industry	enchanted output / liquid XP	ars_nouveau:imbuement / forbidden_arcanus infusion	magic	M-10	REJECT	{'REJECT': 1, 'ACCEPT': 1}	redundant with the accepted liquid-XP weave above; same pillar, prefer the single cleaner routing over a second arcane-i
2	False	create_enchantment_industry	create_enchantment_industry liquid XP	create_new_age:energising	create	M-17	REJECT	{'REJECT': 2}	Create New Age energising charges tools with FE, not XP fluid — the type mismatch means no natural join; don't force it.
2	False	create_enchantment_industry	create_enchantment_industry:super_experience_nugget	ars_nouveau:enchanting_apparatus	magic	M-10	ACCEPT	{'ACCEPT': 2}	Super-XP nuggets (dense concentrated XP from the super_experience_block line) become a required reagent on the Ars encha
2	True	create_enchantment_industry	experience_bucket (Liquid Experience fluid)	irons_spellbooks:alchemist_cauldron_brew / ars_nouveau:imbuement as an XP-cost fuel	magic	M-10	ACCEPT	{'ACCEPT': 2}	pipe automated mob-farm XP (liquid form) as the fuel/cost for a magic-side brew or imbuement — the factory-enchanting sp
2	False	create_enchantment_industry	create_enchantment_industry mechanical enchanting line (automated Blaze Enchanter output: enchanted books/gear)	occultism:spirit_fire	magic	M-11	ACCEPT	{'ACCEPT': 2}	the enchantment factory's surplus output doesn't pile in a chest — the occultist dissolves it in spirit-fire to distill 
2	False	create_enchantment_industry	create_enchantment_industry liquid XP (experience fluid)	irons_spellbooks:alchemist_cauldron_brew	magic	M-17	ACCEPT	{'ACCEPT': 1, 'REJECT': 1}	liquid XP is factory-bottled experience — feeding it into Iron's Spellbooks' alchemist cauldron to brew a high-level spe
2	False	create_enchantment_industry	create_enchantment_industry:printer (copies enchanted books)	emergent trade	economy	M-33	ACCEPT	{'ACCEPT': 2}	an enchanting specialist running the Blaze Enchanter + Printer is the pack's enchant-for-hire role — they print enchante
1	False	create_enchantment_industry	create_enchantment_industry:enchanting_template / super_enchanting_template (endgame hyper-enchant mats)	irons_spellbooks:alchemist_cauldron_brew	magic	M-17	REJECT	{'REJECT': 1}	M-17 is "electric FE charging bridge" — charging a focus/tool, not brewing with templates. Template-into-cauldron doesn'
1	False	create_enchantment_industry	create_enchantment_industry:printer (copies enchanted books)	occultism:spirit_trade	magic	M-18	REJECT	{'REJECT': 1}	The Printer already copies books mechanically; routing it through spirit trade reads as a redundant parallel, not a genu
1	False	create_enchantment_industry	create_enchantment_industry:blaze_enchanter (the flagship automated enchanting block)	irons_spellbooks:alchemist_cauldron_brew — brew a spell-scroll or upgrade that costs liquid XP (routing the enchant-industry output into Iron's spell economy)	magic	M-10	REJECT	{'REJECT': 1}	the liquid-XP → Ars imbuement weave already covers the magic pillar cleanly; a second path through Iron's Cauldron is re
1	False	create_enchantment_industry	create_enchantment_industry:printer (book-copying machine)	ars_nouveau:enchanting_apparatus	magic	M-05	REJECT	{'REJECT': 1}	the Printer's role is book/schedule copying — routing it through the enchanting apparatus would mean making Ars books re
1	False	create_enchantment_industry	create_enchantment_industry:mechanical_grindstone (automated disenchanting output)	occultism:spirit_trade	magic	M-18	ACCEPT	{'ACCEPT': 1}	spirit-trade spirits are supply/logistics agents; having them barter enchanted-book fragments (disenchant byproduct) tie
1	False	create_enchantment_industry	create_enchantment_industry:enchanting_template / enchanted books	irons_spellbooks:alchemist_cauldron_brew	magic	M-05	REJECT	{'REJECT': 1}	Iron's cauldron brews potions, not scrolls/spells; enchanted books entering the cauldron has no natural player read-thro
1	False	create_enchantment_industry	create_enchantment_industry:mechanical_grindstone output (disenchanted items → liquid XP)	irons_spellbooks:alchemist_cauldron_brew	magic	M-17	REJECT	{'REJECT': 1}	M-17 is for FE/electric charging, not liquid-XP brewing. Mismatched motif — no-motif for this specific routing. The liqu
1	False	create_enchantment_industry		farmersdelight:cooking (cook experience_cake_base → experience_cake using the cooking pot)	survival	M-12	ACCEPT	{'ACCEPT': 1}	the experience cake is literally food — routing its base through FD cooking integrates it into the food-processing chain
1	False	create_enchantment_industry		smokeleafindustries items (buds/extract) — CEI's grinding method could accept smokeleaf product as a "refinement" step	create	M-12	ACCEPT	{'ACCEPT': 1}	the industrial grindstone processes fibrous material into refined powder; smokeleaf buds fed through the grindstone yiel
1	False	create_enchantment_industry		ars_nouveau:book_upgrade method — the printer's output (copied enchanted books) as a feedstock for Ars book upgrades	magic	M-05	ACCEPT	{'ACCEPT': 1}	the Ars book-upgrade method expects an existing book of the right tier — the CEI printer can mass-produce those intermed
1	False	create_enchantment_industry	`create_enchantment_industry:mechanical_grindstone` output (stripped-enchant residue / liquid XP)	`irons_spellbooks:alchemist_cauldron_brew`	magic	M-10	ACCEPT	{'ACCEPT': 1}	Disenchanted residue distilled in the alchemist's cauldron produces a spell-grade extract — the iron's spellbooks side o
1	False	create_enchantment_industry	liquid XP (experience_bucket)	create_enchantment_industry:grinding (Mechanical Grindstone) then numismatics coin	economy	M-08	REJECT	{'REJECT': 1}	grinding the liquid XP doesn't map naturally — the Mechanical Grindstone grinds solids, not fluids. The fluid-to-economy
1	False	create_enchantment_industry	create_enchantment_industry:blaze_forger	M-05 native-gating (Blaze Forger requires Create parts)	create	M-05	REJECT	{'REJECT': 1}	create_enchantment_industry is already anchored to Create (all its machines are built with Create components); gating it
1	False	create_enchantment_industry	create_enchantment_industry:blaze_enchanter (automates enchanting, mid-tier machine)	boss-drop gate on input	magic	M-15	REJECT	{'REJECT': 1}	the Blaze Enchanter is already a Create-spine item made through Create methods; gating it on a boss drop introduces M-15
1	False	create_enchantment_industry	create_enchantment_industry hyper-enchanted gear (super_enchanting_template outputs, endgame)	occultism:spirit_trade	magic	M-18	ACCEPT	{'ACCEPT': 1}	a hyper-enchanted piece of gear is exactly the kind of premium item an Occultism spirit-trader would deal in — the Creat
1	False	create_enchantment_industry	liquid XP as a free-XP arbitrage path	direct level drain → enchantment → disenchant cycle	(bypass		REJECT	{'REJECT': 1}	not a weave candidate; flagged as a balance REWORK concern — the disenchanter+blaze enchanter loop should be costed to p
1	False	create_enchantment_industry	create_enchantment_industry:enchanting_template / super_enchanting_template	create:sequenced_assembly (gating the hyper-enchant tier)	create	M-06	ACCEPT	{'ACCEPT': 1}	Super-enchanting templates require a multi-stage Create assembly line to produce — the factory earns its forbidden power
1	False	create_enchantment_industry	create_enchantment_industry grinding (Mechanical Grindstone)	create_enchantment_industry:grinding (accepts enchanted gear → strips to liquid XP)	create	M-05	REJECT	{'REJECT': 1}	already anchored to Create via its own machines — this doesn't add a 2nd anchor, it deepens the one that exists; not a c
1	False	create_enchantment_industry	create_enchantment_industry:super_experience_block / experience_lantern	occultism:ritual (XP-dense block as a ritual circle material — the ritual consumes it)	magic	M-11	ACCEPT	{'ACCEPT': 1}	Occultism rituals that normally demand rare mob-drops can instead be fuelled by a dense XP condenser — industrialised ex
1	False	create_enchantment_industry	create_enchantment_industry:enchanted_book output	create_enchantment_industry:grinding (Mechanical Grindstone strips enchants)	magic	M-11	REJECT	{'REJECT': 1}	grinding is a disenchant step back to liquid XP, not a transmutation into a magic essence — the disenchant→XP fluid→ritu
1	False	create_enchantment_industry	liquid XP	irons_spellbooks:alchemist_cauldron_brew	magic	M-17	REJECT	{'REJECT': 1}	M-17 is specifically FE-charging; liquid XP is not FE. The correct motif for XP as magic fuel is M-10 (arcane infusion p
1	False	create_enchantment_industry	create_enchantment_industry:mechanical_grindstone	create_enchantment_industry:grinding	create	M-06	REJECT	{'REJECT': 1}	the mechanical grindstone is already a Create-side machine (automated grindstone); adding sequenced-assembly depth is po
1	False	create_enchantment_industry	create_enchantment_industry:grinding (method — Mechanical Grindstone)	create_enchantment_industry:grinding	create	M-04	REJECT	{'REJECT': 1}	`grinding` is a Create-spine method already; routing it for deco-recycle is valid but purely internal to Create — doesn'
1	False	create_enchantment_industry	liquid XP (create_enchantment_industry:experience fluid)	irons_spellbooks:alchemist_cauldron_brew	magic	M-10	ACCEPT	{'ACCEPT': 1}	Iron's Spellbooks' alchemist cauldron brews spells/potions — fuelling it with Create's industrial Liquid XP (instead of 
1	False	create_enchantment_industry	Mechanical Grindstone (create_enchantment_industry:grinding)	create_enchantment_industry:grinding	create	M-06	REJECT	{'REJECT': 1}	M-06 is sequenced-assembly keystones; the grindstone is simply an auto-grindstone (automated disenchant), not a sequence
1	True	create_enchantment_industry	experience_bucket (liquid XP)	occultism:ritual / spirit cost	magic	M-18	ACCEPT	{'ACCEPT': 1}	Occultism rituals that demand XP can drink piped Liquid Experience — automate the soul-cost of summoning. (Liquid XP as 
1	True	create_enchantment_industry	blaze_enchanter / hyper-enchant output	KubeJS boss/colony gate	create	M-15	ACCEPT	{'ACCEPT': 1}	cap-breaking hyper-enchantment is the kind of endgame power that should sit behind a boss drop or MineColonies part, not
1	False	create_enchantment_industry	create_enchantment_industry:printer output (enchanted books)	irons_spellbooks:alchemist_cauldron_brew (feed an enchanted book + arcane essence into an Iron's cauldron to produce a scroll/higher-tier spell book)	magic	M-29	ACCEPT	{'ACCEPT': 1}	The Create printer mass-produces enchanted books the Iron's Spellbooks alchemist needs to brew advanced scrolls — the te
1	False	create_enchantment_industry	create_enchantment_industry:mechanical_grindstone / disenchanting	create_enchantment_industry:grinding (its own registered recipe-type) → route boss-drop gear through the grindstone to extract liquid XP + reclaimed parts	economy	M-34	ACCEPT	{'ACCEPT': 1}	Combat specialists bring boss-geared loot to the grindstone specialist, who strips enchants into liquid XP and returns t
1	False	create_enchantment_industry	create_enchantment_industry: automated enchanting chain	minecolonies research gate (research required before colony buildings can request enchanted tools — CEI's Blaze Enchanter is the production method unlocked by MineColonies' Enchanter's Study research tier)	economy	M-37	ACCEPT	{'ACCEPT': 1}	The colony's enchanting study unlocks the knowledge to request magically-enhanced tools, but the Blaze Enchanter (CEI) i
1	False	create_enchantment_industry	create_enchantment_industry: loot=yes	loot-seed (seed the CEI dungeon/mob loot tables with a Create-XP-industry recipe hint — e.g. an experience_lantern in treasure chests, motivating players to explore for the tech tier)	survival	M-15	ACCEPT	{'ACCEPT': 1}	An Experience Lantern found in dungeon loot teases the XP-industry tier before the player has built the infrastructure —
1	False	create_enchantment_industry	create_enchantment_industry:grinding (Mechanical Grindstone)	create_enchantment_industry:grinding	create	M-05	REJECT	{'REJECT': 1}	The Mechanical Grindstone is already an in-pillar Create method (automated grindstone on the Create spine); gating a cre
1	False	create_enchantment_industry	create_enchantment_industry:blaze_enchanter output (enchanted gear)	service-for-hire (enchant-on-demand for other players)	economy	M-33	ACCEPT	{'ACCEPT': 1}	An industrial enchanting station is exactly a "labor" node — other players bring gear, the enchanting specialist runs it
1	False	create_enchantment_industry	liquid XP → magic arcane-infusion on basic components	ars_nouveau:imbuement		M-10	REJECT	{'REJECT': 1}	M-10 anti-rule — do not gate basic/everyday components behind infusion. The liquid XP link above is fine for mid/endgame
1	False	create_enchantment_industry	`create_enchantment_industry:blaze_enchanter` (liquid-XP consumption)	`create_enchantment_industry:grinding` (Mechanical Grindstone)	create	M-26	ACCEPT	{'ACCEPT': 1}	the bigger the enchanting operation, the faster XP depletes — makes the mob-farm productive throughput matter economical
1	False	create_enchantment_industry	liquid XP (experience_bucket — fluid form of XP)	irons_spellbooks:alchemist_cauldron_brew	magic	M-29	ACCEPT	{'ACCEPT': 1}	the Alchemist Cauldron (Iron's) can consume liquid XP piped from Create's industrial XP farm as a brew ingredient — a Cr
1	False	create_enchantment_industry	enchanted output (automated enchanting via Blaze Enchanter)	service-for-hire	economy	M-33	ACCEPT	{'ACCEPT': 1}	a Create-specialist runs the enchant factory; magic/survival players bring gear + books, and pay for enchanting as a ser
1	False	create_enchantment_industry	create_enchantment_industry:printer (copies enchanted books)	create:sequenced_assembly	create	M-06	REJECT	{'REJECT': 1}	the Printer is already the mod's own endgame machine; adding a sequenced-assembly wrapper on top would be double-gating 
1	False	create_enchantment_industry	create_enchantment_industry hyper-enchanting (breaks vanilla caps)	create:sequenced_assembly or M-06	create	M-06	ACCEPT	{'ACCEPT': 1}	super-enchanting templates gating hyper-tier enchantments are a multi-stage chain through the Blaze Enchanter + Printer 
1	False	create_enchantment_industry	liquid XP as aeronautics fuel alternative	createaddition:liquid_burning	aeronautics	M-13	REJECT	{'REJECT': 1}	experience as a vehicle fuel is tonally wrong for this pack — XP is an arcane/progression resource, not a diesel substit
1	False	create_enchantment_industry	create_enchantment_industry enchanted-book output	ars_nouveau:enchanting_apparatus	magic	M-33	ACCEPT	{'ACCEPT': 1}	the enchanting specialist's Blaze Enchanter factory is the pack's commercial enchanting bureau — you bring the gear, the
1	False	create_enchantment_industry	create_enchantment_industry:experience_bucket	create:filling → aeronautics fuel/power (if aeronautics uses XP as exotic fuel)	aeronautics	M-13	REJECT	{'REJECT': 1}	tone-clash + reagent-ownership conflict: aeronautics propulsion fuel is reserved for TFMG diesel/gasoline/lubricant (M-1
1	False	create_enchantment_industry	enchanted books (produced by the Printer / Blaze Enchanter)	occultism:ritual	magic	M-29	ACCEPT	{'ACCEPT': 1}	a high-tier Occultism ritual (summoning a greater spirit or upgrading a familiar) consumes a specific enchanted book, so
1	False	create_enchantment_industry	super_experience_nugget (a dense XP item, mid-rarity)	create:pressing	create	M-06	REJECT	{'REJECT': 1}	pressing XP nuggets is circular internal to Create-CEI and adds no second-pillar anchor; it just deepens an already-Crea
1	True	create_enchantment_industry	experience_bucket (Liquid XP fluid)	M-29 cross-route — a magic recipe (Occultism ritual / Ars apparatus) *requires* liquid XP as fuel	magic	M-29	ACCEPT	{'ACCEPT': 1}	liquid XP is a pipeable fluid; making a magic-side cost (a ritual, a high-tier focus charge) consume Create's bottled XP
1	True	create_enchantment_industry	blaze_enchanter automated enchanting	M-33 service-for-hire (enchant another player's gear)	economy	M-33	ACCEPT	{'ACCEPT': 1}	an automated-enchanting setup lets a specialist run an enchant-for-hire service on other players' gear (the labor axis: 
1	False	create_enchantment_industry	create_enchantment_industry:blaze_enchanter (consumes blaze rods / Nether materials)	worldgen/scarcity — Nether blaze rods are a regional Nether-bound resource; the Blaze Enchanter's fuel dependency gates the industrial enchanting tier on Nether access	survival	M-30	ACCEPT	{'ACCEPT': 1}	you cannot run the Blaze Enchanter without blaze fuel — and blazes are a Nether-regional resource, not a simple overworl
1	False	create_enchantment_industry	create_enchantment_industry:experience_bucket (liquid XP fluid)	createaddition:liquid_burning (burn liquid XP for FE as a high-density exotic fuel)	create	M-32	ACCEPT	{'ACCEPT': 1}	oversaturated liquid XP (from a mob-farm running faster than the Blaze Enchanter can consume) can be fed to a liquid bur
2	False	createshufflefilter	createshufflefilter:weighted_shuffle_filter (stack-weighted random Deployer dispatch)	create:sequenced_assembly / create:deploying	create	M-06	REJECT	{'REJECT': 2}	M-06 (sequenced-assembly keystone) is already create→create depth; adding a shuffle filter is a variant of M-06's delive
1	False	createshufflefilter	createshufflefilter:shuffle_filter / weighted_shuffle_filter (filter items)	any recipe-gate approach	any		REJECT	{'REJECT': 1}	Both filter items are pure builder/automation utility for randomizing Deployer placement — their value is entirely as a 
1	False	createshufflefilter	shuffle_filter / weighted_shuffle_filter	recipe (crafting)	create	M-20	REJECT	{'REJECT': 1}	M-20 (deploy-application upgrade) requires the item to be applied *onto* a base to upgrade it — a filter item that rando
1	False	createshufflefilter	weighted_shuffle_filter	recipe	economy		REJECT	{'REJECT': 1}	the item has no sellable trade-good property or luxury-good shape; it's a builder utility. No coherent economy anchor; n
1	False	createshufflefilter	createshufflefilter:shuffle_filter / weighted_shuffle_filter (deployer filter items)	create:item_application	create	M-20	REJECT	{'REJECT': 1}	M-20 is about applying a woven part onto a base to upgrade it — the shuffle filter isn't an upgrade applier, it's a filt
1	False	createshufflefilter	createshufflefilter:shuffle_filter / weighted_shuffle_filter	recipe (crafting)	create		REJECT	{'REJECT': 1}	the filters are a Create-internal builder utility with no cross-system surface. Giving them a Create-processing recipe s
1	False	createshufflefilter	createshufflefilter:shuffle_filter / weighted_shuffle_filter	create:deploying (Deployer randomizes block-type placement on a contraption)	aeronautics	M-24	REJECT	{'REJECT': 1}	The shuffle filter affects Deployer item-placement logic, not drivetrain/propulsion/control surfaces — M-24 targets mech
1	False	createshufflefilter	createshufflefilter:weighted_shuffle_filter	create:mechanical_crafting (gated behind a Create machine-crafting step to emphasize it's a precision component)	create	M-05	REJECT	{'REJECT': 1}	The filter is already implicitly a Create item (uses Create Deployer); requiring mechanical_crafting is adding depth to 
1	False	createshufflefilter	createshufflefilter:weighted_shuffle_filter	aeronautics build automation	aeronautics		REJECT	{'REJECT': 1}	The shuffle filter randomizes Deployer placement for varied block selection — this could be used in ship-building contra
1	False	createshufflefilter	createshufflefilter:shuffle_filter	ars_nouveau:imbuement	magic	M-10	REJECT	{'REJECT': 1}	tone clash — a probabilistic mechanical filter gaining "magic weighting" is incoherent; the items are industrial, not ar
8	False	exposure	exposure:camera (gold + glass instrument)	create:sequenced_assembly	create	M-06	REJECT	{'REJECT': 6, 'ACCEPT': 2}	The camera is already made via sequenced_assembly (the existing Create anchor); proposing it again as a candidate is dup
7	False	exposure	exposure:aged_photograph	exposure:photograph_aging	economy	M-35	ACCEPT	{'ACCEPT': 7}	Aged photographs are time-matured documents; a specialist who keeps a darkroom running long enough to age prints has a t
6	False	exposure	exposure:black_and_white_film (craft requires silver — check if galosphere palladium applies)	create:pressing silver → film base	create	M-12	ACCEPT	{'ACCEPT': 4, 'REJECT': 2}	pressing a refined silver/alloy sheet through Create to produce the film base makes the camera a Create production chain
3	False	exposure	exposure:album / exposure:photograph	supplementaries:item_lore or supplementaries:antique_book	economy	M-33	ACCEPT	{'ACCEPT': 3}	A photographer player offering keepsake portraits (albums/prints) as a service to other players is a pure labor trade wi
3	False	exposure	exposure:aged_photograph	exposure:photograph_aging → supplementaries:antique_book or supplementaries:item_lore	economy	M-33	ACCEPT	{'ACCEPT': 3}	Aged photographs baked into an annotated Supplementaries antique-book become tradeable keepsakes with provenance — a pla
2	False	exposure	exposure:black_and_white_film (film cartridge)	create:sequenced_assembly	create	M-06	REJECT	{'REJECT': 2}	Film development via sequenced assembly already EXISTS as the inbound weave (made-by: create:sequenced_assembly). Propos
2	False	exposure	exposure gold_camera (gold tier)	ars_nouveau:enchanting_apparatus	magic	M-10	REJECT	{'REJECT': 2}	Imbuing a camera with arcane energy is tonally strained — the gold camera is a material upgrade (more durable/capable), 
2	False	exposure	exposure:camera_gold	create:sequenced_assembly (gold camera as an endgame version assembled via sequenced assembly with precision lenses)	create	M-06	REJECT	{'REJECT': 1, 'ACCEPT': 1}	already anchored to Create via sequenced_assembly film development; a second Create edge doesn't add a new anchor — and 
2	False	exposure	exposure:aged_photograph (aging recipe output)	ars_nouveau:imbuement	magic	M-10	REJECT	{'REJECT': 2}	aged photographs have no magical property — aging is a cosmetic darkroom process. Imbuing a photograph reads as non-sens
2	False	exposure	exposure:camera (gold variant)	create:mechanical_crafting	create	M-20	REJECT	{'REJECT': 1, 'ACCEPT': 1}	the gold camera is already crafted; adding a deploy-upgrade step to a cosmetic camera variant has no loop-advancing valu
2	False	exposure	exposure:photograph (printed photo, unique item)	loot-seed in structure loot tables (seed developed photographs into exploration loot — "found photo" flavor)	survival		REJECT	{'REJECT': 2}	no-motif — a loot-seed of a purely cosmetic item doesn't advance any loop node; it's decoration, not a structural tie
2	False	exposure	exposure:black_and_white_film	tfmg:distillation (silver halide chemical supply chain)	create	M-29	REJECT	{'REJECT': 2}	TFMG distillation produces oil fractions not photographic chemicals; the "silver halide" tie is theme-only with no actua
2	False	exposure	exposure:photograph (developed print)	exposure:photograph_aging (the aging method — photographs get more valuable with in-world age, M-35)	economy	M-35	ACCEPT	{'ACCEPT': 2}	an aged photograph of a rare place (End city, Nether fortress, a ship in flight) commands a higher trade price than a fr
2	False	exposure	exposure:photograph_aging (aged photos gain value/aesthetic)	exposure:photograph_aging method	economy	M-35	ACCEPT	{'ACCEPT': 2}	aging a photograph takes time and the right conditions — a "seasoned" photograph is worth more (M-35 maturation); a phot
2	False	exposure	exposure photographs as documented map intelligence	emergent player trade + supplementaries:weathered_map tie	economy	M-33	ACCEPT	{'ACCEPT': 2}	a photographer sells aged photographs to players building a settlement map or propaganda wall (supplementaries blackboar
