chunk	mod	action	motif	match	matched_link	ref	note	evidence
S16	gravestone	drop	M-33	NONE		gravestone:obituary → economy (M-33 service-for-hire: death recovery)	briefing failure mode verbatim — anchor bookkeeping with no loop motion. Recovery-for-hire happens or not without a ledger row.	row's own delivery field = "emergent" (nothing authorable, can never ship); dossier 2nd-anchor: "none — leave. any weave
S08	immersive_paintings	drop		NONE		ratified LEAVE (pure client-side decorative-expression, no material surface)	LEAVE overtaken by a shipped Create routing of all four craftables; drop the stale verdict.	kubejs/server_scripts/recipes/23-immersive-paintings.js (#172)
S06	mcwstairs	drop	M-04	NONE		mcwstairs stone/brick/blackstone stair/railing variants → create:crushing M-04	shipped batch philosophy supersedes the pending pass; 81-decoration-metal.js's mcwstairs entry is a no-op anyway (digest shows no metal-ingot recipes).	the shipped M-04 batch (35-web-bridges.js) deliberately skips vanilla-material variant families ("already sit in the van
S03	mcwwindows	drop	M-04	NONE		mcwwindows stone parapet / arrow-slit variants → create:crushing M-04	the row's premise ("every stone deco block crushes") never shipped; ~50 recipes of bloat for zero loop motion — superseded.	the shipped batch (35-web-bridges.js) deliberately scopes crushing to orphaned worldgen stones and skips vanilla-materia
S06	minecolonies_compatibility	drop	M-05	AMBIG		citizen_terminal/citizen_stock_keeper→create M-05	one half redundant, other half targets dead items; JEI-hide terminal/grid instead (housekeeping, not a weave).	recipe digest — citizen_stock_keeper already consumes create:stock_link; citizen_terminal/citizen_grid are neoforge:item
S02	modulargolems	drop	M-33	NONE		modulargolems assembled golem → service-for-hire (golem specialist builds for others) (M-3	golemancer-for-hire happens on its own; nothing to author; ledger row is bookkeeping, not a weave.	the row's own delivery field is "config (emergent)"; slate consistently cut emergent-only M-33 rows elsewhere (create_pa
S14	mowziesmobs	drop	M-10	AMBIG	sol_visage / earthrend artifacts→magic via ritual transmutation	SHIPPED 35-magic-web-mobs.js: ice_crystal → ars_nouveau:imbuement → water_essence (beyond-	drop or re-point the input (glowing_jelly already carries mowzies→source); ownership conflicts are a DECISIONS.md escalation, not a local override.	ratified MERGE ruled "ice_crystal can ONLY serve one master… M-15 Create primary"; ledger §2 reserves each boss's signat
S12	naturalist	drop	M-34	AMBIG	naturalist:glow_goop → ars_nouveau:imbuement (M-10)	naturalist large predator drops → economy M-34 (combat-route supply)	combat-supply re-anchors on alexsmobs' kept versions — that slate's row, not naturalist's; this row's item basis was partly invented.	v0.7.0 dedupe denies naturalist:bear + naturalist:rattlesnake spawns (config/incontrol/spawn.json); digest has no "bear 
P1	numismatics	drop	M-26	AMBIG		blaze_banker (requires blaze rods)→survival (consumption sink) M-26	mechanism-pending pattern; refile as an issue if banker-fuel still wants pursuing.	no blaze_banker recipe in the digest and no rod-upkeep documented anywhere (dossier: "stokes the bank" only); per-transa
S15	quark	drop	M-12	motif-exact	NEW <quark:crab_shell> → via create:milling → minecraft:bone_meal x2	quark crop/food storage_blocks (apple_crate, carrot_crate, potato_crate, sugar_cane, etc.)	violates the anti-arbitrage rule; without the nugget it merely duplicates vanilla crafting — loop-inert either way.	crates already compress AND uncompress on the crafting table (quark:building/crafting/compressed/apple_crate{,uncompress
S15	quark	drop	M-10	motif-exact	quark:ancient_wood (Glimmering Weald underground biome) → ars_nouveau:imbuement (arcane in	quark:ancient_bookshelf (Glimmering Weald) → ars_nouveau:enchanting_apparatus (power bonus	variant bookshelves boosting the vanilla enchanting table is native Quark behavior already; nothing authorable remains in this row.	false premise — the Ars enchanting_apparatus draws Source from jars/pedestals, not bookshelves; there is no bookshelf-po
S05	rechiseled	drop	M-28	NONE		rechiseled high-detail stone variants → economy M-28	demand-gate with no scarcity behind it — colony already requests stone natively; forking style packs is disproportionate for a value-inert hop. DROP; Create anc	builder requests are schematic-driven, not config — pack has zero custom Structurize style packs (no structurize/minecol
S07	rechiseledcreate	drop	M-04	NONE		rechiseledcreate chiseled stone/window blocks → create:crushing (M-04 deco-recycle)	island reading is a metric gap (rechiseled:chiseling edges unparsed by connectivity.py) — fix tooling, not 242 crush recipes.	dossier: chiseling converts within a recipe family 1:1 (base blocks included); absent from shipped 35-web-bridges.js, wh
S17	ribbits	drop	M-08	AMBIG	ribbits:toadstool / brown_toadstool → occultism:spirit_fire M-11	ribbits amethyst-shard trade → economy M-08 (player-minted currency framing)	Ribbit merchants natively sinking shards for swamp goods stays as ambient flavor; wiring NPC barter deeper into the player economy is against the player-run doc	shipped coin policy (config/createblockchain-common.toml header): one FE-priced mint, ~10x gated, SPUR-only, "never a mo
S19	s_a_b	drop	M-06	NONE		s_a_b:hardsteelblock/doublesteelblock→create M-06	slate premise ("springs from a mixing bowl") is false in 1.4.3; per-block sequenced_assembly on bulk hull material grinds warship building, adds no edge.	digest recipes s_a_b:compacting/{light,steel,hard,double}_steel_block — native ladder via create:compacting of tfmg:heav
S19	s_a_b	drop	M-34	NONE		s_a_b steel plates→economy M-34	demand-gating is already done by the native TFMG-plate chain; the folded M-31 bulk-freight context stays a design lens, not an authorable recipe.	M-34 is combat-route supply (danger output), not factory output; the slate itself cut cataclysm's analogous M-34 row ("t
S10	t_and_t	drop	M-33	fuzzy	t_and_t→economy	t_and_t→economy (M-33 trading_floor stall seeding)	deco-crush class; re-express the "villages are trade hubs" intent as wiki/onboarding copy, zero authoring.	no config surface exists (trading_floor digest: one block; T&T structures are NBT/cristellib — injection means fragile s
P1	tfmg	drop	M-08	fuzzy	tfmg:steel→aeronautics M-23	tfmg:steel→economy M-08	keep the regional trio tin/silver/palladium as mint metals; steel is the hull metal, not the settlement medium.	recipes/05-metals.js unified ALL steel into one pool; the slate itself CUT ironworks steel-mint for coin inflation — sam
P1	trading_floor	drop	M-08	fuzzy	trading_floor:trading_depot → economy (cross-route bridge + colony labor)	trading_floor:trading_depot → economy (Create-processed goods → player-minted coin / emera	M-08 credit lives at the numismatics mint chains; a villager-emerald loop is the pattern the player-run rework killed.	the block ONLY automates villager trades (dossier: 1 block, no recipe types); emeralds are its medium; the ratify-note's
S15	underground_village	drop	M-08	NONE		underground_village Stoneholm chest loot → loot-seed (numismatics coin)	v2.0 jar already pays exploration richly: emeralds plus Create components in worker rooms (tools/mod-data/loot/underground_village-2.0).	createblockchain piggy_bank CUT states the rule verbatim ("chest loot coins = NPC coin faucet, contradicts the player-ru
S15	underground_village	drop	M-04	NONE		underground_village Stoneholm structure blocks (dismantled) → create:crushing (M-04 deco r	vanilla stone-brick crushing is a pack-wide call for the batch, not this mod's weave; the row is a no-op as scoped.	digest: mod registers 0 blocks / 0 items; the row's "Stoneholm stone bricks / cobblestone / deepslate brick" are minecra
S13	valarian_conquest	drop	M-02	fuzzy	valarian_conquest faction loot (shields, armor, weapons) → economy M-08	valarian_conquest boss/elite drops (faction lord relics) → magic M-02	unauthorable both ways — no entity loot hook, and the relic would be invented content; re-filed under custom below.	loot digest = blocks/ tables only, zero entities/ tables; no relic-class item among 319 items
P2	aeronautics	mark-done	M-23	fuzzy	adjustable_burner fuel→create/aeronautics	aeronautics structural alloy→create (hull + drivetrain)	M-24 half thoroughly shipped. M-23 "hull" half is void — ships are free-form block builds, no hull-item registry to gate.	spine/54-weave-aeronautics.js (control ladder, TFMG circuits, Additions electric, Crafter builds) + 50-cross-tier.js (sm
P1	aeroworks	mark-done	M-24	NONE		NEW aeroworks:gyroscope/mechanical_servo/stepper_servo/joystick → via create:mechanical_cr	the whole 4-item mod is woven inbound AND consumed outbound; no further weave needed.	spine/54-weave-aeronautics.js re-authors all four items; spine/50-cross-tier.js makes aeronautics:smart_propeller consum
P2	aileron	mark-done	M-34	AMBIG	NEW aileron:cloudskipper + aileron:smokestack (enchants) → via ars_nouveau:enchantment (ap	aileron loot tables (enchant books) → survival	the mod already does this row; extending to modded dungeon tables is optional low-value polish.	loot digest — aileron:chests/end_city_treasure_elytra_enchants natively injects cloudskipper/smokestack books into minec
P2	ars_nouveau	mark-done	M-01	AMBIG	Wilden Guardian summon timing → magic (celestial gate)	foreign essences/lapis/amethyst → magic (M-01 hub)	hub exists; further mineral lanes are depth, not gaps.	33-magic-web-spine.js (arcane_essence both directions + occult essence on/off-ramps, allurite/lumiere-catalysed); lapis/
P2	ars_nouveau	mark-done	M-02	AMBIG		farm/mob surplus → survival (Sourcelink passive drain)	native mechanic, no pack artifact required; surface in wiki.	Agronomic/Vitalic Sourcelinks generate from crop growth and mob deaths natively; the row itself says "no recipe needed" 
S07	astikorcartsredux	mark-done	M-20	AMBIG		plow/reaper iron blade → create (M-20)	keystone supersedes the blade-level delivery (digest: plow has no iron natively); do not double-gate a daily tool.	kubejs/server_scripts/recipes/91-astikor-carts.js — wheel rebuilt around create:shaft, transitively gating all ~55 carts
S19	cataclysm	mark-done	M-15	fuzzy	cataclysm:amethyst_crab_meat (Blessed)→survival	cataclysm:ancient_metal_ingot→create	delivery differs from slate (mechanical_crafting gate, not sequenced_assembly) — a real equivalent; ladder exceeds the slate.	spine/40-gates.js T3 — aeronautics:gyroscopic_propeller_bearing requires cataclysm:ancient_metal_ingot via create:mechan
S17	chefsdelight	mark-done	M-26	NONE		chefsdelight feast-tier meals (Roast Chicken / Honey Glazed Ham) → diet-system consumption	row also mis-attributes FD items to chefsdelight; no authoring remains, the sink is live.	the named feasts are farmersdelight ids (FD digest; chefsdelight registers 0 items), and shipped Appleseed auto-derives 
P1	create_ironworks	mark-done	M-30	fuzzy	tin (c:ingots/tin, regional)→economy via player-minted coin	tin ore→economy via regional scarcity gate M-30	the KEEP's exact ask (confirm GTMOGS entries) is shipped reality.	kubejs/data/pcmc/gtmogs/ore_vein/tin.json + all three native ironworks biome-modifiers overridden neoforge:none
S14	create_jetpack	mark-done	M-06	NONE		create_jetpack:netherite_jetpack→create:sequenced_assembly (M-06, times=7 ACCEPT)	sequenced_assembly-as-specified needed a transitional item the mod lacks (digest: 4 items, no incomplete_*); the Crafter build is the real equivalent.	spine/40-gates.js T4 mechanical_crafting (electron_tube + precision_mechanism + advanced_energiser + 4 netherite + key),
S14	create_jetpack	mark-done	M-15	NONE		create_jetpack:netherite_jetpack→boss-drop gating (M-15, times=5+4+1+1 ACCEPT)	shipped v0.7.0, playtest-pending per file header; nothing left to author.	spine/40-gates.js keys the grid on cataclysm:cursium_ingot (Maledictus); no smithing bypass remains
S14	create_jetpack	mark-done	M-05	NONE		NEW create_jetpack:jetpack → via create:mechanical_crafting + createaddition:capacitor → e	beyond-slate shipped reality superseding the old M-05 CUT ("recipe-only tweak") — don't re-propose jetpack weaves.	spine/57-jetpacks.js (re-author + create_sa's four jetpacks disabled, #87); spine/00-tiers.js lists create_jetpack:jetpa
S04	create_new_age	mark-done	M-30	AMBIG	create_new_age:energising (method)→magic	create_new_age:thorium_ore (regional, 2 biome-modifiers)→economy	default worldgen disabled, GTMOGS vein is sole source; sporadic tfmg:lithium co-located.	kubejs/data/pcmc/gtmogs/ore_vein/thorium.json (biomes #pcmc:vein_thorium) + kubejs/data/create_new_age/neoforge/biome_mo
S01	create_sa	mark-done	M-17	NONE		brass_exoskeleton_chestplate → create via FE charging	as-ratified charging was unauthorable (gear holds no FE, burns engine fuel); the electric seam landed as build-cost instead.	spine/56-weave-stuff-additions.js — brass_exoskeleton mechanical_crafting requires 2x createaddition:capacitor (the earl
S01	create_sa	mark-done	M-06	NONE		NEW create_sa engines + power gear → via tier-anchored assembly seams → create/tfmg/aerona	beyond-slate shipped reality; future sweeps confirm, don't re-propose engine/jetpack/drone weaves.	spine/56 (heat_engine on createlowheated:basic_burner, steam_engine on c:ingots/steel, drill→createoreexcavation:drill, 
S05	create_train_parts	mark-done	M-20	NONE		create_train_parts brass/copper sliding windows + train steps → create:pressing (pressed s	native equivalent is stronger than the proposed sheets (casings sit above sheets in processing depth); no kubejs needed — close the row as natively satisfied, d	0.4.0 jar's STOCK recipes already gate every window/step/slide on create casings (brass_casing/copper_casing/andesite_ca
P1	createaddition	mark-done	M-24	AMBIG	createaddition:charging → irons_spellbooks FE-chargeable magic gear	createaddition:rolling → aeronautics wiring (copper/electrum wire as control-surface harne	shipped as sheets/motors rather than wire — same edge, satisfied.	spine/54-weave-aeronautics.js — electrum_sheet into aeroworks:joystick, electric_motor into stepper_servo; smart_propell
P1	createaddition	mark-done	M-29	AMBIG	createaddition:charging → irons_spellbooks FE-chargeable magic gear	NEW createaddition:capacitor/electric_motor/copper_wire → via create:mechanical_crafting →	beyond-slate shipped reality; recorded so future sweeps confirm instead of re-proposing.	spine/51-weave-additions-tfmg.js (all T3 machines need Additions parts; capacitor = the T3 token w/ overcharged_iron) + 
S15	createblockchain	mark-done	M-08	AMBIG	createblockchain:mining_core (geode worldgen consumable) → M-30 regional-scarcity gate on 	createblockchain:currency_miner FE intake → Create-Addition FE sourced from scarce regiona	the row's "document the config chain" intent is delivered via cost levers. [BALANCE-PENDING: 10x FE + steep global ramp may dead-end the miner vs produce-and-tr	config/createblockchain-common.toml ships the design pass: baseEnergyPerCoin 830k→8.3M (~10x), difficultyInterval 110→25
S06	createimmersivetacz	mark-done	M-12	AMBIG	createimmersivetacz:twelve_gauge_shell / rounds → economy (M-26 consumption sink)	createimmersivetacz:nitropowder_bucket → create (M-12 via tfmg:vat_machine_recipe)	shipped equivalent with CBC sourcing (cross-weapons-industry seam); mixer→tfmg-vat swap adds no loop motion; chain playtest-settled (24-artillery-seams.js).	kubejs/data/createimmersivetacz/recipe/nitropowder_fluid.json (create:mixing of createbigcannons:nitropowder) + primer_f
S10	createlowheated	mark-done	M-26	NONE		createlowheated:basic_burner solid-fuel consumption → consumption sink (fuel demand)	the "verify required not optional" ask is answered by the shipped ladder. [BALANCE-PENDING: fuel burn rate vs T2 throughput]	native passive-heat removal confirmed and built around in spine/20-power-ladder.js (lowheated→heated→superheated ladder;
S10	createlowheated	mark-done	M-05	NONE		createlowheated lowheated heat-tier → woven Create basin recipes require managed heat	residual is a tier-tuning question — spine doc says don't hand recipes "heated" where "lowheated" serves; retune shipped magic steps per ladder guidance. [BALAN	companion delivery shipped exactly (spine/20-power-ladder.js re-authors basic_burner from #c:plates/iron + #c:netherrack
S19	domum_ornamentum	mark-done	M-04	NONE		domum_ornamentum Create-processed-stone→create (architects_cutter)	native combinatorial input; nothing to author; strike from the PLUMB batch backlog.	dossier — architects_cutter natively consumes arbitrary full blocks incl. modded (Create casings/stone work today); 35-w
S19	domum_ornamentum	mark-done	M-28	NONE		domum_ornamentum colony-builder-demands-DO-blocks	native demand gate; authoring hut-requirement config would duplicate what blueprints already do.	dossier — DO is MineColonies' decoration backbone; default blueprints request DO blocks natively, builder demand live wi
S04	drones	mark-done	M-05	NONE		drones:iron_rotor→create (M-05)	shipped as a shaped Create-parts recipe rather than mechanical_crafting; lighter than slate delivery but the gate is real and tier-appropriate.	kubejs/server_scripts/recipes/90-drones.js — iron_rotor = create:iron_sheet + copper + create:shaft (frame/controller/dr
S04	drones	mark-done	M-06	NONE		drones:ion_thruster→create (M-06)	real equivalent shipped (marquee parts, no SA chain); optional v0.9.0 depth upgrade to sequenced_assembly remains valid but not required for the loop.	90-drones.js — ion_thruster = create:propeller + 2x electron_tube + createaddition:electric_motor
S01	expandeddelight	mark-done	M-30	fuzzy	expandeddelight:cheese_wheel (aged) → economy	expandeddelight:salt_ore regional spawn → economy	exactly the ratified ask, already real; only the M-03 crush remains on salt.	kubejs/data/pcmc/gtmogs/ore_vein/salt.json (weight 25, biomes #pcmc:vein_salt = ocean+beach) + salt as companion in lith
S07	farmersdelight	mark-done	M-12	AMBIG	farmersdelight seasonal crops (cabbage/tomato/rice/onion) → survival (M-16 seasonal reagen	farmersdelight crops → create (M-12 milling/cutting → flour, meal, paste)	core exists natively; "full crop range" extension is gold-plating (vegetables cut, not mill) — runtime-dump native coverage before adding anything.	digest made-by: FD jar natively ships create:milling/mixing/filling inbound; 81-decoration-metal.js adds create:iron_she
P1	galosphere	mark-done	M-07	fuzzy	galosphere palladium ore→create M-03	galosphere:allurite_shard / lumiere_shard→magic M-07	reserved role intact and growing; nothing displaced.	recipes/33-magic-web-spine.js attunement pedestals (allurite/lumiere) + 80-securitycraft.js laser_block consumes allurit
S08	gamediscs	mark-done	M-05	NONE		console components → via Create parts (precision_mechanism / electron_tube / createadditio	loot file itself flags rates as a starting preset. [BALANCE-PENDING: disc drop chance vs modded-structure chest density]	99-gamediscs.js re-shapes all 5 components + console; 40-gamediscs-loot.js seeds discs at 6/3/1.5% across all chest tabl
S01	hpm	mark-done	M-05	motif-exact	hpm:largehull / largemast → create (M-05/M-23 via create:mechanical_crafting)	hpm:hand_cannon → create (M-05 via create:pressing + tacz:gun_smith_table_crafting)	real equivalent, deliberately shallower than ratified — file header keeps flintlocks "not TaCZ-deep"; gun_smith_table half dropped by design.	recipes/95-swashbucklers.js — hand_cannon + hand_mortar re-shaped onto create:iron_sheet + andesite_alloy
S06	immersive_armors	mark-done	M-05	fuzzy	immersive_armors finished armor sets (Heavy/Divine/Steampunk) → economy (emergent trade by	immersive_armors Heavy / Steampunk sets → Create (create:pressing + create:mechanical_craf	shipped exceeds slate — Warrior set also routed; organic sets deliberately left vanilla (coherence over forced grind).	kubejs/server_scripts/recipes/10-immersive-armors.js — Heavy=iron_sheet+iron_block; Steampunk=brass_sheet+precision_mech
S08	immersive_paintings	mark-done	M-12	NONE		painting/graffiti (+glow variants) → via create:deploying / create:mixing → Create	no further weave wanted; uploads stay locked server-side (#94).	23-immersive-paintings.js (4 raw-JSON recipes; tag-ingredient workaround documented; playtest tracked on #234)
P2	irons_spellbooks	mark-done	M-01	fuzzy	irons_spellbooks apothecarist-mob-drops→magic (ritual/transmutation)	irons_spellbooks arcane_essence→magic (arcane-currency bond)	exactly as the ledger reserved it; nothing left to author.	33-magic-web-spine.js — source→arcane_essence (imbuement + allurite) and arcane_essence→source (apparatus + lumiere), an
P2	irons_spellbooks	mark-done	M-03	AMBIG	irons_spellbooks apothecarist-mob-drops→magic (ritual/transmutation)	irons_spellbooks mithril_ore→create (ore-doubling)	shipped chose raw-doubling + XP over the row's pyrium-dust byproduct — equivalent in function; close as done.	36-magic-web-create.js — both ore variants crush to 2x raw_mithril + xp(0.25); blasting chain untouched
P2	irons_spellbooks	mark-done	M-26	AMBIG	irons_spellbooks apothecarist-mob-drops→magic (ritual/transmutation)	irons_spellbooks scrolls→survival (consumption sink)	nothing to author; counts as the magic economy's demand-renewal edge as-is.	native mechanic (one-shot consumable casts, dossier); the row's own delivery field says "native mechanic"
S01	kobolds	mark-done		AMBIG	kobold combat drops (skulls, from raiding Dens) → economy (combat specialist → magic user 	NEW kobold entity loot → via kubejs loot-table override → gaia scavenger drops	beyond-slate shipped reality, currently loop-inert flavor; gains motion only when gaia's drop-only pile gets sinks — route there, don't double-author.	kubejs/data/kobolds/loot_table/entities/kobold.json (grimoireofgaia:fur 0-2, c:nuggets/iron 0-3, rare box_iron/bag_arrow
P1	mcwfences	mark-done		fuzzy	mcwfences metal fence variants → create:crushing (M-04 deco-recycle)	NEW mcwfences metal fences ← create:iron/copper/golden_sheet → via replaceInput	inbound Create tie shipped beyond the slate; complements, not replaces, the M-04 crush.	recipes/81-decoration-metal.js routes all mcwfences metal ingots to pressed sheets
S02	mcwroofs	mark-done		AMBIG	mcwroofs stone/brick/andesite/deepslate roof variants → create	NEW mcwroofs metal-ingot inputs → via event.replaceInput → create pressed sheets	slate never recorded this; mcwroofs already holds a shipped second-system tie — record in ledger.	recipes/81-decoration-metal.js:24 routes mcwroofs (with mcwdoors/mcwwindows/etc.) iron/copper/gold ingots → create:*_she
S06	mffs	mark-done	M-05	AMBIG	mffs projector delivery → economy (colony Fortress research gate + service-for-hire)	mffs:projector / interdiction_matrix → create (native-method gating + sequenced-assembly)	the pack's reference Create weave; the slate row itself marked it already-authored.	kubejs/server_scripts/recipes/60-mffs.js — focus_matrix gated on create:electron_tube; projector/interdiction_matrix seq
S14	moblassos	mark-done	M-28	AMBIG	hostile_lasso (weakened monster capture) → magic via occultism spirit delivery	emerald_lasso (villager capture)→economy via MineColonies colony seeding	recipe in place and better-themed than asked; the colony-seeding behavior is live emergent value.	recipes/22-mob-lassos.js re-authors emerald_lasso (golden_lasso + c:gems/emerald + c:ingots/brass — the trade metal); th
S14	moblassos	mark-done	M-37	AMBIG	hostile_lasso (weakened monster capture) → magic via occultism spirit delivery	diamond_lasso→MineColonies research gate ("capture anything" unlocked by colony University	the DEFER's intent ("too powerful to be materials-only") landed as a boss-key gate — clear the M-37 variant from playtest routing.	22-mob-lassos.js diamond_lasso consumes any #pcmc:boss_keys drop (the flat roster's first consumer; 05-tags.js comment "
S14	moblassos	mark-done	M-05	AMBIG	hostile_lasso (weakened monster capture) → magic via occultism spirit delivery	NEW moblassos lasso family → via create:electron_tube/precision_mechanism re-craft + boss-	beyond-slate shipped reality superseding the slate's M-05 CUT reasoning — future sweeps confirm, don't re-propose lasso weaves.	22-mob-lassos.js (#171): golden=Create electronics, hostile=cataclysm:monstrous_horn, aqua/emerald branch off golden; It
S02	modulargolems	mark-done	M-15	NONE		boss-drop metals (Cataclysm cursium / Ice&Fire dragonsteel) → modulargolems:golem_assemble	native equivalent — a cursium golem body already costs cursium by construction; authoring would duplicate the mod's own mechanic.	native part-casting already consumes the boss metal (dossier: dragonsteel/cursium bodies, "already pulls modded boss-tie
S02	modulargolems	mark-done	M-10	NONE		golem-core upgrade slot → ars_nouveau:imbuement (source_gem / arcane core) (M-10)	shipped as alternative Ars route to empty_upgrade, not a hard capability gate; v0.11.0 may still deepen top-tier arcane golems.	recipes/35-magic-web-mobs.js:31 `imbue('modulargolems:empty_upgrade','ars_nouveau:source_gem',400)` — Ars path into the 
S14	mowziesmobs	mark-done	M-15	motif-exact	earthrend_gauntlet (Wroughtnaut drop)→create via boss-key gate	ice_crystal (Frostmaw drop)→create via boss-key sequenced_assembly gate	delivery landed shaped+tag rather than sequenced_assembly/cold-tier — real equivalent; the sculptor_staff alternative satisfies no-chokepoint.	spine/40-gates.js T3 reinforced_energiser keyed on #pcmc:mowzies_mid (05-tags.js: ice_crystal + sculptor_staff); ice_cry
