chunk	mod	action	motif	match	matched_link	ref	note	evidence
S05	fxntstorage	rescope	M-06	motif-exact	fxntstorage hardened_backpack→create (sequenced-assembly)	fxntstorage hardened_backpack→create (sequenced-assembly) M-06	rescope: register pcmc:incomplete_* component (57-jetpacks/60-mffs pattern), build a "hardened pack frame" via SA, and have native backpack_crafting consume IT 	stock hardened recipe is the mod's OWN fxntstorage:backpack_crafting type (brass_backpack + railway_casing), an in-place
S04	gnkinetics	rescope	M-24	motif-exact	gnkinetics planetary/worm/industrial-gear→aeronautics (drivetrain)	gnkinetics planetary/worm/industrial-gear→aeronautics (drivetrain) (M-24)	weave survives, delivery doesn't: rescope to the engine/gearbox seam (simulated:engine_assembly — a reduction gearset IS an engine core); coordinate with create	named slots shipped otherwise — 54-weave-aeronautics.js gave propeller_bearing create:cogwheel ("keep it simple", delibe
S01	hpm	rescope	M-06	motif-exact	hpm:corvette_steamship_item → create (M-06 sequenced_assembly)	hpm:corvette_steamship_item → create (M-06 sequenced_assembly)	hold the 20x-ACCEPT design on file; author the sequenced_assembly only when upstream ships the steamship finished.	corvette has NO native recipe in the 2.6.6C digest (summon-only WIP, dossier confirms); authoring a player route hands o
S01	hpm	rescope	M-12	motif-exact	hpm:cannonball / mortar_ball → create (M-12/M-29 via createbigcannons:cartridge_assembly o	hpm:cannonball / mortar_ball → create (M-12/M-29 via createbigcannons:cartridge_assembly o	drop the CBC half (ownership); deliver M-12 as an ADDITIVE create:compacting bulk route — hand-craft stays, factory outproduces it. [BALANCE-PENDING: bulk ratio	native cannonball = smooth_stone+TNT (not iron, contradicting the KEEP's premise); 95 header deliberately left ammo unto
S06	immersive_armors	rescope	M-10	motif-exact	immersive_armors:divine_chestplate set → magic (ars_nouveau:enchanting_apparatus)	immersive_armors:divine_chestplate set → magic (ars_nouveau:enchanting_apparatus)	deliver as enchanting_apparatus recipes for divine pieces (reagent robe piece; pedestals golden_sheets+source_gem, totem/emerald kept), replacing the shaped swa	shipped 10-immersive-armors.js routed Divine through Create only (golden_sheet+precision_mechanism+totem); slate's "armo
S15	mcwdoors	rescope	M-28	motif-exact	mcwdoors→economy	mcwdoors→economy	corrected delivery: minecolonies crafterrecipes datapack teaching the Sawmill the mcwdoors families; optional custom schematic pack creates the request pull.	MineColonies builders only request blocks present in schematics — stock blueprints use vanilla doors, so the ratified "c
P1	mcwfences	rescope	M-28	motif-exact	metal fence variants → MineColonies builder orders	metal fence variants → MineColonies builder orders M-28	keep, but rewrite the delivery as schematic work; as written it never fires.	builders request what schematics specify; no "request config" knob exists — delivery means editing shipped style packs (
S12	more_slabs_stairs_and_walls	rescope	M-28	motif-exact	more_slabs_stairs_and_walls stone variants → economy (M-28 colony route)	more_slabs_stairs_and_walls stone variants → economy (M-28 colony route)	re-deliver as emergent — builders requisition MSSW cuts from player-scanned schematics, Create saws supply; wiki/design copy, no recipe artifact; else fold into	stated delivery "config/MineColonies: hut schematic upgrades request MSSW cuts" is unauthorable — stock hut schematics d
S14	mowziesmobs	rescope	M-15	motif-exact	earthrend_gauntlet (Wroughtnaut drop)→create via boss-key gate	earthrend_gauntlet (Wroughtnaut drop)→create via boss-key gate	re-key the metalwork gate on wrought_helmet (axe stays reward gear) or re-attribute to the Sculptor; fix the 05-tags entry/comment.	loot digest: entities/ferrous_wroughtnaut drops ONLY wrought_axe + wrought_helmet; earthrend_gauntlet comes from entitie
S09	mutantszombies	rescope	M-34	motif-exact	mutant zombie variants→survival M-34	mutant zombie variants→survival M-34	weave is sound; deliver via LootJS scoped to mutantszombies entity types + existing-or-registered reagent; verify table binding in playtest.	digest loot=no + "standard zombie drops remain" means the mobs almost certainly reference the shared vanilla zombie tabl
S11	oceansdelight	rescope	M-02	motif-exact	oceansdelight:fugu_slice→magic	oceansdelight:fugu_slice→magic (M-02 alchemist_cauldron poison ink)	brew to an existing id (uncommon/rare_ink) or an Ars essence; ratify-note already says author last, drop freely. [BALANCE-PENDING: farmable fish vs scroll-tier 	irons_spellbooks:alchemist_cauldron_brew IS a registered recipe type (dossier AUTO line), but no "poison ink" id exists 
S08	pantographsandwires	rescope	M-32	motif-exact	pantographsandwires:coal_coke → Create (TFMG:coking byproduct feedstock)	pantographsandwires:coal_coke → Create (TFMG:coking byproduct feedstock)	delivery is backwards — coking produces coke, never consumes it. Rescope: tag-join tfmg:coal_coke into c:coal_coke; optionally retire the blasting shortcut so t	tfmg:coking/coal OUTPUTS tfmg:coal_coke (recipes/tfmg-1.2.0.txt); c:dusts/coal_coke already holds both mods' dusts (nati
S08	pantographsandwires	rescope	M-29	motif-exact	pantographsandwires:graphite → Create (create_new_age:energising cross-route dependency)	pantographsandwires:graphite → Create (create_new_age:energising cross-route dependency)	energising cannot take a second ingredient — unauthorable as written. Rescope: require c:ingots/graphite in New Age motor/generator shaped or mechanical_craftin	all 6 stock energising recipes are single-input (recipes/create-new-age-1.1.7c); spine/50-cross-tier.js records "New Age
S15	quark	rescope	M-10	motif-exact	quark:ancient_wood (Glimmering Weald underground biome) → ars_nouveau:imbuement (arcane in	quark:ancient_wood (Glimmering Weald underground biome) → ars_nouveau:imbuement (arcane in	corrected delivery: imbuement ancient_wood/log + Source → ars_nouveau:source_gem, tuned below the lapis route. [BALANCE-PENDING: ancient_sapling makes the wood 	the output "attuned timber reagent" is not a registered item; ledger M-01 names ars_nouveau:source_gem the universal hub
S11	rottencreatures	rescope	M-11	motif-exact	rottencreatures→magic	rottencreatures→magic (M-11 frozen+magma flesh → occultism:spirit_fire → chilled/seared es	weave right, outputs invented; rescope to occultism:demons_dream_essence per shipped precedent — NOT afrit/marid_essence (would devalue occultism's own rare dro	no chilled/seared essence id exists in occultism digest; shipped idiom (35-magic-web-mobs.js) spirit-fires into EXISTING
S11	rottencreatures	rescope	M-19	motif-exact	rottencreatures→create	rottencreatures→create (M-19 magma_rotten_flesh → create:haunting → infused smoldering rea	rescope output to existing item, e.g. minecraft:magma_cream (soul-fire renders the taint out); keeps the starved Create→magic seam without inventing ids.	no "smoldering reagent" item in any digest; haunting output must be an existing id
S11	rottencreatures	rescope	M-34	motif-exact	rottencreatures→economy	rottencreatures→economy (M-34 Dead Beard treasure_chest seeded with Numismatics coin denom	seed the chest with bullion/trade goods (the M-08 mint metal once v0.13.0 defines it); combat specialist sells to the minter — keeps flavor AND mint monopoly.	WEAVE-LEDGER reagent table: numismatics coins are "minted by players (M-08), never an NPC sink"; M-14/M-21 cut as NPC co
S15	sky_whale_ship	rescope	M-15	motif-exact	sky_whale_ship loot chests → aeronautics M-15	sky_whale_ship loot chests → aeronautics M-15	deliver via LootJS (installed) structure-scoped injection of aeronautics:levitite_blend / gyroscopic_propeller_bearing / create:copper_casing; first verify whal	"balloon silk" / "airframe blueprint fragments" are not registered ids (aeronautics digest has envelopes, levitite_blend
P1	sliceanddice	rescope	M-29	motif-exact	sliceanddice sprinkler (fluid-area dispenser) + magic potion fluid→magic	sliceanddice sprinkler (fluid-area dispenser) + magic potion fluid→magic M-29	verify the fluid-effect API (runtime/code check) before v0.11.0; if hardcoded, demote to a build-task issue.	sprinkler fluid behaviors are code-side ("water wets, lava fire, others = effects" — dossier); no in-pack growth-boost f
S10	snowyspirit	rescope	M-12	fuzzy	snowyspirit ginger→create (milling)	snowyspirit ginger→create (milling)	re-deliver as create:mixing automation of extradelight's ginger goods (e.g. #c:crops/ginger + sugar → extradelight:candied_ginger); same loop edge, real output 	no ground-ginger item exists in any pack digest (extradelight's processed forms are candied_ginger/ginger_beer/pickled; 
S18	spawn	rescope	M-31	motif-exact	spawn clam/crab bulk catch → aeronautics logistics M-31	spawn clam/crab bulk catch → aeronautics logistics M-31	RESCOPE to an M-36 fit-flag on #238 — seafood as the flagship perishable cargo; drop the v0.13.0 config row.	the row's load-bearing mechanism is perishability, which is M-36 — mechanism-pending build #238 (hard rule: flag fits, n
S19	stylecolonies	rescope	M-28	fuzzy	stylecolonies High Magic blueprint style → magic	stylecolonies High Magic blueprint style → magic	verify style BOMs (jar blueprints or in-game) before counting the edge; also audit styles referencing absent mods' blocks.	no source shows Ars/Occultism blocks in High Magic; dossier's modded-block styles cite BYG/Quark/Create/Twilight Forest 
S05	supplementaries	rescope	M-12	motif-exact	supplementaries:flax→create M-12	supplementaries:flax→create M-12	rescope: create:milling flax → string ×2 + flax_seeds chance (real items, parallels wheat milling); oil branch needs no authoring.	no linen/flaxseed-oil items exist in jar (digest 3.6.7); oil half is ALREADY native — createaddition:compacting/seed_oil
S05	supplementaries	rescope	M-23	motif-exact	supplementaries:flax/rope→aeronautics M-23	supplementaries:flax/rope→aeronautics M-23	rescope: swap deployed stick→supplementaries:rope in the 16 deploying recipes (rope rigs the wool envelope); same remove/re-add pattern the file already uses.	v0.7.0 shipped envelopes as deploying-ONLY (54-weave-aeronautics.js removed all 16 shaped recipes); stock deploying = st
S10	t_and_t	rescope	M-08	motif-exact	t_and_t→economy	t_and_t→economy (M-08 coin loot-seed)	reseed the same chests with scarce mint-METAL (raw regional tin/silver) + trade goods; exploration still feeds the economy, coin supply stays player-minted.	M-14 was CUT for "minted coin from outside the player economy"; reagent table: numismatics:* is player-minted, M-08's wh
S19	terralith	rescope	M-31	motif-exact	terralith rare/fantastical biomes (Skylands, Moonlight Grove, Mirage Isles) → aeronautics 	terralith rare/fantastical biomes (Skylands, Moonlight Grove, Mirage Isles) → aeronautics 	now authorable — key a high-value vein to terralith:skylands in the shipped pcmc vein tags; needs height-range fit + runtime check. [BALANCE-PENDING: which vein	no vein tag references terralith:skylands (grep kubejs/data); terralith adds zero blocks, so the Skylands hold nothing e
S19	terralith	rescope	M-22	motif-exact	terralith Moonlight Grove / lunar biomes → magic M-22 (lunar/celestial reagent gate)	terralith Moonlight Grove / lunar biomes → magic M-22 (lunar/celestial reagent gate)	biome half shipped via mithril vein; rescope the lunar half to an Enhanced-Celestials event gate on an existing method, not a custom herb.	shipped vein_mithril.json keys irons_spellbooks:mithril_ore to moonlight_grove/mirage_isles — the biome-exclusive magic 
P1	tfmg	rescope	M-23	motif-exact	tfmg:steel→aeronautics M-23	tfmg:steel→aeronautics M-23	re-aim delivery at high-tier flight-machine/structural blocks; the hull-recipe surface does not exist.	Aeronautics ships are free-form block builds — there are no "hull construction recipes" to key steel into; spine/54-weav
S08	touhou_little_maid	rescope	M-10	motif-exact	touhou_little_maid:broom (endgame rideable flight item)→magic	touhou_little_maid:broom (endgame rideable flight item)→magic	weave right, one reagent wrong: strike the source_gem variant, deliver via occultism spirit essence per the reagent table. Altar serializer is KubeJS-reachable 	the KEEP lists "Ars source_gem" as a catalyst option, but source_gem is M-01-reserved — and the slate's own TLM CUT row 
S20	trek-b0.6.1.1	rescope	M-08	motif-exact	trek structures (ship holds, pyramid chests, fortress rooms)→economy	trek structures (ship holds, pyramid chests, fortress rooms)→economy	seed Create components / raw coin-metal salvage, not minted coins — keeps exploration-pays while preserving minting as the M-08 specialization.	WEAVE-LEDGER §2 reserves numismatics:* as "minted by players (M-08), never an NPC sink"; M-14 was cut for exactly "curre
S02	upgrade_aquatic	rescope	M-30	motif-exact	upgrade_aquatic raw/cooked fish (regional ocean good) → economy	upgrade_aquatic raw/cooked fish (regional ocean good) → economy (M-30)	deliver as a constraint on M-12 authoring — ≥1 dish/recipe demands UA-specific fish (raw_pike/raw_perch item or tag), preserving the regional pull.	delivery field is "emergent"; M-30's method is region-locked input → recipe input; the M-12 tag-join alone would let any
S13	valarian_conquest	rescope	M-05	motif-exact	valarian_conquest armorsmith / builder stations → create M-05	valarian_conquest armorsmith / builder stations → create M-05	no recipes exist to gate; rescope: ADD crafting recipes FOR the station blocks (armorsmith/builder/barber_surgeon) requiring Create iron sheets/brass.	tools/mod-data/recipes/ has no valarian file (jar ships ZERO data recipes; dossier: no registered recipe-types)
S13	valarian_conquest	rescope	M-08	motif-exact	valarian_conquest faction loot (shields, armor, weapons) → economy M-08	valarian_conquest faction loot (shields, armor, weapons) → economy M-08	seeded minted coin is an NPC-class faucet bypassing the minter; rescope to spoils + mint-metal feedstock; jar registers no chests/ tables — needs structure-cond	M-08 reframe (#163/#240) = player-minted only; M-14 cut for "coin from outside the player economy"; kubejs has zero numi
S09	woodworks	rescope	M-28	motif-exact	woodworks→economy	woodworks→economy (M-28)	deliver as a pack colony style/blueprint set using woodworks bookshelves/chests (in-game authored, shippable), optionally + crafterrecipes supply side.	MineColonies has no config to make huts request foreign furniture; builder requests are driven by BLUEPRINT content — sh
