chunk	mod	action	motif	match	matched_link	ref	note	evidence
S16	netmusic	mark-done	M-07	NONE		(v0.7.0) netmusic:computer/cd_burner ← create:framed_glass/electron_tube + create_new_age:	shipped reality outran the slate — the ratified LEAVE predates this tie.	kubejs/server_scripts/recipes/97-netmusic.js; WEAVE-LEDGER M-07 row cites file `97` as an established seed (allurite use
P1	numismatics	mark-done	M-05	AMBIG	vendor block→economy (service-for-hire storefronts, M-33)	vendor/depositor blocks→create (native-method gating) M-05	satisfied natively plus the lock; do NOT re-gate via mechanical_crafting — the slate's own trading_floor M-05 depth logic.	recipe digest — vendor = brass_casing+electron_tube+framed_glass, brass_depositor adds sturdy_sheet, andesite_depositor 
P1	occultism	mark-done	M-03	fuzzy	occultism:silver_ingot (c:ingots/silver) → economy	occultism:silver_ingot / iesnium_ore → create M-03 (iesnium half)	iesnium half done, additive as designed.	recipes/36-magic-web-create.js crushes iesnium_ore → 2x iesnium_dust + xp nugget; dust smelts back natively
P1	occultism	mark-done	M-11	AMBIG	occultism:spirit_trade (summoned trader) → economy	foreign mob/boss drops → occultism:spirit_fire M-11	partial roster; cataclysm/deeperdarker drop-only piles still unrouted — extend with the same pattern.	recipes/34-magic-web-occult.js + 35-magic-web-mobs.js (born_in_chaos dusts/spirits, grimoireofgaia organs, mowzies folia
P1	occultism	mark-done	M-30	AMBIG	occultism:silver_ingot (c:ingots/silver) → economy	silver_ingot → regional-scarcity gate M-30	the ratify-note's exact ask, already real.	kubejs/data/pcmc/gtmogs/ore_vein/silver.json (#pcmc:vein_silver) + native gen no-op'd + silver-keyed input shipped (52-w
S05	rechiseled	mark-done	M-04	NONE		rechiseled decoration blocks → create M-04 (PLUMB)	PLUMB row is a no-op for authoring; the companion mod IS the plumbing — record DONE so the batch doesn't re-author it.	mechanism is native, not kubejs — rechiseledcreate (mods/rechiseled-create.pw.toml) ships the Mechanical Chisel that run
S19	s_a_b	mark-done	M-23	NONE		s_a_b steel plates→aeronautics M-23	M-23 economics live natively — s_a_b IS the hull material and already costs TFMG heavy plates; aeronautics-side injection is unauthorable.	native (digest) — every steel-block tier consumes tfmg:heavy_plate; aeronautics ships physics-assemble from placed world
P1	securitycraft	mark-done	M-05	AMBIG	securitycraft base-defense-installation→economy (service-for-hire)	securitycraft Universal-Block-Reinforcer→create (native-method gating) M-05	keystone strategy beats per-item gating; also threads M-07 catalyst demand.	recipes/80-securitycraft.js — laser_block (allurite shard focused through a rose-quartz lens) is the keystone the 3-tier
P1	securitycraft	mark-done	M-05	AMBIG	securitycraft base-defense-installation→economy (service-for-hire)	securitycraft sentry→create (sentry requires CBC/Create components) M-05	real equivalent shipped; the CBC-parts flavor stays optional — don't double-gate.	80-securitycraft.js portable_radar (electron_tube + createaddition copper_wire + iron sheets) feeds sentry/ims/sonic sys
S16	smokeleafindustries	mark-done	M-17	AMBIG	smokeleafindustries refined extracts / gummies → economy M-28	smokeleafindustries generator FE output → create M-17	shipped reality inverted the slate: the "redundant" M-05 gate shipped as THE anchor; M-17 bridge works by nature. Nothing left to author.	kubejs/server_scripts/recipes/93-smokeleaf.js gates ALL smokeleaf machines on create:precision_mechanism via the hemp_co
S01	tacz	mark-done	M-05	AMBIG	tacz guns/ammo → economy (combat-route supply / emergent trade)	tacz:gun_smith_table_crafting inputs → create (native-method gating, M-05)	shipped STRONGER than ratified — method replaced, not gated; the "basic guns may stay vanilla" leniency dropped with it.	remove-default-tacz-guns.js deletes the entire tacz:gun_smith_table_crafting type + the four bench blocks (#187); all gu
S01	tacz	mark-done	M-06	AMBIG	tacz guns/ammo → economy (combat-route supply / emergent trade)	tacz high-tier guns → create:sequenced_assembly (M-06 keystone)	equivalent depth, different shape; heavies gate on the artillery specialist's part, not boss keys — the remove-script comment claiming #pcmc:boss_keys/capacitor	depth shipped as component chains into mechanical_crafting (sniper = gun_barrel+firing_mechanism+gun_trigger+createbigca
S01	tacz	mark-done	M-26	fuzzy	tacz guns/ammo → economy (combat-route supply / emergent trade)	tacz:ammo (consumable) → survival + economy (continuous consumption sink, M-26)	nothing left to author. [BALANCE-PENDING: per-magazine cost vs PvPvE ammo uptake]	sink is native; the "metals via Create" pairing shipped — casing fills are sequenced_assembly (primer deploy + createimm
S19	terralith	mark-done	M-30	AMBIG	terralith Moonlight Grove / lunar biomes → magic M-22 (lunar/celestial reagent gate)	terralith biome c:tags (65) → GTMOGS regional ore-gen M-30	ratify-note's "blocked-on-worldgen-config" is cleared — the v0.7.0 ore map shipped exactly this keying.	kubejs/data/pcmc/tags/worldgen/biome/vein_*.json (22 veins) key terralith biomes, e.g. vein_silver → terralith:rocky_mou
P1	tfmg	mark-done	M-24	fuzzy	tfmg fuels→aeronautics M-13	tfmg:combustion_engine→aeronautics M-24	residual work is playtest balance, not recipes.	native ship-mounting makes TFMG engines the powerplant; spine/51-weave-additions-tfmg.js deepened every engine (mechanic
P1	tfmg	mark-done	M-29	fuzzy	tfmg fuels→aeronautics M-13	tfmg:plastic→create M-29	the magic-adjacent variant stays optional future work; row satisfied.	spine/52-weave-tfmg-newage.js reactor_heat_vent requires tfmg:plastic_sheet (etched/coated circuits gate the other New A
P1	tfmg	mark-done	M-32	AMBIG	tfmg fuels→aeronautics M-13	tfmg ore byproducts (sulfur/saltpeter/coke)→create M-32	chain complete end-to-end; coke→blast-furnace fuel is native too.	native tfmg:mixing/gunpowder (charcoal+nitrate+sulfur) → createimmersivetacz:gunpowder_fluid (create:mixing) → recipes/2
P1	tfmg	mark-done	M-30	fuzzy	tfmg fuels→aeronautics M-13	tfmg regional ores→economy M-30	crude-oil regionality is TFMG-native deposit gen — confirm its spread at playtest.	kubejs/data/pcmc/gtmogs/ore_vein/{bauxite,lithium}.json biome-locked (#pcmc:vein_*); native tfmg biome-modifiers overrid
P2	aeronautics	rescope	M-10	motif-exact	levitite_blend crystallization→magic (arcane catalyst gate)	levitite_blend crystallization→magic (arcane catalyst gate)	re-scope delivery to the JSON step: add allurite/source catalyst to the create:mixing blend recipe (jar-confirmed). Same loop edge, authorable today.	dossier status — blend→levitite crystallization is CODE, not JSON ("STILL code-only"); a KubeJS catalyst-adjacent hook h
S03	alcohol_industry	rescope	M-28	motif-exact	alcohol_industry→economy	alcohol_industry→economy	deliver via recruitment-item config + food-tag servability so cooks serve spirits; verify exact config key in-game — no minecolonies config shipped yet.	MineColonies has no "building upkeep consumes item" mechanic to config; its real demand hooks are the tavern visitor-rec
S03	alexsmobs	rescope	M-11	motif-exact	alexsmobs exotic drops (ambergris / ender_residue / void_worm parts) → magic	alexsmobs exotic drops (ambergris / ender_residue / void_worm parts) → magic	narrow inputs to ender_residue + void_worm_eye/mandible; spirit_fire delivery unchanged (shipped 34/35 schema); ambergris stays M-10's, beak M-15's.	row text double-spends ambergris (M-10's — alexsmobs' own CUT row calls this a reagent-ownership conflict) and risks the
P2	ars_nouveau	rescope	M-22	motif-exact	Wilden Guardian summon timing → magic (celestial gate)	Wilden Guardian summon timing → magic (celestial gate)	mechanism-uncertain — re-scope to gating the ritual TABLET recipe on a moon-event-obtained reagent, or prove the event hook before authoring. Enhanced Celestial	rituals are code-driven, not recipe-authorable — same reason 34-magic-web-occult.js explicitly skipped occultism:ritual;
S07	astikorcartsredux	rescope	M-28	motif-exact	astikorcartsredux:oak_seed_drill + colony Farmer hut → economy (M-28)	astikorcartsredux:oak_seed_drill + colony Farmer hut → economy (M-28)	rescope delivery to the Farmer hut block recipe consuming a seed_drill (quarry pattern); "tool upgrade" as written is unauthorable.	MineColonies farmers use hoe items; no API/config surface makes a cart entity a hut tool; 98-minecolonies.js shows hut b
S11	beachparty	rescope	M-12	motif-exact	beachparty coconut/tropical fruit → create (M-12)	beachparty coconut/tropical fruit → create (M-12)	rescope to create:milling beachparty:coconut → 2x coconut_open (existing ids; mechanizes native throw-to-open for bulk), upstream of the M-26 sink.	no coconut cream/flake id exists in ANY digest (only ecologics+beachparty have coconut ids); recipe digest: palm_bar_mix
S09	betterdungeons	rescope	M-08	motif-exact	betterdungeons loot tables→economy	betterdungeons loot tables→economy	re-deliver as seeding the mint's INPUT (scarce coin-metal/valuables) into deep chests — danger still feeds the economy, medium stays player-struck.	hard rule "economy link counts only as demand-gating"; M-14 bounty-coin and M-21 trade-coin were CUT as "currency from o
S19	bettermineshafts	rescope	M-08	motif-exact	mineshaft chest loot → loot-seed (numismatics coin)	mineshaft chest loot → loot-seed (numismatics coin)	coin-in-chest = the cut-M-14 faucet class, bypasses the mint specialist; rescope to goods-seed (LootJS rider, cf. 40-gamediscs-loot.js) or drop — GTMOGS veins a	WEAVE-LEDGER M-08 reframe (#163/#240): coins are player-minted, "no NPC coin faucets" — M-14/M-21 were cut for exactly t
P2	born_in_chaos_v1	rescope	M-30	motif-exact	born_in_chaos_v1:dark_metal → regional scarcity gate (M-30)	born_in_chaos_v1:dark_metal → regional scarcity gate (M-30)	premise fix — verify whether deposit worldgen exists at all before authoring placement config; the lock is likely already native.	dossier — dark metal is mob-drop sourced (Chaos Knight ~9%, Missionary ~16%); the mod's 50 biome modifiers already regio
S19	cataclysm	rescope	M-11	motif-exact	cataclysm:witherite_ingot / cursium_ingot (boss drops)→magic	cataclysm:witherite_ingot / cursium_ingot (boss drops)→magic	narrow M-11 input to witherite_ingot; double-routing cursium/ignitium would dilute their shipped T4 gates per the slate's own one-role-per-metal logic.	40-gates.js spent cursium (T4 jetpack gate) and ignitium (T4 reactor); witherite remains unspent — only generic #pcmc:bo
S19	cataclysm	rescope	M-12	motif-exact	cataclysm:amethyst_crab_meat (Blessed)→survival	cataclysm:amethyst_crab_meat (Blessed)→survival	cook the RAW crab meat into the prestige dish; cooking the Blessed variant would bank fight-immunity outside the dungeon. [BALANCE-PENDING: dish stats vs altar 	dossier — amethyst_bless is a one-way Sunken-City altar ceremony purpose-built for the Leviathan fight; no shipped kubej
P1	cbc_at	rescope	M-15	motif-exact	cbc_at heavy-autocannon / rocket-pod (endgame tier)→create	cbc_at heavy-autocannon / rocket-pod (endgame tier)→create M-15	this exact tier carries the CBC-5.11.3 pin crash history (CLAUDE.md) — playtest hard when authored.	ha_munition_assembly / rocket_assembly are PER-ROUND munition recipes (digest); boss-gating them taxes every shot instea
S03	charta	rescope	M-12	motif-exact	charta:empty_wine_glass / empty_beer_glass → survival	charta:empty_wine_glass / empty_beer_glass → survival	re-source the wine half vinery→create_winery; beer via create:filling or extradelight:bottle_fluid; tequila→cactus_wine_glass mapping available.	vinery was REMOVED in the v0.7.0 thunderdome (slate: its KEEP ideas "seed create_winery"); create_winery digest ships wi
S11	companions	rescope	M-15	motif-exact	companions:relic_gold → create (M-15 boss-key gate)	companions:relic_gold → create (M-15 boss-key gate)	deliver as a SPINE_GATES row on a mid-tier machine slot, not bespoke sequenced-assembly; relic_gold is the Pontiff's reserved per-boss key (reagent table).	shipped gate idiom is spine/40-gates.js SPINE_GATES rows (shaped/mechanical_crafting boss keys: cataclysm ingots, #pcmc:
S18	create_better_villagers	rescope		NONE		CBV native trade lists (Andesite/Brass/Copper Worker sell Create parts; Miner sells raw me	audit/config-cap CBV trades against 10-locks/40-gates and scarce metals before v0.9.0; per-profession config is the lever.	spine/10-locks.js walls precision_mechanism/electron_tube to Create-only RECIPES; villager trades are code-side, not rec
S04	create_cheese	rescope	M-05	motif-exact	create_cheese tier-3 maturing→Create-pressed beeswax seal (M-05, times=1 ACCEPT)	create_cheese tier-3 maturing→Create-pressed beeswax seal (M-05, times=1 ACCEPT)	inserting a second physical input in the maturing slot is unauthorable without a runtime dump; rescope: gate calendar_page_tier_3 via create:deploying honeycomb	jar digest has zero data recipes — maturing recipes are code-registered, slot schema unverifiable offline (CLAUDE.md dum
S13	create_confectionery	rescope	M-04	motif-exact	create_confectionery deco blocks (chocolate/caramel/gingerbread bricks) → create	create_confectionery deco blocks (chocolate/caramel/gingerbread bricks) → create	missed the v0.7.0 plumbing batch; rescope crush output to minecraft:cocoa_beans (lossy) and fold into the next batch.	no cocoa-powder item in any digest (real items: cocoa_butter, bars, bricks); shipped M-04 batch 35-web-bridges.js contai
S13	create_confectionery	rescope	M-28	motif-exact	create_confectionery output (candies / chocolate goods) → economy	create_confectionery output (candies / chocolate goods) → economy	rescope to teaching the colony Bakery confectionery recipes (crafterrecipes) — the M-28 alt-route-production form.	"colony requests morale/buff items" is not a real MineColonies config surface; colonists already eat edible candy native
S04	create_dragons_plus	rescope	M-23	motif-exact	create_dragons_plus:levitite_fragile_fluid_tank → aeronautics (M-23)	create_dragons_plus:levitite_fragile_fluid_tank → aeronautics (M-23)	delivery as written is unauthorable; rescope: give T4 aeronautics:pearlescent_levitite a fabrication recipe consuming the filled levitite tank — tier-coherent, 	digest — tank already crafts FROM aeronautics:levitite_blend_bucket (neoforge:mod_loaded conditional), the reverse edge;
S05	create_enchantment_industry	rescope	M-10	motif-exact	create_enchantment_industry→magic	create_enchantment_industry→magic M-10 (liquid XP as imbuement/cauldron fuel)	rescope: experience_bucket / super_experience_nugget as reagent+pedestal ITEMS on the proven imbuement/enchanting_apparatus schemas; drop the cauldron branch. W	"piped as the fuel" is unauthorable — imbuement's fuel is Source (schema {input,output,source,pedestalItems}, 33-magic-w
S20	create_hypertube	rescope	M-29	motif-exact	hypertube_entrance (sequenced_assembly) requires a magic reagent sub-component → magic	hypertube_entrance (sequenced_assembly) requires a magic reagent sub-component → magic	weave is right — deliver as irons_spellbooks:arcane_essence or ars source_gem (M-01 currency spend, ownership-consistent) in a replaced shaped entrance recipe; 	no SA chain exists to host a sub-component (entrance is crafting_shaped per recipes digest); a sub-component delivery is
S08	create_integrated_farming	rescope	M-12	motif-exact	roost egg/feather/poultry output → survival (via farmersdelight:cooking)	roost egg/feather/poultry output → survival (via farmersdelight:cooking)	nothing to author — the edge is native. Real finding: all 9 duck/goose roosts are dead content (untitledduckmod absent) — a curation or mod-add call, not recipe	loot/create-integrated-farming-1.2.2.txt: gameplay/roost/chicken → minecraft:egg; duck/goose tables output untitledduckm
S08	create_integrated_farming	rescope	M-28	motif-exact	roost/net bulk outputs → economy (colony supply via MineColonies hut requests)	roost/net bulk outputs → economy (colony supply via MineColonies hut requests)	deliver via crafterrecipes consuming eggs/fish (Cook/Baker); note only the chicken stream is live (see the M-12 dead-content finding).	same gap as extradelight M-28 — "request list" config doesn't exist; colonist food demand + crafterrecipes datapack is t
P1	create_ironworks	rescope	M-23	motif-exact	steel_plate / bronze_plate→aeronautics hull (M-23) + drivetrain (M-24)	steel_plate / bronze_plate→aeronautics hull (M-23) + drivetrain (M-24)	rescope to bronze/tin early-tier flight parts; free-form hulls have no recipes (same correction as tfmg M-23).	recipes/05-metals.js deleted ironworks' steel_sheet press ("the assembly is the canonical route") — the steel half now d
S04	create_new_age	rescope	M-24	motif-exact	create_new_age advanced_motor / reinforced_motor / generator_coil→aeronautics	create_new_age advanced_motor / reinforced_motor / generator_coil→aeronautics	control slots taken (T3 Additions); rescope to the engine seam — simulated:engine_assembly / portable_engine line (62-machines-misc.js) — CNA=T4 tier-coherent, 	54-weave-aeronautics.js shipped the control seam on createaddition:electric_motor/electrum_sheet + tfmg:etched_circuit_b
S02	create_tweaked_controllers	rescope	M-05	motif-exact	create_tweaked_controllers:tweaked_lectern_controller → create (M-05)	create_tweaked_controllers:tweaked_lectern_controller → create (M-05)	Create gate already stock; rescope delivery to mechanical_crafting conversion of stock grid, matching shipped Crafter-work convention.	digest: mod registers no recipe types (no own machine, so M-05 literally unauthorable); dossier: stock craft already use
P1	createaddition	rescope	M-17	motif-exact	createaddition:charging → irons_spellbooks FE-chargeable magic gear	createaddition:charging → irons_spellbooks FE-chargeable magic gear M-17	keep the weave, fix the delivery — authored charging recipes (e.g. depleted focus → charged focus).	delivery claims "config/native, no recipe needed" — false: Iron's gear holds no FE and the tesla coil only charges energ
S13	createfisheryindustry	rescope	M-28	motif-exact	seafood (chowder/soups/steaks)→economy via MineColonies colony requests	seafood (chowder/soups/steaks)→economy via MineColonies colony requests	rescope to minecolonies crafterrecipes — teach Cook/Restaurant the fishery dishes; colony then pulls raw fishery inputs continuously.	no "request table" config surface exists in MineColonies; the real datapack surface is crafterrecipes (colony-integratio
S13	createfisheryindustry	rescope	M-16	motif-exact	bait_trap catch→survival (seasonal bait, seasonal rare catch)	bait_trap catch→survival (seasonal bait, seasonal rare catch)	rescope: bait_trap recipes keyed on seasonally-grown crops as bait — Serene Seasons gates crop growth natively; runtime-dump the type schema before authoring.	bloodworm/cicada/ice-grub bait items exist in NO digest (invented); recipe conditions are load-time, so runtime season-g
S11	createfood	rescope	M-16	motif-exact	seasonal crop ingredients → createfood recipes	seasonal crop ingredients → createfood recipes (M-16)	drop the "KubeJS ingredient gate" clause; deliver via SS fertility tags on true crop inputs (melon/pumpkin/berry lines); pack-level survival lever — author once	recipes are static — KubeJS cannot make an ingredient season-conditional; Serene Seasons fertility is tag/config-driven;
S11	createfood	rescope	M-28	motif-exact	createfood finished dishes → economy (colony supply, MineColonies cook/restaurant hut requ	createfood finished dishes → economy (M-28 colony cook/restaurant hut requests)	re-tag M-26 colony-upkeep sink; deliver via minecolonies food config/tags (restaurant stock preference); do NOT add cook crafter recipes.	M-28's definition is the colony PRODUCING basics cheaper / colony-locked parts; a colony REQUESTING dishes is demand, no
S07	ctov	rescope	M-08	motif-exact	ctov structure chests → economy	ctov structure chests → economy	cap to cog/spur at low rate as "old coin" flavor, or seed scarce raw metal feeding the player mint [BALANCE-PENDING: seed rate vs inflation].	M-08 reframe (#163/#240) makes coin player-minted only; infinite worldgen makes chest coin a renewable non-player faucet
S13	dtterralith	rescope	M-30	motif-exact	dtterralith region-specific tree species → economy (M-30 regional scarcity)	dtterralith region-specific tree species → economy (M-30 regional scarcity)	edge is native — rescope to no-author documentation; demand side is aesthetic wood (ambient).	DT species drop their own seeds in their native Terralith biomes — native acquisition; loot-seed delivery adds only an i
S01	dungeons-and-taverns-v4.4.4	rescope	M-15	motif-exact	dungeons-and-taverns structure loot→create M-15	dungeons-and-taverns structure loot→create M-15	drop the "boss-key" half; deliver as a rare mid-tier Create COMPONENT seed (precision mechanism class) — taste of tech, no gate bypass.	shipped 40-gates.js ladder gates T-tiers on thematic boss drops (cataclysm ancient_metal/cursium/ignitium); trial vaults
S14	dungeons_arise_seven_seas	rescope	M-08	motif-exact	galleon/fortress loot tables → economy M-08	galleon/fortress loot tables → economy M-08	seed scarce mint-METAL bullion + valuables into the *_treasure tables — pirate hoards feed the minter, coin stays player-struck.	M-08 reframe (#163/#240) + ledger §2 make numismatics:* player-minted only; mowziesmobs ratified CUT says outright "M-08
S14	dungeons_arise_seven_seas	rescope	M-02	motif-exact	galleon/fortress loot → magic M-02	galleon/fortress loot → magic M-02	weave survives; re-target the ship treasure/normal tables — the named delivery surfaces don't exist in 1.0.4.	loot digest (DungeonsAriseSevenSeas-1.0.4) ships ONLY five ship families — corsair_corvette/pirate_junk/small_yacht/unic
S17	dynamictrees	rescope	M-12	motif-exact	dynamictrees:branch byproduct → create:milling (sawdust/pulp intermediate)	dynamictrees:branch byproduct → create:milling (sawdust/pulp intermediate)	weave is sound, named outputs don't exist; retarget to existing ids — mill branch → sticks + paper chance — and note branches come from harvest, not passive she	no mod in the pack registers any sawdust/wood_pulp item (grep over tools/mod-data/by-mod/ = zero hits); no milling recip
S15	dynamictreesplus	rescope	M-11	motif-exact	dynamictreesplus mushroom caps (brown/red)→occultism:spirit_fire (M-11, times=1+1+1 ACCEPT	dynamictreesplus mushroom caps (brown/red)→occultism:spirit_fire (M-11, times=1+1+1 ACCEPT	corrected delivery: spirit_fire transmutes a mega cap → occultism:datura_seeds — the trance/mycotoxin lore the row itself cites.	the output "fungal essence reagent" is not a registered item and the ledger reagent rule says reuse, don't invent; occul
S13	ecologics	rescope	M-12	fuzzy	ecologics:coconut (raw fruit) → create M-12	ecologics:coconut (raw fruit) → create M-12	weave right, delivery names nonexistent items; rescope: create:milling coconut → coconut_slice xN + coconut_husk, yield above hand-break.	digest has no "coconut meat"/"husk fiber" items; real items are coconut_slice + coconut_husk (husk already a soup-bowl i
S13	ecologics	rescope	M-30	motif-exact	ecologics:coconut (beach-biome regional) → economy M-30	ecologics:coconut (beach-biome regional) → economy M-30	GTMOGS can't place crops; beach-lock is already native — edge goes live via the M-12 demand rows; rescope to no-author documentation; scarcity weak (beaches com	slate's own gtmogs LEAVE row: GTMOGS is ore-vein gen only; coconut palms are native beach worldgen
S08	endermoon	rescope	M-22	motif-exact	endermoon event→magic M-22	endermoon event→magic M-22	author the authorable half: a pearl-VOLUME imbuement/ritual recipe; the moon's native spawn surge is the de-facto gate. "Event-gate configuration" as written is	endermoon owns 0 items/0 recipe types (digest); no mechanism exists to condition a recipe on an Enhanced Celestials luna
S07	endrem	rescope	M-11	motif-exact	endrem themed eyes (undead_eye, nether_eye, corrupted_eye) → magic via occultism:ritual tr	endrem themed eyes (undead_eye, nether_eye, corrupted_eye) → magic via occultism:ritual tr	rescope to two-step spirit_fire (themed offering → eye) or proven enchanting_apparatus; target loot-only eyes (nether/cold/corrupted), not natively-craftable on	34-magic-web-occult.js:9-10 rules occultism:ritual "NOT authored (pentacle/spirit-bound; not KubeJS-safe)"; digest: unde
S16	enhancedcelestials	rescope	M-22	motif-exact	Blood/Blue Moon event-state → magic M-22	Blood/Blue Moon event-state → magic M-22	weave is right; deliver as event-gated REAGENT: blood-moon-only spawn entry (EC datapack) → mob drop via LootJS feeds occultism ritual. Native moon-condition = 	stated delivery "KubeJS recipe condition keyed to moon state" is unauthorable — NeoForge recipe conditions are load-time
S08	extradelight	rescope	M-28	motif-exact	extradelight feasts / high-tier dishes → economy (MineColonies colony provisioning)	extradelight feasts / high-tier dishes → economy (MineColonies colony provisioning)	deliver as MineColonies crafterrecipes datapack (Cook/Restaurant learns ED dishes) so the native request system creates ingredient demand.	no "hut request list" config mechanism exists; the pack's minecolonies surface is recipe-side (98-minecolonies.js); Mine
