times_suggested	from_opus	mod	from	via	to_pillar	motif	consensus	verdicts	hook
1	False	create_ironworks	create_ironworks tin_ingot / crushed tin	numismatics mint (Create process → coin)	economy	M-08	ACCEPT	{'ACCEPT': 1}	Tin is scarce and regional — crushing and processing it into the Numismatics coin chain is exactly the scarcity-economy 
1	False	create_ironworks	create_ironworks steel_ingot / steel_plate	Aeronautics airframe recipe (structural alloy ingredient)	aeronautics	M-23	ACCEPT	{'ACCEPT': 1}	Steel plate as a required structural component in mid-tier Aeronautics hulls is mechanically obvious — you can't bolt to
1	False	create_jetpack	create_jetpack:jetpack	create:sequenced_assembly (gating, not fabrication)	create	M-06	ACCEPT	{'ACCEPT': 1}	the jetpack is a brass-tier personal-flight device that logically belongs at the end of a small sequenced-assembly chain
1	False	create_jetpack	create_jetpack:netherite_jetpack (endgame variant)	create:sequenced_assembly	create	M-06	ACCEPT	{'ACCEPT': 1}	the lava-dive jetpack shouldn't be a flat bench craft — a sequenced finishing step (deploy netherite plate onto complete
1	False	create_jetpack	create_jetpack:jetpack (brass tier)	M-15 boss-key	create	M-15	REJECT	{'REJECT': 1}	the brass jetpack is mid-game, not endgame flagship; gating it behind a boss drop over-prices the entry tier — M-15 is b
1	False	create_ltab-3.9.2	structure loot tables (discoverable loot seeded in Create-themed ruins)	loot-table seeding (not a method-routing)	economy	M-01	REJECT	{'REJECT': 1}	seeding coins or reagents into loot tables is a loot edit, not a method-routing — it fits no approved motif (M-01..M-24 
1	False	create_ltab-3.9.2	create_ltab structure loot tables	loot-seed (seed a boss-key fragment or progression token)	create	M-15	REJECT	{'REJECT': 1}	M-15 is boss-key gating of complex tech; seeding a key fragment into a non-boss structure loot table conflates two disti
1	False	create_mobile_packages	robo_bee courier delivery	config tie / economy integration	economy	M-09	ACCEPT	{'ACCEPT': 1}	configuring drone ports to service Numismatics trade posts or player shops makes the drone network the physical delivery
1	False	create_mobile_packages	portable_stock_ticker	recipe (Create sequenced_assembly)	create	M-06	ACCEPT	{'ACCEPT': 1}	a handheld stock terminal that talks to the Create logistics network is a precision device — building it through a seque
1	False	create_mobile_packages	create_mobile_packages robo_bee	recipe (create:mechanical_crafting or sequenced_assembly as a Create fabrication step)	create	M-05	ACCEPT	{'ACCEPT': 1}	the Robo Bee courier isn't bought — you fabricate it on a Create mechanical-crafting grid from andesite casings + a bras
1	False	create_mobile_packages	create_mobile_packages portable_stock_ticker	recipe (create:sequenced_assembly)	create	M-06	REJECT	{'REJECT': 1}	the stock ticker is a convenience tool, not an endgame keystone; M-06 (sequenced-assembly) is for flagship/endgame items
1	False	create_mobile_packages	create_mobile_packages bee_port / drone_port	recipe (numismatics sell listing via trade)	economy	M-21	REJECT	{'REJECT': 1}	M-21 is provisional and the maintainer leans no; also drone ports are infrastructure items, not trade goods — the econom
1	False	create_new_age	create_new_age:energising	ars_nouveau:enchanting_apparatus powered by FE	magic	M-10	REJECT	{'REJECT': 1}	the Enchanting Apparatus has its own power source (source jars); wiring FE into it is not a supported mechanic. M-10 is 
1	False	create_new_age	create_new_age:copper_wire	create:crushing	create	M-04	REJECT	{'REJECT': 1}	copper wire crushing is a within-Create deepening only; it earns no new pillar. No value as a weave-ledger entry.
1	False	create_new_age	create_new_age:energising method (as a gate)	create_new_age:energising	aeronautics	M-05	ACCEPT	{'ACCEPT': 1}	advanced airship drive components — electric motors or a high-tier propulsion controller — are built in the Energiser; a
1	False	create_new_age	create_new_age circuits (blank_circuit / copper_circuit)	ars_nouveau:imbuement or enchanting_apparatus	magic	M-10	REJECT	{'REJECT': 1}	Ars Nouveau is organic/nature-magic; "circuit as arcane reagent" clashes hard with that aesthetic. Iron's Spellbooks is 
1	False	create_new_age	create_new_age FE generation (generator_coil / motors)	createaddition:charging	magic	M-17	REJECT	{'REJECT': 1}	M-17 rides createaddition:charging, which is Create Addition's method — not create_new_age's. CNA's contribution is gene
1	False	create_new_age	create_new_age:fluxuated_magnetite (energised magnetic material)	ars_nouveau:imbuement (arcane infusion of a magnetically-charged material)	magic	M-10	REJECT	{'REJECT': 1}	thin thematic bridge; "electrically charged = arcane reagent" is not a player-intuitive connection.
1	False	create_new_age	create_new_age Energiser gating Create-Aeronautics engine components	create_new_age:energising	aeronautics	M-05	REJECT	{'REJECT': 1}	already covered more cleanly by M-17 (magic) — adding a second ACCEPT for aeronautics here would need a named aeronautic
1	True	create_new_age	thorium_ore (2 biome-modifiers)	scarce regional ore → create:crushing → numismatics mint	economy	M-08	ACCEPT	{'ACCEPT': 1}	Thorium is a scarce, regional reactor ore — processed and minted it feeds the scarcity economy, parallel to Ironworks ti
1	True	create_new_age	motors / generator coils / wires	aeronautics drivetrain recipe	aeronautics	M-24	ACCEPT	{'ACCEPT': 1}	electric motors and coils feed Aeronautics propellers/engines — the FE drivetrain side of the airship supply line (M-24 
1	False	create_new_age	create_new_age:solid_corium (reactor waste byproduct)	occultism:spirit_fire or ars_nouveau:imbuement (transmute exotic irradiated material into magical reagent)	magic	M-10	ACCEPT	{'ACCEPT': 1}	spent reactor corium holds strange energies — the occultists found a ritual that draws those emanations into source, tur
1	False	create_new_age	create_new_age:corium (reactor waste)	occultism:spirit_fire or create:haunting	magic	M-19	REJECT	{'REJECT': 1}	Corium is reactor waste — a nuclear-horror material. Routing it through spirit-fire is thematically jarring (industrial 
1	False	create_new_age	create_new_age:corium / create_new_age:solid_corium (reactor byproduct)	create:sequenced_assembly as an ingredient for a top-tier structural part	create	M-06	ACCEPT	{'ACCEPT': 1}	Corium, the nuclear waste output, is dense and exotic — folding it as a sequenced-assembly input into an advanced aerona
1	False	create_new_age	create_new_age:generator_coil / layered_magnet	crafting/create:mechanical_crafting	aeronautics	M-24	ACCEPT	{'ACCEPT': 1}	Aeronautics propulsion needs a generator; the CNA generator coil and layered magnet are the exact components a rotationa
1	False	create_new_age	create_new_age advanced reactor components (reactor_casing, reactor_rod, reactor_fuel_acceptor)	create:sequenced_assembly	create	M-06	ACCEPT	{'ACCEPT': 1}	Building a nuclear reactor isn't a crafting-table affair — the reactor fuel rods and casing pass through a multi-stage s
1	False	create_new_age	create_new_age FE generation (motor/generator/solar systems)	Aeronautics FE engine intake	aeronautics	M-13	REJECT	{'REJECT': 1}	M-13 is explicitly "TFMG/Create-Addition fuel → engine intake." FE is not a fuel in that sense — it's a power form the a
1	False	create_new_age	create_new_age:fluxuated_magnetite	create_new_age:energising	aeronautics	M-24	ACCEPT	{'ACCEPT': 1}	a magnetised alloy is a natural compass/gyroscope material; Aeronautics navigation systems call for an energised magneti
1	False	create_new_age	create_new_age:thorium_ore (biome-modifier scarcity)	worldgen scarcity config	survival	M-08	REJECT	{'REJECT': 1}	scarcity of Thorium is already expressed by its biome-modifiers (2 of them); adding a separate config tie doesn't add a 
1	False	create_pattern_schematics	create_pattern_schematics:empty_pattern_schematic	`create:mechanical_crafting` (the schematic + quill assembly could require a Create-processed paper/brass component)	create	M-05	REJECT	{'REJECT': 1}	the mod is already anchored firmly in Create; M-05 is for gating a *foreign* mod's flagship item inside its own machine 
1	False	create_sa	create_sa:blazing_* tools	ars_nouveau:imbuement	magic	M-10	REJECT	{'REJECT': 1}	the blazing line is mid-tier workhorse gear (blaze rods → fire tools); gating it behind an arcane infusion step adds com
1	False	create_sa	create_sa:brass_drone_item	create:sequenced_assembly (upgrade path)	aeronautics	M-06	REJECT	{'REJECT': 1}	drones already belong to the aeronautics pillar; deepening within the same pillar doesn't earn a new pillar. M-06 is for
1	False	create_sa	create_sa:brass_jetpack_chestplate / andesite_jetpack (personal flight gear)	config tie or recipe — require Aeronautics-specific fuel cell or structural part as an ingredient	aeronautics	M-23	ACCEPT	{'ACCEPT': 1}	a jetpack burning TFMG diesel or using a Create-Aeronautics structural component to build the fuel chamber ties personal
1	False	create_sa	create_sa:brass_drone_item modules	recipe (Create mechanical_crafting + Ars/Iron's focus component)	magic	M-05	REJECT	{'REJECT': 1}	drones are already deep Create (built via sequenced_assembly); adding a magic module would deepen an already-deep item p
1	False	create_sa	create_sa:brass_jetpack_chestplate / andesite_jetpack_chestplate	recipe	aeronautics	M-24	REJECT	{'REJECT': 1}	Jetpacks are personal flight, not airframe/drivetrain components. M-24 targets propellers/engines/control surfaces on sh
1	False	create_sa	create_sa:brass_drone_item (programmable autonomous helper)	config/recipe	aeronautics	M-24	REJECT	{'REJECT': 1}	Drones are personal logistics, not ship drivetrain. M-24 specifically covers propellers/control surfaces for Aeronautics
1	False	create_train_parts	create_train_parts:train_step_brass / train_slide_brass / brass_sliding_window	create:pressing (pressed brass sheet as ingredient)	create	M-20	ACCEPT	{'ACCEPT': 1}	a brass train step already implies industrial fabrication; requiring a pressed brass sheet to craft it makes the Create-
1	False	create_train_parts	create_train_parts:train_step_andesite / train_slide_andesite / andesite_sliding_window	crafting table (andesite_alloy as ingredient, vanilla crafting is fine here per palette rules)	create	M-20	ACCEPT	{'ACCEPT': 1}	andesite variants should cost andesite alloy (the standard Create material), not raw andesite — makes them feel like Cre
1	False	create_train_parts	create_train_parts:crossing	thematic (colony road planning)	aeronautics		REJECT	{'REJECT': 1}	no-motif; purely thematic with no recipe method to route through.
1	False	create_train_parts	create_train_parts:brass_sliding_window / train_step_brass / train_slide_brass	recipe — create:pressing (brass sheets as input)	create	M-20	ACCEPT	{'ACCEPT': 1}	train fittings assembled from Create-pressed brass sheets makes the train-detailing tier feel like it belongs in the sam
1	False	create_train_parts	create_train_parts:crossing	recipe — create:mechanical_crafting	create	M-20	REJECT	{'REJECT': 1}	the crossing is a track-logic block; gating it behind mechanical_crafting (a heavier step) for a purely functional infra
1	False	create_train_parts	create_train_parts brass/copper window and step blocks	recipe (require create:brass_sheet / create:copper_sheet as crafting ingredients)	create	M-04	ACCEPT	{'ACCEPT': 1, 'REJECT': 1}	the same pressed sheets that go into every Create machine are exactly what you'd panel a train window or step with — the
1	False	create_train_parts	create_train_parts blocks (loot=yes)	loot-seed	create	M-08	REJECT	{'REJECT': 1}	loot=yes is flagged in the jar digest but the items are crafted train fittings, not chest loot — likely just block drops
1	False	create_tweaked_controllers	tweaked_linked_controller / tweaked_lectern_controller	recipe (Create mechanical_crafting or sequenced_assembly)	create	M-24	ACCEPT	{'ACCEPT': 1}	the controller is a precision control surface — routing it through a Create-intensive craft (precision mechanism + elect
1	False	create_tweaked_controllers	create_tweaked_controllers items	recipe	magic		REJECT	{'REJECT': 1}	a redstone-frequency controller has no coherent magic resonance; forced edge, no motif fits.
1	False	create_tweaked_controllers	create_tweaked_controllers items	numismatics sell/trade	economy	M-21	REJECT	{'REJECT': 1}	M-21 is provisional and the maintainer leans no; a controller is infrastructure, not a trade good — forced economy edge.
1	False	create_tweaked_controllers	tweaked_lectern_controller (control interface for Create contraptions/vehicles)	numismatics sell	economy	M-09	REJECT	{'REJECT': 1}	A redstone-signal controller has no inherent economic character — it's a QoL device, not a trade good. Selling a control
1	False	create_tweaked_controllers	tweaked_lectern_controller craft (already uses Create precision mechanism + electron tubes)	no new weave needed	create	M-05	REJECT	{'REJECT': 1}	The existing craft already routes through Create parts — this is already the M-05 pattern (native-method gating). Record
1	False	create_ultimate_factory	create_ultimate_factory renewable diamond (coal-block+lava→diamond via create:compacting)	numismatics coin mint	economy	M-08	REJECT	{'REJECT': 1}	M-08 is "scarce regional metal → processed → coin." Renewable diamonds are a vanilla material the mod makes reproducible
1	False	create_ultimate_factory	create_ultimate_factory renewable blaze rod / calcite outputs	ars_nouveau:imbuement	magic	M-10	REJECT	{'REJECT': 1}	This mod has no items of its own — the blaze rods are vanilla, and magic imbuement of vanilla materials belongs on the m
1	False	create_ultimate_factory	coal-block compacting to diamond pathway	recipe (create:compacting — already defined by the mod)	economy	M-08	REJECT	{'REJECT': 1}	the mod's diamond recipe is a renewable Create-depth loop, not a scarcity-metal pipeline; treating synthetic diamonds as
1	False	create_ultimate_factory	blaze-rod output (blaze powder compacting path)	loot-seed / recipe into magic	magic	M-10	REJECT	{'REJECT': 1}	the mod itself outputs vanilla blaze rods/powder via Create compacting — routing those onward into Ars imbuement is plau
1	False	createaddition	irons_spellbooks / ars_nouveau FE-chargeable items (spell foci, arcane batteries, wands with FE capacity)	createaddition:charging — the tesla coil or charging station powers magic gear from the Create electrical grid	magic	M-17	ACCEPT	{'ACCEPT': 1}	wiring your arcane focus into the Create power grid to charge it up is exactly the kind of tech-meets-magic seam the pac
1	True	createaddition	seed_oil / bioethanol (crop fuels)	createaddition:liquid_burning → Aeronautics engine	aeronautics	M-13	ACCEPT	{'ACCEPT': 1}	farmed seed-oil refined to bioethanol is a renewable propulsion fuel for an airship/vehicle engine, threading agricultur
1	True	createaddition	seed_oil / bioethanol	numismatics sell	economy	M-09	REJECT	{'REJECT': 1}	bioethanol is better reserved as propulsion fuel (M-13, owned by aeronautics); also TFMG diesel/gasoline already own the
1	False	createaddition	createaddition:seed_oil / bioethanol (crop-oil fuel)	createaddition:liquid_burning + numismatics	economy	M-12	REJECT	{'REJECT': 1}	the seed_oil liquid-burning is a closed energy loop (crops → oil → FE → back into the machine), not a tradeable end-prod
1	False	createaddition	createaddition:biomass / biomass_pellet	create:compacting + numismatics	economy	M-08	REJECT	{'REJECT': 1}	biomass pellets are not a "scarce regional metal" — they are a renewable crop byproduct. M-08 specifically covers scarce
1	False	createaddition	seed_oil / bioethanol (crop-fermented fuel)	createaddition:liquid_burning	economy	M-12	REJECT	{'REJECT': 1}	liquid_burning makes the crop oil a *fuel input*, not a processed sellable intermediate — M-09 luxury→coin doesn't apply
1	True	createaddition		tfmg:winding (TFMG's winding machine consumes wire)	create	M-12	ACCEPT	{'ACCEPT': 1}	Create Addition's rolled copper wire feeds TFMG's winding machine for coils/motors — bonds the two Create electricity ad
1	True	createaddition		createaddition:charging area-effect	magic	M-17	ACCEPT	{'ACCEPT': 1}	park a magic focus/battery in a tesla-coil field to passively recharge it — the *ambient* charging tier of M-17, a step 
1	True	createaddition		ars_nouveau:imbuement as a conductive arcane substrate	magic	M-10	REJECT	{'REJECT': 1}	row 535 already REJECTed electrum→Ars; concur, electrum here is an electrical-conductor alloy, the gold/silver-alloy-as-
1	False	createaddition	createaddition:copper_wire / electrum_wire (via rolling)	crafting/deploying as aeronautics wiring component	aeronautics	M-24	ACCEPT	{'ACCEPT': 1}	the rolling mill makes the wires; the airship's control surfaces need wires — one feeds the other
1	False	createaddition	createaddition items (electrum_ingot, alternator, accumulator)	createaddition:charging (tesla coil)	magic	M-17	ACCEPT	{'ACCEPT': 1}	The tesla coil charges Iron's Spellbooks battery foci and wearables — the electric layer literally powers your spells.
1	False	createaddition	createaddition:biomass / biomass_pellet	recipe (farmersdelight:cooking or create:compacting)	economy	M-12	REJECT	{'REJECT': 1}	Biomass is already a fuel intermediate; routing it through cooking/compacting into a food-adjacent product is a stretch 
1	False	createaddition	createaddition:bioethanol (refined crop fuel)	createaddition:liquid_burning → aeronautics engine intake (as an alternative light-tier propellant)	aeronautics	M-13	ACCEPT	{'ACCEPT': 1}	bioethanol is a renewable lower-tier fuel that can run a small airship before the crew has diesel/gasoline; escalates th
1	False	createadditionallogistics	createadditionallogistics:brass_encased_lazy_cogwheel / brass_encased_lazy_shaft	recipe (create:mechanical_crafting)	aeronautics	M-24	ACCEPT	{'ACCEPT': 1}	brass lazy cogwheels are an efficient intermediate for Aeronautics control linkages — performance-tuned gearing that red
1	False	createadditionallogistics	createadditionallogistics:andesite_encased_lazy_cogwheel (entry-tier)	recipe (create:deploying / item_application)	aeronautics	M-20	ACCEPT	{'ACCEPT': 1}	deploy a lazy cogwheel onto a basic shaft segment to upgrade it to a ship-grade lazy assembly in one step — light single
1	False	createadditionallogistics	createadditionallogistics:brass_encased_lazy_shaft	recipe (create:mechanical_crafting)	aeronautics	M-24	REJECT	{'REJECT': 1}	Lazy shafts are a performance infrastructure piece, not a drivetrain component in the Aeronautics sense; treating them a
1	False	createadditionallogistics	createadditionallogistics flexible shafts (omnidirectional kinetics)	recipe	aeronautics	M-24	ACCEPT	{'ACCEPT': 1}	Flexible shafts that connect any direction are exactly what a ship's mechanical drivetrain needs to route power to prope
1	True	createbigcannons	finished shells/munitions (AP shells, cartridges)	numismatics sell	economy	M-09	ACCEPT	{'ACCEPT': 1}	a munitions specialist sells fabricated shells as a war-good to the crew
1	True	createbigcannons	bronze/cast_iron/steel cannon parts (cast in foundry)	aeronautics construction recipe	aeronautics	M-23	ACCEPT	{'ACCEPT': 1}	heavy cast cannon plate is the structural feedstock for armored naval/air gun-platforms — deepens the aeronautics build 
1	False	createbigcannons	cannon shells / big cartridges (finished war goods)	`numismatics` sell — finished munitions as a trade good for the military specialist role	economy	M-09	ACCEPT	{'ACCEPT': 1}	The crew that runs the foundry sells shells to the crew that flies the gunship — specialization driving trade.
1	False	createbigcannons	createbigcannons:nethersteel (nether-alloy, endgame tier)	`occultism:spirit_fire` — nethersteel scrap transmuted into an occult metal (spiritual resonance of nether-forged steel)	magic	M-11	REJECT	{'REJECT': 1}	Nethersteel is a military-industrial material; routing it through spirit fire to produce an occult reagent is a tonal cl
1	False	createbigcannons	createbigcannons:steel_ingot (`c:ingots/steel`)	recipe — steel as a structural airframe input (already shared via c:tags with M-23)	aeronautics	M-23	REJECT	{'REJECT': 1}	This is already the existing aeronautics anchor via M-23 (structural alloy → airframe); recording it as a new candidate 
1	False	createbigcannons	createbigcannons shells / munitions (finished war goods)	numismatics sell/price	economy	M-09	ACCEPT	{'ACCEPT': 1}	a cannon-focused specialist selling shells to the group's military buyers is a natural trade-guild driver — munitions ar
1	False	createbigcannons	boss/elite mob drops (via loot=yes — cannon loot tables exist)	loot-seed	economy	M-14	ACCEPT	{'ACCEPT': 1}	seeding bounty-relevant drops (cartridge fragments, cannon parts) into CBC's loot tables links the PvPvE combat loop to 
1	False	createblockchain	Mining Core (createblockchain:mining_core, worldgen-scarce consumable)	tfmg:industrial_blasting or create:crushing	create	M-08	ACCEPT	{'ACCEPT': 1}	the Mining Core is a geode-found consumable gating the currency faucet; requiring it to be pre-processed through Create 
1	False	createblockchain	cryotheum coolant fluid	tfmg:distillation	create	M-08	REJECT	{'REJECT': 1}	cryotheum is a proprietary coolant block; routing it through TFMG distillation as though it were a petroleum byproduct i
1	False	createblockchain	createblockchain:mining_core (geode worldgen consumable)	create:crushing	create	M-03	ACCEPT	{'ACCEPT': 1}	Mining Cores come from geodes — crushing a raw geode cluster in a Create millstone/crusher to extract the core gives the
1	False	createblockchain	createblockchain:currency_miner (FE consumer)	createaddition:charging (FE tie)	create	M-17	REJECT	{'REJECT': 1}	the miner already uses FE which implies the Create-electricity bridge; the existing anchor already captures this. Adding
1	False	createblockchain	createblockchain:piggy_bank (chest loot)	loot-seed	economy	M-08	ACCEPT	{'ACCEPT': 1}	Seed the piggy_bank loot table with scarce-metal coins (not just base coins) — finding a piggy bank in a dungeon that pa
1	False	createblockchain	createblockchain:mining_core_geode (worldgen structure)	loot-seed	economy	M-08	ACCEPT	{'ACCEPT': 1}	Geodes that yield Mining Cores could also seed higher-denomination coins in their "geode chest" if applicable — reinforc
1	True	createblockchain	Forge Energy fed to Currency Miner	createaddition charging/generation upstream	create	M-08	ACCEPT	{'ACCEPT': 1}	route the miner's FE from scarce regionally-processed metal (via createaddition generators) so minted coins trace back t
1	False	createfisheryindustry	createfisheryindustry:fish_skin	ars_nouveau:imbuement	magic	M-10	REJECT	{'REJECT': 1}	fish skin as a magic reagent is tonally weak — it's a mundane leather-substitute; nothing about it calls to arcane infus
1	False	createfisheryindustry	createfisheryindustry:fish_skin (peeler output, leather-substitute c:tag candidate)	recipe (crafting)	magic		REJECT	{'REJECT': 1}	fish skin as a magic ingredient doesn't compose any accepted motif; it's a leather substitute, not an arcane material. F
1	False	createfisheryindustry	createfisheryindustry:harpoon / harpoon_pouch (ranged weapon line)	loot-seed	economy	M-14	REJECT	{'REJECT': 1}	M-14 is provisional; harpoons as bounty-board drops are coherent (sea-creature hunt) but M-14 is held for 0.9 economy re
1	False	createfisheryindustry	createfisheryindustry catch (fish tags, shellfish)	irons_spellbooks:alchemist_cauldron_brew	magic	M-12	ACCEPT	{'ACCEPT': 1}	Fish oils and shellfish (lobster, mussels) are classical alchemy ingredients — running them through the Alchemist Cauldr
1	False	createfisheryindustry	createfisheryindustry:seafood_chowder / createfisheryindustry:cooked_lobster / createfisheryindustry:cooked_cod_steak (high-effort processed seafood)	numismatics sell/price	economy	M-09	ACCEPT	{'ACCEPT': 1}	mechanical fishing → peeled steaks → chowder is a full automated processing chain; the output is a premium food that a s
1	False	createfisheryindustry	createfisheryindustry:harpoon (projectile weapon, mid-tier iron/zinc craft)	recipe (create:sequenced_assembly — add a backtank valve part)	create	M-06	REJECT	{'REJECT': 1}	harpoon is already in the Create pillar (made via create:sequenced_assembly per existing inbound weaves). M-06 would be 
1	True	createfood	hot drinks / processed dishes	bountiful board payout	economy	M-14	REJECT	{'REJECT': 1}	bounty boards want combat/mob drops, not cooked food; the sell-good route (M-09) already covers food→coin, this duplicat
1	True	createfood	foreign crops/meats/cheese (it consumes)	create:milling/mixing + farmersdelight:cooking	create	M-12	ACCEPT	{'ACCEPT': 1}	it is itself a giant M-12 consumer — already its design, worth logging as the canonical inbound food-processing sink for
1	False	createfood	createfood:bacon_pizza / apple_cheesecake / apple_ice_cream (high-effort finished dishes)	numismatics sell (trade/price config)	economy	M-09	ACCEPT	{'ACCEPT': 1}	a Create bakery specialization mints coin from its multi-stage output — the food processing chain pays for itself in the
1	False	createfood	createfood:apple_milkshake / apple_juice (drinks)	numismatics sell	economy	M-09	ACCEPT	{'ACCEPT': 1}	craft drinks are a step above raw food — bottled beverages as a lighter coin tier below the full-dish luxury goods
1	False	createfood	createfood:apple_pie_filling_block / jam_block (sweet fillings/jams)	vinery:apple_fermenting or extradelight:vat	survival	M-12	ACCEPT	{'ACCEPT': 1}	fruit fillings are one processing step from fermenting into cider or jam liqueur — deepens the food chain and feeds the 
