times_suggested	from_opus	mod	from	via	to_pillar	motif	consensus	verdicts	hook
1	False	modulargolems	golem entity loot (loot=yes)	occultism:spirit_fire / numismatics bounty	magic	M-02	REJECT	{'REJECT': 1}	loot=yes in the digest likely references the golem_workbench block's loot table, not a meaningful mob-drop stream — asse
1	False	modulargolems	TFMG steel (via TFMG industrial chain) as golem-body material	modulargolems:golem_assemble	create		REJECT	{'REJECT': 1}	TFMG steel feeding golem bodies deepens the Create spine but creates no cross-pillar edge — both mods are Create-anchore
1	False	modulargolems	standard golem body (iron/copper tier)	create:sequenced_assembly	create	M-06	REJECT	{'REJECT': 1}	dossier already confirms create:sequenced_assembly is in golem assembly (existing inbound weave); this would be a weave 
1	False	modulargolems	golem body (iron/gold tier)	numismatics coin as unlock fee	economy	M-21	REJECT	{'REJECT': 1}	M-21 is provisional and leans no; buying golem frames for coins feels arbitrary — there's no in-world logic for why a cr
1	False	modulargolems	modulargolems soldier golem (combat construct)	numismatics sell / M-09	economy	M-09	REJECT	{'REJECT': 1}	Selling autonomous combat golems as trade goods doesn't fit the pack's player-run economy ethos (the 10-player group use
1	False	modulargolems	mowziesmobs boss-drop metals (ice_crystal, earthrend material — wrought) / iceandfire:dragonsteel / cataclysm:cursium	modulargolems:golem_assemble — require boss-drop metal parts for high-tier golem bodies	survival	M-02	ACCEPT	{'ACCEPT': 1}	The best golems are made from the toughest stuff you can find; a Frostmaw-ice-crystal golem arm is exactly the reward a 
1	False	modulargolems	modulargolems golem assembly	numismatics M-14 bounty	economy	M-14	REJECT	{'REJECT': 1}	Bounties for deploying a golem (as a kill-boss substitute) is a stretch — M-14 is mob-combat → coin, not construction → 
1	True	modulargolems	best golem bodies (golem_assemble metal inputs)	modulargolems:golem_assemble (boss-drop metal as required body material)	survival	M-15	ACCEPT	{'ACCEPT': 1}	the strongest constructs demand a metal you only get by killing a Cataclysm/Ice&Fire boss — golems are a combat-progress
1	True	modulargolems	golem-part upgrade slot (add_N_slot / golem core)	modulargolems:golem_add_slot or golem_replace_part (ars/occultism reagent as the upgrade catalyst)	magic	M-11	ACCEPT	{'ACCEPT': 1}	animating a construct's higher slots needs an occult spirit-essence / Ars source charge — golemancy is half magic, so th
1	True	modulargolems	golem core	ars_nouveau:source_gem direct sink as a per-part input	magic	M-01	REJECT	{'REJECT': 1}	source_gem is the reserved universal magic currency (reagent-ownership) and a raw 1:1 source-gem-into-golem swap is arbi
1	True	modulargolems	assembled golem metal recovery	create:crushing (golem body block back to raw)	create	M-04	REJECT	{'REJECT': 1}	no-motif-fit for an entity; golems are entities not deco blocks, so the lossy deco-recycle motif doesn't apply and a "cr
1	False	modulargolems	Cataclysm cursium ingot / boss-drop metals	modulargolems:golem_assemble	survival	M-15	ACCEPT	{'ACCEPT': 1}	killing the Cataclysm bosses yields the metals that build your deadliest golems — combat gating that reads naturally
1	False	modulargolems	Occultism mod otherstone / spirit essence	modulargolems:golem_add_slot	magic	M-11	REJECT	{'REJECT': 1}	dossier marks route WEAK; golem-slot upgrades read as mechanical-physical, not occult; the theme pairing (construct auto
1	False	modulargolems	Ice & Fire dragonsteel (boss-tier metal)	modulargolems:golem_assemble (boss drop as body material)	survival	M-15	ACCEPT	{'ACCEPT': 1}	dragonsteel golems as the apex combat tier — you fight dragons to build constructs that fight harder things; the boss-ke
1	False	modulargolems	modulargolems golem body parts	occultism:spirit_fire transmutation	magic	M-11	REJECT	{'REJECT': 1}	spirit-fire is for organic-to-essence transmutation (M-11 organic↔magic); applying it to a metal construct body is a ton
1	False	modulargolems	golem-core upgrade slot	ars_nouveau:imbuement (source_gem infused core)	magic	M-10	ACCEPT	{'ACCEPT': 1}	infusing a golem-core with Ars source gives it arcane abilities (magic-attuned golem); the industrial-arcane vibe of the
1	False	modulargolems	golem metal parts	occultism:spirit_trade (acquire exotic metals)	magic	M-18	REJECT	{'REJECT': 1}	M-10 (Ars infusion) already provides the magic anchor; adding Occultism spirit_trade as a metal source would duplicate t
1	False	modulargolems	Cataclysm boss-drop metal (cursium ingot / boss signature drop)	modulargolems:golem_assemble	survival	M-02	ACCEPT	{'ACCEPT': 1}	the most powerful golem bodies require boss-metal cores — you can't automate away the dungeon; killing the Cataclysm bos
1	False	modulargolems	Ice&Fire dragonsteel ingot	modulargolems:golem_assemble	survival	M-02	REJECT	{'REJECT': 1}	dragonsteel is already a supported cross-mod metal in the dossier (deps include iceandfire); this is an existing connect
1	False	modulargolems	golem chassis blank	create:sequenced_assembly for endgame body intermediate	create	M-06	REJECT	{'REJECT': 1}	The dossier already credits create:sequenced_assembly as an existing inbound weave; re-proposing it would duplicate rath
1	False	modulargolems	modulargolems:golem_assemble (boss-tier metals — Cataclysm cursium, Ice&Fire dragonsteel)	modulargolems:golem_assemble recipe requiring boss drops as keystone	survival	M-15	ACCEPT	{'ACCEPT': 1}	the most powerful golem bodies demand a boss-key ingredient — you can't build a dragonsteel golem without slaying the dr
1	False	modulargolems	modulargolems:golem_assemble (arcane core)	recipe using ars_nouveau:source_gem or occultism ritual component as a golem-core upgrade	magic	M-10	ACCEPT	{'ACCEPT': 1}	animating a construct requires a spark of arcane source — the golem-soul is a source gem seated in the chest cavity; gol
1	False	more_slabs_stairs_and_walls	stone/wood cut variants (847 blocks)	create:cutting	create	M-04	ACCEPT	{'ACCEPT': 1}	a player building on an airship or colony wants bulk stone cuts — of course the saw produces them automatically
1	False	more_slabs_stairs_and_walls	gravity-block cuts (concrete-powder/sand/gravel slabs)	create:crushing	create	M-04	REJECT	{'REJECT': 1}	M-04 is for recycling *back* to raw material; crushing the gravity-cuts back to sand/gravel is valid but marginal — adds
1	False	more_slabs_stairs_and_walls	more_slabs_stairs_and_walls stone/wood cut variants (bulk)	recipe (create:cutting)	create	M-12	ACCEPT	{'ACCEPT': 1}	a player loads logs or stone blocks into the mechanical saw to bulk-produce the cut variants for a build — the decoratio
1	False	more_slabs_stairs_and_walls	more_slabs_stairs_and_walls:*concrete_powder_slab/stairs/wall (gravity variants)	recipe (create:mixing)	create	M-12	REJECT	{'REJECT': 1}	concrete-powder variants via mixing is an overly granular edge — Create already handles concrete via compacting/mixing a
1	False	more_slabs_stairs_and_walls	more_slabs_stairs_and_walls stone cuts (cobble/stone/deepslate family)	recipe (create:crushing)	create	M-04	REJECT	{'REJECT': 1}	crushing 847 variants back to base material would mean hundreds of crushing recipes for decorative blocks — M-04 is best
1	False	more_slabs_stairs_and_walls	the 847 slab/stair/wall cuts	create:cutting	create	M-04	ACCEPT	{'ACCEPT': 1}	a Create saw on the log/stone cuts means the whole builder's palette auto-produces on the Create spine — bulk material p
1	False	more_slabs_stairs_and_walls	concrete-powder / sand / gravel gravity cuts	create:crushing	create	M-04	ACCEPT	{'ACCEPT': 1}	crushed concrete-powder stairs → sand/gravel recycle; closes the loop on the gravity-block cuts without needing the play
1	False	more_slabs_stairs_and_walls	wood/log cut variants	create:milling	create	M-12	REJECT	{'REJECT': 1}	milling is for extracting material (sawdust / pulp); milling a finished decorative slab doesn't yield a coherent interme
1	False	mowziesmobs	mowziesmobs:blowgun / dart	create:crushing OR numismatics sell	create	M-09	REJECT	{'REJECT': 1}	The blowgun is a weapon used for combat; treating it as a trade-good luxury or crush-recycling target trivializes a uniq
1	False	mowziesmobs	Grottol (ore-eating mob / diamond drop)	numismatics bounty (M-14)	economy	M-14	REJECT	{'REJECT': 1}	M-14 is provisional and the maintainer leans no. The Grottol's diamond emission is already an in-world economy bonus (di
1	False	mowziesmobs	mowziesmobs:elokosa_paw_full / elokosa_paw_crescent (moon-phase drops, mid/endgame)	ars_nouveau:imbuement or occultism:ritual as moon-gated reagent	magic	M-22	ACCEPT	{'ACCEPT': 1}	the Elokosa is a moon-phase shapeshifter; its paw in the phase it was caught resonates with any moon-attuned ritual — th
1	False	mowziesmobs	mowziesmobs:earthrend_gauntlet (Wroughtnaut drop — unbreakable axe)	ars_nouveau:imbuement	magic	M-10	REJECT	{'REJECT': 1}	the earthrend gauntlet is a melee weapon, not a raw material; routing a finished weapon into an imbuement step is a forc
1	False	mowziesmobs	mowziesmobs wrought-metal / earthrend_gauntlet materials (Wroughtnaut drop)	create:sequenced_assembly (as M-06 gate)	create	M-15	ACCEPT	{'ACCEPT': 1}	Ferrous Wroughtnaut is a metal giant — his wrought-iron drop gating advanced Create metalwork is thematically read-at-a-
1	False	mowziesmobs	mowziesmobs:dart / blowgun (low-tier everyday weapon)	numismatics M-14 bounty	economy	M-14	REJECT	{'REJECT': 1}	Darts/blowguns are weapons, not mob drops — M-14 requires a bounty-board consuming mob drops and paying coin. The drop /
1	False	mowziesmobs	mowziesmobs:sol_visage / earthrend_gauntlet	create:sequenced_assembly	create	M-15	ACCEPT	{'ACCEPT': 1}	boss-artifact as the literal unlock piece for a complex tech recipe — "you fought Barako; now you can build the [device]
1	False	mowziesmobs	mowziesmobs boss drops (ice_crystal / sol_visage)	occultism:spirit_fire	magic	M-11	REJECT	{'REJECT': 1}	power-read says these are prestigious endgame artifacts (unbreakable gear), not bulk reagents; using them as ritual tran
1	False	mowziesmobs	mowziesmobs:earthrend_gauntlet or wrought-helm (Wroughtnaut drop, iron/forge theme)	create:sequenced_assembly	create	M-05	ACCEPT	{'ACCEPT': 1}	the Wroughtnaut's forged artifact is a keystone input for a high-tier metalworking Create machine — a smith's boss gate 
1	True	mowziesmobs	ice_crystal / wrought-metal boss drops	create:sequenced_assembly (boss drop as keystone input)	create	M-15	ACCEPT	{'ACCEPT': 1}	the Wroughtnaut's axe-metal and the Frostmaw's ice crystal are exactly the boss-key the pack wants gating high Create te
1	True	mowziesmobs	sol_visage / ice_crystal artifacts	occultism:spirit_fire or ars_nouveau:imbuement (transmute artifact → magic catalyst)	magic	M-11	ACCEPT	{'ACCEPT': 1}	a mythic mask/ice shard is a natural arcane catalyst; sinks a non-renewable artifact into the magic spine without compet
1	True	mowziesmobs	rare boss kills / drops	numismatics bounty payout	economy	M-15	REJECT	{'REJECT': 1}	these drops are too scarce/non-renewable to anchor a coin loop; a bounty on a once-per-spawn boss is thin, and the M-06 
1	False	mowziesmobs	mowziesmobs:captured_grottol (rare ore-eating mob — drops diamonds)	occultism:spirit_fire	magic	M-11	ACCEPT	{'ACCEPT': 1}	a captured Grottol that eats ores is a living transmutation engine — burning it in spirit fire to yield a concentrated e
1	True	mowziesmobs	boss-drop artifacts (ice_crystal, wrought helm/axe metal, earthrend_gauntlet)	create:sequenced_assembly / item_application (boss drop as keystone)	create	M-15	ACCEPT	{'ACCEPT': 1}	matches the pack's "complex Create tech unlocks via boss drops" north star — a Mowzie's artifact as the keystone input t
1	True	mowziesmobs	Grottol diamond/gem drops	create:crushing or numismatics	create	M-03	REJECT	{'REJECT': 1}	Grottol just emits vanilla diamonds; processing vanilla diamonds isn't a Mowzie-specific weave and adds nothing distinct
1	False	mowziesmobs	mowziesmobs boss drops (ice_crystal / sol_visage)	ars_nouveau:imbuement	magic	M-10	ACCEPT	{'ACCEPT': 1}	Infusing a boss artifact in the Ars apparatus attunes its primal energy — solar or glacial — into a high-tier source len
1	False	mowziesmobs	mowziesmobs boss drops	numismatics sell	economy	M-09	REJECT	{'REJECT': 1}	M-14 bounty-board already covers the combat→economy path; adding a plain coin-sell on top is redundant and weakens the b
1	False	mushroomquest	mushroomquest:resin_orb	ars_nouveau:imbuement	magic	M-10	REJECT	{'REJECT': 1}	Resin orb is a worldgen/atmospheric block item; the dossier doesn't identify it as a drops-type reagent or flag it as ef
1	False	mushroomquest	mushroomquest rare/mythical caps (agarikon, angels_wing, etc.)	farmersdelight:cooking or extradelight:oven/vat	survival	M-12	ACCEPT	{'ACCEPT': 1}	rare foraged mushrooms roasted or braised into buffet dishes that fuel the diminishing-returns food loop (pairs with sol
1	False	mushroomquest	rare/mythical mushroom caps (effect-bearing)	farmersdelight:cooking (cooking_pot)	economy	M-12	ACCEPT	{'ACCEPT': 1}	the forager processes rare caps into tinctures/soups worth selling — the kitchen is the bridge between finding and tradi
1	False	mushroomquest	everyday mushroom (edible caps)	farmersdelight:cooking	survival	M-12	ACCEPT	{'ACCEPT': 1}	run foraged mushrooms through Farmer's Delight cooking to produce variety meals; the two mod systems already share the s
1	False	mushroomquest	mushroomquest:resin_orb / deadly effect caps	occultism:spirit_fire or ars_nouveau:imbuement	magic	M-11	REJECT	{'REJECT': 1}	the dossier flags this WEAK; resin_orb is not confirmed to have effect relevance to magic rituals; the cooking/economy w
1	False	mushroomquest		extradelight:mortar (grind into potion-component paste) → irons_spellbooks:alchemist_cauldron_brew	magic	M-10	ACCEPT	{'ACCEPT': 2}	grinding toxic or hallucinogenic caps in the mortar then brewing the extract in the alchemist's cauldron converts a fora
1	False	mushroomquest		create:milling	create	M-12	ACCEPT	{'ACCEPT': 1}	milling glowing caps yields a luminescent dust (bioluminescent pigment) usable as a crafting reagent — thematic, low-ste
1	False	mushroomquest	mushroomquest:miso_soup_block / prepared mushroom dishes (high-saturation)	numismatics sell	economy	M-09	ACCEPT	{'ACCEPT': 1}	a "mushroom forager" specialty — players who invest in biome-specific foraging sell premium broths and rare-cap dishes f
1	False	mushroomquest	mushroomquest rare caps with seasonal/biome-specific spawning	season-gated spawn (Serene Seasons config/worldgen)	create	M-16	ACCEPT	{'ACCEPT': 1}	only-in-autumn foraging for specific caps that feed a seasonal ritual or Create recipe deepens the seasonal economy; mus
1	True	mutantszombies	mutant variants	bountiful board → numismatics / M-02 reagent sink	magic	M-14	REJECT	{'REJECT': 1}	deliberately vanilla-style mob mod — spawn eggs only, loot=no, no item drops. There is no material to route. A bounty ed
1	False	mutantszombies	mutant zombie variants	loot-seed	economy	M-14	ACCEPT	{'ACCEPT': 1}	bounty boards post contracts for mutant-variant kills — these tougher zombies are a distinct threat tier that earns coin
1	False	mutantszombies	mutant zombie variants	loot-seed	magic	M-02	ACCEPT	{'ACCEPT': 1}	add a rare drop (mutated flesh / biotic reagent) to the mutant brute/rotten mutant loot tables — Occultism spirit-fire o
1	False	mutantszombies	mutant zombie variants	loot-seed	create	M-15	REJECT	{'REJECT': 1}	zombie variants are not thematically a gate to engineering/mechanical progression; a boss-key to a Create machine from z
1	False	naturalist	naturalist:venison / naturalist:bushmeat	farmersdelight:cutting + farmersdelight:cooking	survival	M-12	ACCEPT	{'ACCEPT': 1}	raw venison through a cutting board → venison steak/strips/stew; the FD processing chain is the natural home for wild ga
1	False	naturalist	naturalist:cooked venison / naturalist:cooked_bushmeat	numismatics sell	economy	M-09	ACCEPT	{'ACCEPT': 1}	game hunters sell premium wild-game cuts to colonist markets — venison is a huntable luxury that can't be farmed like ch
1	False	naturalist	naturalist:antler	ars_nouveau:enchanting_apparatus or occultism:spirit_fire	magic	M-02	ACCEPT	{'ACCEPT': 1}	a deer antler is a classic arcane component (bone-like, naturally shed, symbolically lunar); routing it as a catalyst or
1	False	naturalist	naturalist:antler	recipe (occultism:spirit_fire — bone-keratin analog burns into a spirit compound)	magic	M-11	ACCEPT	{'ACCEPT': 1}	a stag's shed antler holds latent life-force; the spirit flame renders it into raw essence
1	False	naturalist	naturalist:venison + naturalist:bushmeat	recipe (farmersdelight:cutting / cooking → food chain)	create	M-12	ACCEPT	{'ACCEPT': 1}	wild game goes from carcass to plate through the same kitchen tools as farmed meat — Farmer's Delight's cutting board pr
1	False	naturalist	naturalist:glow_goop	loot-seed (seeded into naturalist loot tables as a drop)	magic	M-02	REJECT	{'REJECT': 1}	glow_goop already drops directly from fireflies via mob death — it IS a mob-drop reagent natively. The M-02 action (loot
1	False	naturalist	naturalist:antler	ars_nouveau:imbuement	magic	M-10	ACCEPT	{'ACCEPT': 1}	a shed antler carries natural spiritual resonance; imbued into a nature-attuned arcane focus component — a deer-hunt pay
1	False	naturalist	naturalist:glow_goop (firefly drop)	occultism:spirit_fire	magic	M-11	ACCEPT	{'ACCEPT': 1}	distilled bioluminescence transmutes in spirit flame into a minor illumination essence — firefly hunting has a ritual pa
1	False	naturalist	naturalist:bushmeat (raw)	farmersdelight:cutting	survival	M-12	ACCEPT	{'ACCEPT': 1}	raw boar bushmeat on the cutting board yields strip cuts and lard, extending the food-processing web with wild-game butc
1	False	naturescompass	naturescompass:naturescompass (the compass item itself)	create:mechanical_crafting (gate the compass construction behind a Create recipe using precision_mechanism, giving the tech-pillar something useful to build)	create	M-05	ACCEPT	{'ACCEPT': 1}	precision mechanism + compass → Nature's Compass; in a scarcity-driven pack, a biome-hunting tool that helps players fin
1	False	netmusic	netmusic:music_cd (craftable, loot=yes)	recipe — route cd_burner/computer through Create brass components as crafting inputs	create	M-05	ACCEPT	{'ACCEPT': 1}	a network-capable music computer needs precision gears and brass — workshop-tier tech to build a speaker system; keeps i
1	False	netmusic	netmusic:music_player_backpack	recipe — require a travelersbackpack:backpack_upgrade step	survival		REJECT	{'REJECT': 1}	no-motif — the Travelers Backpack upgrade path is a different mod's internal mechanic, not a pack-level motif; this woul
1	False	netmusic	netmusic:music_cd (craftable NBT audio disc)	recipe (crafting)	economy	M-09	REJECT	{'REJECT': 1}	The CD's value is purely cosmetic audio; treating it as a "luxury good" mintable into coin is contrived — the player ear
1	False	northstar	northstar:astronomical_reading (a "read" of celestial/planet positions)	ars_nouveau:enchanting_apparatus or occultism:ritual	magic	M-22	ACCEPT	{'ACCEPT': 1}	an astronomy reading is literally a record of celestial alignment — feeding it as a catalyst into a lunar ritual or star
1	False	northstar	northstar:titanium_ingot / northstar:martian_steel_ingot	recipe (aeronautics airframe/hull ingredient)	aeronautics	M-23	ACCEPT	{'ACCEPT': 1}	martian steel is the logical high-tier hull material for advanced ship frames — you go to space to get the metal that le
1	False	northstar	northstar:astronomical_reading	config or loot-seed (rare drop in structure chests hinting at planet locations)	survival	M-22	REJECT	{'REJECT': 1}	astronomical_reading as exploration loot fits flavour but no current motif covers "exploration document as loot drop"; f
1	False	northstar	northstar:tungsten_ingot (c:ingots/tungsten)	recipe (numismatics mint, create:pressing → coin)	economy	M-08	ACCEPT	{'ACCEPT': 1}	Tungsten from Mars/Moon is a scarcer metal than overworld iron; minting it adds a specialist currency tier for the off-w
1	False	numismatics	numismatics:vendor / depositor blocks	recipe — create:mechanical_crafting / create:pressing	create	M-05	REJECT	{'REJECT': 1}	numismatics blocks are already Create-styled and made via vanilla crafting with Create materials; gating them behind mec
1	False	numismatics	numismatics:vendor / depositor	config tie	create	M-08	REJECT	{'REJECT': 1}	no new weave needed — the existing anchors already cover Create (vendor/depositor are Create-flavored, crafted via Creat
1	False	numismatics	numismatics:blaze_banker / bank_terminal	loot-table seeding	survival		REJECT	{'REJECT': 1}	seeding bank cards into dungeon chests is cute but fits no current motif (no M covers "economy object as loot"); mark no
1	False	occultengineering	occultengineering:spirit_solution	ars_nouveau:imbuement (arcane conversion)	magic	M-10	REJECT	{'REJECT': 1}	spirit_solution is reserved as the Occultism-side intermediate (M-11); cross-wiring it into Ars imbuement would double-s
1	False	occultengineering		numismatics mint	economy	M-08	REJECT	{'REJECT': 1}	sterling_silver is also occultism's primary ritual reagent; minting it to coin risks soft-locking ritual progression if 
1	False	occultengineering	occultengineering:mechanical_pulverizer (mid-game automation block)	create:sequenced_assembly	create	M-06	REJECT	{'REJECT': 1}	The pulverizer is already assembled via inbound Create methods (create:pressing/item_application etc.) at appropriate de
1	False	occultengineering	occultengineering:spirit_solution	occultism:ritual or ars_nouveau:imbuement	magic	M-11	REJECT	{'REJECT': 1}	spirit_solution is the RESERVED reagent already owned by M-11 (reagent-ownership table); it's already the established oc
1	False	occultengineering	occultengineering:phlogiport (wireless logistics)	config/recipe	economy		REJECT	{'REJECT': 1}	phlogiports are a logistics device, not a tradeable commodity or economy input; no motif maps "item-teleporter → economy
1	False	occultengineering	occultengineering:phlogiport (wireless logistics block)	minecolonies colony supply unlock	create	M-15	REJECT	{'REJECT': 1}	phlogiport is a logistics infrastructure piece, not a boss drop; M-15 requires a boss-key drop as gate item. Tone mismat
1	False	occultism	occultism:silver_ingot (real silver, c:ingots/silver)	numismatics mint	economy	M-08	ACCEPT	{'ACCEPT': 1}	Real silver from Occultism's dimensional mines is the pack's scarce precious metal — minting it into coin makes the spir
1	False	occultism	occultism:afrit_essence / djinni_essence / foliot_essence / marid_essence	ars_nouveau:imbuement (spirit essences as catalysts for imbuement tiers)	magic	M-01	ACCEPT	{'ACCEPT': 1}	Spirit essences as power-tier catalysts for Ars imbuement — Occultism and Ars speak the same "arcane energy" language; a
1	False	occultism	occultism:iesnium_ingot	create:haunting (iesnium soul-fire transmutation — the otherworld metal passes through soul-fire and gains a spirit charge)	create	M-19	ACCEPT	{'ACCEPT': 1}	Iesnium is already an otherworld metal with elemental resonance — running it through Create's haunting (soul-fire) to un
1	False	occultism	mob drops (any c:tags mob drop)	occultism:spirit_fire → essences	magic	M-11	ACCEPT	{'ACCEPT': 1}	Spirit fire as the universal mob-drop transmuter — every enemy that dies near a pentacle can contribute to the magic web
1	False	occultism	occultism:spirit_trade (summoned merchant spirit)	numismatics coin as trade currency	economy	M-21	ACCEPT	{'ACCEPT': 1}	A spirit-trader who accepts and pays in coin rather than arbitrary item barter — Occultism's otherworld commerce becomes
1	False	occultism	occultism:iesnium_ingot (rare otherworld ore)	recipe (create:crushing)	create	M-03	ACCEPT	{'ACCEPT': 1}	crushing iesnium ore doubles yield — the rare otherworld metal earns a Create-ore-processing bonus, pulling players towa
1	False	occultism	mob/boss drops (afrit/djinni essences, otherworld drops)	occultism:spirit_trade	economy	M-18	ACCEPT	{'ACCEPT': 1}	a summoned spirit-merchant deals otherworld goods for coin — demon labor becomes a logistics arm of the player economy.
1	False	occultism	occultism:spirit_trade	trade (occultism:spirit_trade)	economy	M-09	ACCEPT	{'ACCEPT': 1}	Summoned trader spirits deal in otherworld reagents at coin value — binding demon commerce to the pack's trade pillar so
1	False	occultism	occultism:iesnium_ingot (rare otherworld metal)	recipe (create:sequenced_assembly)	create	M-06	ACCEPT	{'ACCEPT': 1}	Iesnium, a metal drawn from a pocket void dimension by a bound Djinni, is exotic enough to be an endgame sequenced-assem
1	False	occultism	occultism:dimensional_mineshaft (passive ore logistics)	config	create	M-18	ACCEPT	{'ACCEPT': 1}	Dimensional miner spirits acquire scarce regional ores that are too deep or too sparse to mine by hand — magic as a logi
1	True	oceansdelight	high-effort seafood dishes (elder_guardian_roll, cabbage_wrapped_elder_guardian, fugu_roll/fugu_slice, bowl_of_guardian_soup)	numismatics sell/price	economy	M-09	ACCEPT	{'ACCEPT': 1}	a coastal cook far from the spawn ocean turns a risky elder-guardian/pufferfish dish into coin — the seaside specialist'
1	True	oceansdelight	everyday cod/salmon/sea-pickle dishes (braised_sea_pickle, cooked_stuffed_cod, baked_tentacle_on_a_stick)	numismatics sell	economy	M-09	REJECT	{'REJECT': 1}	balance — these are cheap, spammable FD plates off common drops; pricing them makes seafood a flat money printer and und
1	True	oceansdelight	raw guardian flesh / cut_tentacles	numismatics sell of the raw drop	economy	M-12	REJECT	{'REJECT': 1}	theme — selling raw mob flesh for coin is the generic "vendor-trash" pattern the pack avoids; the value should come from
