times_suggested	from_opus	mod	from	via	to_pillar	motif	consensus	verdicts	hook
2	False	kobolds	kobolds:kobold_skull	occultism:spirit_fire (M-11)	magic	M-11	ACCEPT	{'ACCEPT': 2}	kobolds are an underground folk with a distinct life-force; burning a kobold skull in spirit fire transmutes it into a s
2	False	mcwdoors	mcwdoors iron/metal door variants	create:crushing	create	M-04	ACCEPT	{'ACCEPT': 2, 'REJECT': 1}	a demolition grinder reduces an unwanted iron door back to scrap — sensible workshop recycle, lossy
2	False	mcwroofs	mcwroofs stone/brick/andesite roof variants	create:crushing	create	M-04	ACCEPT	{'ACCEPT': 2, 'REJECT': 2}	misplaced stone-roof blocks can be salvaged back to gravel and an XP nugget in the Crushing Wheels — the standard Create
2	False	mcwstairs	mcwstairs stone/brick/blackstone stair variants	create:crushing	create	M-04	ACCEPT	{'ACCEPT': 2, 'REJECT': 2}	Architectural stone stairs crush back to gravel + xp nugget (lossy recycling); consistent with how every other stone-fam
2	False	meadow	meadow:alpine_salt	extradelight:evaporator	survival	M-12	ACCEPT	{'ACCEPT': 1, 'REJECT': 1}	Salt brine evaporated in Extra Delight's Evaporator yields refined salt crystals — a processing-chain pull that makes sa
2	False	minecolonies	minecolonies:composting (hut composter)	minecolonies:composting → create:mixing (compost as Create fertiliser mixing input)	create	M-12	ACCEPT	{'ACCEPT': 2}	colony compost is a low-value organic output; feeding it as an ingredient into Create mixing to produce a richer soil am
2	True	minecolonies	colony-produced food/luxury goods (apple_pie, baked_salmon, c:foods/* breads/soups/vegetables)	numismatics sell/price	economy	M-09	ACCEPT	{'ACCEPT': 2}	a self-running colony is a natural production engine — its surplus bread/pie/soup is the obvious sellable trade good, gi
2	False	minecolonies_tweaks	c:crops/* unified tags (corn, rice, soybean, tomato, etc.)	create:milling	create	M-12	ACCEPT	{'ACCEPT': 2}	the minecolonies_tweaks unified crop tags mean a single Create milling recipe covers ALL modded grain variants — the tag
2	False	moblassos	moblassos:emerald_lasso (villager capture)	theme — relocating villagers to MineColonies worksites or Aeronautics ships	economy		REJECT	{'REJECT': 2}	utility synergy only; no method to route through; no material changes hands — a lasso is a transport tool, not a recipe 
2	False	moblassos	moblassos:hostile_lasso (captured monster at <50% HP)	`occultism:ritual` — hostile mob in captivity as a live sacrifice input	magic	M-11	REJECT	{'REJECT': 2}	Occultism rituals consume *drops*, not living entities; hostile_lasso_filled is a container item, not a drop, and the ri
2	False	modulargolems	Ars Nouveau source_gem or Occultism otherstone	ars_nouveau:imbuement / occultism:ritual into golem_add_slot upgrade	magic	M-10	REJECT	{'REJECT': 2}	modulargolems is explicitly an industrial/metallic construct mod; adding arcane infusion on top of the existing Create-a
2	False	modulargolems	golem body (boss-metal tier — dragonsteel, cursium)	modulargolems:golem_assemble consuming boss-drop material	survival	M-02	ACCEPT	{'ACCEPT': 2}	the best golem shells are forged from what you pry out of Cataclysm and Ice&Fire bosses — golemancy rewards exploration-
2	False	modulargolems	modulargolems golem body (boss/mid metal: Cataclysm cursium / Ice&Fire dragonsteel)	modulargolems:golem_assemble gated on boss drop	survival	M-15	ACCEPT	{'ACCEPT': 2}	A cursium-body golem (Cataclysm boss metal) requires the boss's signature drop as the golem core — defeating the boss ea
2	False	modulargolems	modulargolems golem assembly (all tiers)	create:sequenced_assembly (already in use by this mod's recipes)	create	M-06	REJECT	{'REJECT': 2}	The dossier already anchors this mod to Create (it uses create:crushing, create:mechanical_crafting, create:sequenced_as
2	False	modulargolems	golem assembly requiring boss-drop metals (Cataclysm cursium, Ice&Fire dragonsteel)	modulargolems:golem_assemble (with M-15 boss-gating)	survival	M-15	ACCEPT	{'ACCEPT': 2}	the best golem bodies demand metals from boss kills — the combat boss is the key to the top-tier automaton; players who 
2	False	mowziesmobs	mowziesmobs:earthrend_gauntlet (endgame Wroughtnaut boss drop)	create:sequenced_assembly as boss-key gate	create	M-15	ACCEPT	{'ACCEPT': 2}	the Wroughtnaut is an iron-golem-scale forge construct; its gauntlet as a key component in a high-tier Create mechanical
2	False	mowziesmobs	mowziesmobs:ice_crystal (endgame, non-renewable boss drop)	occultism:spirit_fire → frost essence	magic	M-11	REJECT	{'REJECT': 1, 'ACCEPT': 1}	ice_crystal is already used as a boss-key gate (M-15 above). Repurposing it as a consumable ritual reagent burns a uniqu
2	False	mowziesmobs	mowziesmobs:sol_visage (Barako drop)	ars_nouveau:imbuement or occultism:ritual — the Sun Mask as a magic catalyst / ritual component, given its solar power theme	magic	M-11	ACCEPT	{'ACCEPT': 2}	Barako's Sol Visage is more than a mask — placed in an occultism ritual, it channels solar power into a source amplifier
2	False	mowziesmobs	mowziesmobs:earthrend_gauntlet / wrought helm (Wroughtnaut unbreakable artifacts, non-renewable)	occultism:spirit_fire or ars_nouveau:imbuement — transmute artifact material into a rare magic catalyst	magic	M-11	ACCEPT	{'ACCEPT': 2}	Unbreakable relics from an ancient iron guardian have obvious magical significance; distilling one into an occult cataly
2	False	mowziesmobs	mowziesmobs:ice_crystal	ars_nouveau:imbuement	magic	M-10	ACCEPT	{'ACCEPT': 2}	ice crystal attuned through Ars imbuement yields a frost-magic focus — a player investing in magic instead of Create get
2	True	mowziesmobs	boss artifacts (sol_visage, ice_crystal)	occultism:spirit_fire	magic	M-11	ACCEPT	{'ACCEPT': 2}	transmuting a mythic tribal artefact into an occult essence via spirit-fire makes the drops dual-use — combat progressio
2	False	mushroomquest	rare/mythical mushroom caps (e.g. agarikon, mythical-tier caps)	farmersdelight:cooking OR extradelight:oven / melting_pot	create	M-12	ACCEPT	{'ACCEPT': 2}	Foraged mushrooms are raw ingredients crying out for a cooking station; running the rare caps through Farmer's Delight p
2	False	mushroomquest	rare/mythical mushroom caps (endgame tier: agarikon, bay bolete, etc.)	numismatics sell/price	economy	M-09	ACCEPT	{'ACCEPT': 2}	a specialist forager sells rare foraged caps as luxury goods — low-floor income, high ceiling on mythicals; coherent wit
2	False	mushroomquest	mushroomquest rare/mythical mushroom caps	farmersdelight:cooking / extradelight:oven	economy	M-12	ACCEPT	{'ACCEPT': 2}	a morel or agarikon simmered into a gourmet dish commands a real coin price — forager becomes supplier
2	False	naturalist	naturalist:glow_goop	ars_nouveau:imbuement	magic	M-10	ACCEPT	{'ACCEPT': 2}	firefly bioluminescence refined into a glowing arcane reagent — a light-magic attunement input; thematically the stronge
2	False	naturalist	naturalist:antler	create:milling	create	M-12	REJECT	{'REJECT': 2}	milling an antler to bone meal is mechanically possible (M-12 processing chain) but antler-as-bone-meal is a step down f
2	False	naturalist	naturalist:venison / naturalist:bushmeat (cooked)	trade (numismatics sell — butcher-type price)	economy	M-09	ACCEPT	{'ACCEPT': 2}	hunters sell wild game at the market; venison fetches a coin or two from any player who can't farm it
2	False	northstar	northstar:martian_steel_ingot	aeronautics construction recipe (M-23)	aeronautics	M-23	ACCEPT	{'ACCEPT': 2}	martian steel is explicitly a structural alloy (name implies load-bearing metallurgy); using it in top-tier Aeronautics 
2	False	northstar	northstar:advanced_circuit	recipe (aeronautics control surface / navigation computer ingredient)	aeronautics	M-24	ACCEPT	{'ACCEPT': 2}	a ship's autopilot/nav system running on northstar circuits ties the space tech tier directly into the aeronautics drive
2	False	occultengineering	occultengineering:spirit_solution (reserved occult intermediate)	occultism:spirit_trade	economy	M-18	ACCEPT	{'ACCEPT': 1, 'REJECT': 1}	Summoned spirits brokering spirit_solution as a logistics/trade good is the natural extension of M-18 — magic-as-acquisi
2	False	occultism	occultism:silver_ingot (real silver, c:ingots/silver)	recipe (create:crushing)	create	M-03	ACCEPT	{'ACCEPT': 2}	Occultism's true silver through crushing wheels yields double — incentivizes Create-processing over vanilla smelting for
2	False	occultism	foreign mob drops (any c:tag mob drop)	occultism:spirit_fire	magic	M-11	ACCEPT	{'ACCEPT': 2}	dropping a common mob trophy into spirit fire transmutes it into a foliot/djinni essence — every fight feeds the ritual 
2	False	occultism	occultism:datura (crop)	recipe (ars_nouveau:imbuement)	magic	M-10	ACCEPT	{'ACCEPT': 2}	datura's hallucinogenic character fits infusion into an arcane reagent — a natural bridge between Occultism's herbalism 
2	True	oceansdelight	oceansdelight elder_guardian_roll / fugu_slice (finished dishes)	numismatics vendor/price	economy	M-09	ACCEPT	{'ACCEPT': 2}	a coastal cook's showpieces — an elder-guardian roll costs a monument raid, fugu costs nerve — so they're high-effort lu
2	False	oceansdelight	oceansdelight:cooked_stuffed_squid	extradelight:vat (brine/salt liquid step)	create	M-12	REJECT	{'REJECT': 1, 'ACCEPT': 1}	plausible flavor but extradelight:vat is not confirmed to produce a useful *intermediate* here — the output is a finishe
2	False	pantographsandwires	pantographsandwires:coal_coke (c:item/dusts/coal_coke, c:item/ingots/graphite)	tfmg:coking	create	M-12	ACCEPT	{'ACCEPT': 2}	Coke is the backbone of industrial steelmaking — coal_coke produced by pantographs feeds TFMG's coking furnace, tying ov
2	False	railways	railways:benchcart / semaphore (logistics infrastructure)	numismatics (train-line as trade/commerce route flavor — selling logistics services)	economy	M-21	REJECT	{'REJECT': 2}	M-21 is provisional/leans-no; and there's no clean item-routing here, just a thematic flavor argument. No coherent metho
2	False	rottencreatures	rottencreatures:corrupted_wart	occultism:spirit_fire	magic	M-11	ACCEPT	{'ACCEPT': 2}	a corrupted undead plant-wart transmuting into a dark essence through spirit fire is exactly the "kill-loot → arcane inp
2	False	rottencreatures	rottencreatures themed drops (frozen/magma flesh)	create:haunting	create	M-19	REJECT	{'REJECT': 1, 'ACCEPT': 1}	haunting turns items into soul/spirit outputs via soul-fire; frozen flesh → haunting makes thematic sense but the M-19 s
2	False	rottencreatures	rottencreatures:frozen_rotten_flesh	create:crushing	create	M-02	REJECT	{'REJECT': 2}	crushing rotten flesh is mechanically coherent but the output would be trivially cheap bone meal / gravel — no meaningfu
2	False	s_a_b	s_a_b:hardsteelblock (hard armor plate)	create:sequenced_assembly	aeronautics	M-23	ACCEPT	{'ACCEPT': 2}	the toughest armor plating requires a sequenced fabrication pass — it doesn't spring out of a mixing bowl, it's assemble
2	False	samurai_dynasty	samurai_dynasty:steel_block / steel ingots (c:ingots/steel)	create:crushing / create:mixing	create	M-03	ACCEPT	{'ACCEPT': 2}	Steel is an intermediate alloy; routing it through Create's mixing (or crushing ore → alloy) makes the Samurai Dynasty s
2	False	samurai_dynasty	samurai_dynasty Yokai drops (akaname_tongue, enenra ash or drop, etc.)	occultism:spirit_fire OR ars_nouveau:imbuement	magic	M-02	ACCEPT	{'ACCEPT': 2}	Yokai are supernatural spirits in the folklore canon; their dropped reagents (a demon's tongue, a smoke-wraith's essence
2	False	samurai_dynasty	samurai_dynasty:jade / jade_ore (c:gems/jade, c:ores/jade)	create:crushing	create	M-03	ACCEPT	{'ACCEPT': 2}	jade seams crushed for double yield — the samurai's gem enters the industrial web.
2	False	samurai_dynasty	samurai_dynasty:ruby_ore / aquamarine_ore / onyx_ore	create:crushing	create	M-03	ACCEPT	{'ACCEPT': 2}	four new gem ores become part of the Create ore-processing chain — exploration rewards the machine.
2	False	samurai_dynasty	samurai_dynasty:steel_ingot (c:ingots/steel, processed alloy)	numismatics mint	economy	M-08	ACCEPT	{'ACCEPT': 1, 'REJECT': 1}	the blacksmith's steel becomes a coin-economy metal — the forge feeds trade. NOTE: samurai_dynasty steel shares c:ingots
2	True	samurai_dynasty	samurai_dynasty steel ingot (c:ingots/steel)	create:crushing or create:pressing (into steel sheet, feeding the metal web)	create	M-03	REJECT	{'REJECT': 1, 'ACCEPT': 1}	already captured by the jade/onyx ore-doubling row above (same motif, same mod — one row per motif is enough; steel tags
2	False	samurai_dynasty	samurai_dynasty Yokai drops (akaname_tongue, etc.)	occultism:spirit_fire	magic	M-11	ACCEPT	{'ACCEPT': 2}	Yokai are spirit-world creatures in Japanese folklore — an akaname tongue or oni essence transmuting through spirit fire
2	False	samurai_dynasty	samurai_dynasty Immortal drop (storm-lich / boss-tier)	boss-key gate	create	M-15	REJECT	{'REJECT': 1, 'ACCEPT': 1}	the Immortal is a thunderstorm-spawned event mob, not a designated boss with a documented unique signature drop in the d
2	False	samurai_dynasty	jade gems (c:gems/jade)	ars_nouveau:imbuement	magic	M-10	REJECT	{'REJECT': 2}	jade already has a Create ore-doubling route (M-03); adding an arcane infusion path would create a double-spend on the m
2	False	samurai_dynasty	`samurai_dynasty:akaname_tongue` / Yokai drops	`ars_nouveau:imbuement`	magic	M-10	ACCEPT	{'ACCEPT': 2}	Ars Nouveau draws power from exotic creatures; Yokai drop essence as a natural imbuement input — the folklore resonance 
2	False	securitycraft	securitycraft reinforcing materials (scarce modded metals → reinforced blocks)	create:mechanical_crafting (gate the Universal Block Reinforcer's assembly behind a Create-made component)	create	M-05	ACCEPT	{'ACCEPT': 2}	Reinforcing a block to be unbreakable-by-others should demand more than a crafting table — a Create-fabricated reinforce
2	False	simplehats	simplehats rare hats (rarer grab-bag drops)	numismatics sell/trade table	economy	M-09	ACCEPT	{'ACCEPT': 2}	rare cosmetic hats become luxury vanity goods a player can buy or sell for coin — gives the coin economy a collectible/c
2	False	simplehats	simplehats rare hats sold for coin	trade (numismatics)	economy	M-21	REJECT	{'REJECT': 2}	M-21 is provisional (leans no); the M-09 luxury-good sell is sufficient and is the accepted motif — adding M-21 on top i
2	True	sky_whale_ship	whale-structure loot	loot-table → aeronautics destination	aeronautics	M-15	ACCEPT	{'ACCEPT': 2}	sky whales are the natural destination for an Aeronautics airship expedition — seeding their loot with Create Aeronautic
2	True	sky_whale_ship	whale loot rarities	numismatics sell / bounty	economy	M-09	REJECT	{'REJECT': 2}	weaker overlap with the aeronautics loot routing above; a tradable-rarity edge double-uses the same single loot source a
2	False	sky_whale_ship	sky_whale_ship loot tables (onboard chests)	custom loot-table injection → aeronautics progression items (e.g. Create Aeronautics structural components, rare alloy blueprints)	aeronautics	M-23	ACCEPT	{'ACCEPT': 2}	You fly an airship up to the whale's back and the loot crates drop the hull alloys you came for — the sky whale is both 
2	False	sky_whale_ship	sky_whale loot tables	numismatics	economy	M-09	REJECT	{'REJECT': 2}	WEAK — the loot-table → coin path is generic and adds no distinct hook; the aeronautics seam (above) is the coherent 2nd
2	True	smokeleafindustries	hemp building blocks (hemp_planks/bricks)	create:crushing	create	M-04	REJECT	{'REJECT': 2}	M-04 is deco↔Create (crush back to raw/gravel+XP); hemp blocks qualify but the recycling loop is weak design motivation 
2	False	smokeleafindustries	smokeleafindustries:*_extract / *_gummy (refined strain products)	numismatics sell	economy	M-09	ACCEPT	{'ACCEPT': 2}	The mod ships its own dealer/stoner villager trades, proving the sell-loop concept natively; formalizing refined extract
2	False	smokeleafindustries	smokeleafindustries:hemp_crop / raw bud	create:milling	create	M-12	ACCEPT	{'ACCEPT': 1, 'REJECT': 1}	Routing raw hemp through the Create millstone as an alternate entry-tier grind (yielding hemp fiber / raw ground materia
2	True	smokeleafindustries	its FE machine network	createaddition:charging / FE↔kinetic bridge	create	M-17	ACCEPT	{'ACCEPT': 2}	it brings its own FE; bridging that to Create rotational power via Create Addition folds the isolated tech-farm island i
2	True	smokeleafindustries	generator burnable inputs	smokeleafindustries:generator accepting pack biomass/fuel	create	M-13	REJECT	{'REJECT': 2}	tone clash and reagent-ownership — TFMG diesel/gasoline are the reserved aeronautics propulsion fuels; routing weed-tech
2	False	snowyspirit	snowyspirit:ginger (c:crops/ginger)	recipe (create:milling)	create	M-12	ACCEPT	{'ACCEPT': 2}	milling dried ginger root into ground spice fits naturally on a Create millstone — a seasonal crop joins the food-proces
2	False	solclassic	solclassic food-variety penalty system (ambient rule — the bigger the food roster, the more diminishing returns push trading)	numismatics — food-variety pressure makes diverse cooked goods worth buying/selling; the economy pillar is exercised *through* solclassic's rule even though solclassic doesn't own a recipe	economy	M-09	REJECT	{'REJECT': 1, 'ACCEPT': 1}	this is a systemic amplifier, not a recipe-routing weave; M-09 already covers the food-to-economy connection via Farm & 
2	False	solonion	lunchbox (mid-tier container)	create:mechanical_crafting	create	M-05	REJECT	{'REJECT': 2}	mid-tier container doesn't merit complex recipe gating — basic/everyday guardrail; only the golden_lunchbox (endgame) is
2	False	solonion	solonion:golden_lunchbox	create:sequenced_assembly	create	M-06	ACCEPT	{'ACCEPT': 1, 'REJECT': 1}	the best auto-food carry item requiring a multi-stage Create chain feels right — it's gear, not groceries
2	False	spawn	clam meat / crab claw (mid seafood drops)	numismatics sell as exotic caught goods — aquatic catches sold for coin at a pier/market, giving ocean exploration an economic payoff	economy	M-09	ACCEPT	{'ACCEPT': 2}	a crab haul or a net-pulled pearl clam isn't just food — it's coin; seafood becomes the crew's most accessible trade com
2	False	spawn	spawn:crab / crab drops (cooked crab, crab claw)	farmersdelight:cooking + create:milling (shell → powder intermediate)	create	M-12	ACCEPT	{'ACCEPT': 2, 'REJECT': 1}	a crab claw goes from the sea floor to a Create-milled shell powder used in specialty cooking — the ocean feeds the mach
2	False	spawn	spawn:ant_pupa / ant colony byproducts	occultism:spirit_fire or ritual	magic	M-11	REJECT	{'REJECT': 2}	no coherent lore hook; forced organic→occult edge.
2	True	spawn	clam/crab/anglerfish seafood drops	create:milling / farmersdelight:cutting deeper into the meal-feast processing web	create	M-12	ACCEPT	{'ACCEPT': 2}	push the catch past raw FD into Create-milled seafood meals — fishing flows into the same processing web as the crops.
2	False	spawn	spawn:date_log / date_planks	create:crushing → M-04 recycle	create	M-04	REJECT	{'REJECT': 1, 'ACCEPT': 1}	M-04 (deco recycles) applies to metal/stone deco, not a wood set; crushing date logs back to raw wood is covered generic
2	False	spawn	spawn critter drops (ant_pupa, barnacle, seal drops)	occultism:spirit_fire	magic	M-11	ACCEPT	{'ACCEPT': 1, 'REJECT': 1}	ant pupae and barnacle chitin are the kind of strange organic material that spirit-fire transmutes into an essence; ties
2	False	supplementaries	supplementaries:ash (c:dusts/ash)	ars_nouveau:imbuement	magic	M-10	ACCEPT	{'ACCEPT': 2}	ash is a Create/haunting byproduct that could attune into a minor purification catalyst in Ars — players burning things 
2	False	t_and_t	t_and_t structures (conquest forts, outpost towers, ocean sail-ship)	could be loot tables seeding scarce economy goods for the aeronautics/logistics trade web	aeronautics		REJECT	{'REJECT': 2}	no registered method; purely a loot-table edit outside the mod's own mechanics; no-motif path
2	False	t_and_t	t_and_t village-structure loot tables / villager trades	numismatics sell/price	economy	M-09	ACCEPT	{'ACCEPT': 1, 'REJECT': 1}	16 biome-specific village variants are natural trade-hub anchors — wire their loot chests and merchant trades toward Num
2	False	tacz	tacz:ammo / tacz:modern_kinetic_gun	numismatics trade/sell	economy	M-09	ACCEPT	{'ACCEPT': 2}	Ammo is the consumable coin-sink of PvPvE — players sell surplus guns and buy cartridges, making the combat economy run 
2	False	tacz	tacz high-tier gun or endgame attachment	recipe (create:sequenced_assembly — multi-stage precision-machined assembly line)	create	M-06	ACCEPT	{'ACCEPT': 2}	a sniper-grade rifle isn't hand-assembled — it's a sequenced-assembly product, barrel + receiver + stock + optic rail, e
2	False	tfmg	tfmg:aluminum_ingot	create:crushing (ore-doubling byproduct via bauxite)	create	M-03	REJECT	{'REJECT': 2}	TFMG's aluminum already routes through Create methods (create:crushing/pressing/mechanical_crafting per the made-by list
2	True	tfmg	diesel / gasoline / LPG fuels	aeronautics engine/fuel intake	aeronautics	M-13	ACCEPT	{'ACCEPT': 2}	TFMG's Distillation Tower refines crude oil into the precise fuels that power Aeronautics combustion engines — airship p
2	True	tfmg	steel plate / structural steel	aeronautics airframe/hull construction recipe	aeronautics	M-23	ACCEPT	{'ACCEPT': 2}	TFMG steel is the pack's load-bearing structural metal; airframe hulls built from fabricated steel plates make ship cons
2	True	tfmg	refined steel + fuels	numismatics sell/price	economy	M-08	ACCEPT	{'ACCEPT': 2}	smelted steel and canned diesel/gasoline are high-effort processed scarcity — natural Numismatics trade goods for a play
2	True	tfmg	tfmg flamethrower/napalm weaponry	combat flavor	survival		REJECT	{'REJECT': 2}	combat isn't a pillar; weak flavor edge, no structural weave (dossier flags WEAK).
2	False	tide	tide fishing yields (generic)	bountiful board payout	economy	M-14	REJECT	{'REJECT': 1, 'ACCEPT': 1}	Rare-catch numismatics sale (M-09) already covers the economy vector cleanly; adding a second economy edge via M-14 boun
2	True	tide	tide season-locked catches (Serene Seasons-gated fish)	a season-gated input → Create/magic method	create	M-16	ACCEPT	{'ACCEPT': 2}	a fish you can only catch in one season, fed into a method, IS a seasonal reagent — M-16, which the design explicitly fl
2	False	tide	tide:abyss_angler or exotic fish	ars_nouveau:imbuement (M-10)	magic	M-10	REJECT	{'REJECT': 2}	Ars imbuement is better reserved for gem/crystal/essence materials; infusing a fish into a magic reagent crosses a tone 
2	False	trading_floor	`trading_floor:trading_depot`	MineColonies merchant hall + Numismatics coin loop	economy	M-21	REJECT	{'REJECT': 2}	M-21 is provisional (maintainer leans no); the trading_floor→Numismatics link is strong mechanically but the villager-tr
2	False	trailandtales_delight	trailandtales_delight:ancient_coffee	extradelight:vat or create:mixing	create	M-12	REJECT	{'REJECT': 1, 'ACCEPT': 1}	M-09 coin path already gives a strong 2nd pillar; adding a second Create route for the same item would create over-engin
2	False	trashcans	trashcans:ultimate_trash_can	create:mechanical_crafting	create	M-05	REJECT	{'REJECT': 2}	The trash can voids items — the pack is scarcity-driven and every byproduct should retain value; gating or weaving the v
2	False	travelersbackpack	travelersbackpack:blank_upgrade / tank_upgrade (upgrade modules)	create:pressing	create	M-20	REJECT	{'REJECT': 1, 'ACCEPT': 1}	the upgrade modules are mid-tier functional components — threading them through create:pressing is plausible but thin (p
2	False	travelersbackpack	netherite / dragon backpack (top-tier variants)	create:sequenced_assembly	create	M-06	ACCEPT	{'ACCEPT': 1, 'REJECT': 1}	the netherite pack is expedition-grade gear; a sequenced frame + casing earns it the same depth as other endgame Create 
2	False	trek-b0.6.1.1	trek structures (ship holds, pyramid chests, fortress rooms)	loot-seed	economy	M-08	ACCEPT	{'ACCEPT': 2}	rare-structure chests occasionally yield minted coin or Create components — exploration pays into the pack's currency lo
2	False	trek-b0.6.1.1	trek structures	loot-seed	create	M-15	REJECT	{'REJECT': 1, 'ACCEPT': 1}	M-15 is boss-drop gating; Trek has no bosses, only chest loot — forcing a boss-key role onto a generic loot table is an 
2	False	umapyoi	umapyoi:crystal_silver (lower-tier output)	recipe (numismatics sell)	economy	M-09	REJECT	{'REJECT': 2}	the gold/rainbow accept above already earns the economy pillar; adding silver-tier pricing too makes the sell-path trivi
2	False	underground_village	Stoneholm villager trades	bountiful board	economy	M-14	ACCEPT	{'ACCEPT': 1, 'REJECT': 1}	Stoneholm notice board offers coin bounties for clearing the tunnels nearby
2	False	underground_village	Stoneholm chest loot	loot-table insertion of a coin/reagent reward	economy		REJECT	{'REJECT': 2}	loot-table edits are datapack work, not a mod weave; the right approach is to note the datapack opportunity, not propose
2	False	undergroundworlds	undergroundworlds:desert_charm / antidote_flask (consumable charms)	numismatics sell	economy	M-09	REJECT	{'REJECT': 2}	charms are gear items, not consumable luxury goods — M-09 is for high-effort food/crafted consumables; selling combat ge
2	False	upgrade_aquatic	upgrade_aquatic raw fish (raw_pike / raw_perch / raw_lionfish)	farmersdelight:cutting	economy	M-12	ACCEPT	{'ACCEPT': 2}	a cutting board breaks a whole lionfish into fillets and spine-toxin scraps — now the fisherman specialist processes the
2	False	upgrade_aquatic	upgrade_aquatic coralstone blocks	create:crushing	create	M-04	REJECT	{'REJECT': 2}	deco-crush recycling is valid thematically but adds minimal gameplay value for an everyday building stone — borderline M
